{
  "id": "animal.mammoth",
  "name": "MAMMOTH",
  "status": "complete",
  "size_type_alignment": "Huge Beast, Unaligned",
  "size": "Huge",
  "creature_type": "Beast",
  "alignment": "Unaligned",
  "armor_class": 13,
  "hit_points": 126,
  "hit_dice": "11d12 + 55",
  "speed": "50 ft.",
  "abilities": {
    "STR": {
      "score": 24,
      "mod": "+7"
    },
    "DEX": {
      "score": 9,
      "mod": "-1"
    },
    "CON": {
      "score": 21,
      "mod": "+5"
    },
    "INT": {
      "score": 3,
      "mod": "-4"
    },
    "WIS": {
      "score": 11,
      "mod": "+0"
    },
    "CHA": {
      "score": 6,
      "mod": "-2"
    }
  },
  "saves": null,
  "skills": null,
  "resistances": null,
  "immunities": null,
  "vulnerabilities": null,
  "condition_immunities": null,
  "senses": "Passive Perception 10",
  "languages": "None",
  "cr": "6 (XP 2,300; PB +3)",
  "traits": [],
  "actions": [
    {
      "name": "Multiattack",
      "text": "The mammoth makes two Gore attacks."
    },
    {
      "name": "Gore",
      "text": "Melee Attack Roll: +10, reach 10 ft. Hit: 18 (2d10 + 7) Piercing damage. If the target is a Huge or smaller creature and the mammoth moved 20+ feet straight toward it immediately before the hit, the target has the"
    },
    {
      "name": "Prone condition",
      "text": ""
    }
  ],
  "bonus_actions": [
    {
      "name": "Trample",
      "text": "Dexterity Saving Throw: DC 18, one creature within 5 feet that has the Prone condition. Failure: 29 (4d10 + 7) Bludgeoning damage. Success: Half damage."
    }
  ],
  "reactions": [],
  "legendary_actions": [],
  "lair_actions": [],
  "regional_effects": [],
  "raw_text": "AC 13 \tInitiative +2 (12)\nHP 126 (11d12 + 55)\nSpeed 50 ft.\nMOD \tSAVE\nSTR \t24 \t+7 \t+10\nDEX \t9 \t−1 \t−1\nCON \t21 \t+5 \t+8\nMOD \tSAVE\nINT \t3 \t−4 \t−4\nWIS \t11 \t+0 \t+0\nCHA \t6 \t−2 \t−2\nSenses Passive Perception 10\nLanguages None\nCR 6 (XP 2,300; PB +3)\nActions\nMultiattack. The mammoth makes two Gore attacks.\nGore. Melee Attack Roll: +10, reach 10 ft.\nHit: 18 (2d10 + 7) Piercing damage.\nIf the target is a Huge or smaller creature and the mammoth moved\n20+ feet straight toward it immediately before the hit, the target has the\nProne condition.\nBonus Actions\nTrample. Dexterity Saving Throw: DC 18, one creature within 5 feet that has\nthe Prone condition.\nFailure: 29 (4d10 + 7) Bludgeoning damage.\nSuccess:\nHalf damage.\nHuge Beast, Unaligned",
  "sourceRef": {
    "file": "docs/sources/Monster Manual/Animals - Monster Manual - Dungeons & Dragons - Sources - D&D Beyond.pdf",
    "pages": [],
    "section": "Animals"
  },
  "notes": []
}
