{
  "id": "animal.boar",
  "name": "BOAR",
  "status": "complete",
  "size_type_alignment": "Medium Beast, Unaligned",
  "size": "Medium",
  "creature_type": "Beast",
  "alignment": "Unaligned",
  "armor_class": 11,
  "hit_points": 13,
  "hit_dice": "2d8 + 4",
  "speed": "40 ft.",
  "abilities": {
    "STR": {
      "score": 13,
      "mod": "+1"
    },
    "DEX": {
      "score": 11,
      "mod": "+0"
    },
    "CON": {
      "score": 14,
      "mod": "+2"
    },
    "INT": {
      "score": 2,
      "mod": "-4"
    },
    "WIS": {
      "score": 9,
      "mod": "-1"
    },
    "CHA": {
      "score": 5,
      "mod": "-3"
    }
  },
  "saves": null,
  "skills": null,
  "resistances": null,
  "immunities": null,
  "vulnerabilities": null,
  "condition_immunities": null,
  "senses": "Passive Perception 9",
  "languages": "None",
  "cr": "1/4 (XP 50; PB +2)",
  "traits": [
    {
      "name": "Bloodied Fury",
      "text": "While Bloodied, the boar has Advantage on attack rolls."
    }
  ],
  "actions": [
    {
      "name": "Gore",
      "text": "Melee Attack Roll: +3, reach 5 ft. Hit: 4 (1d6 + 1) Piercing damage. If the target is a Medium or smaller creature and the boar moved 20+ feet straight toward it immediately before the hit, the target takes an extra 3 (1d6) Piercing damage and has the Prone condition."
    }
  ],
  "bonus_actions": [],
  "reactions": [],
  "legendary_actions": [],
  "lair_actions": [],
  "regional_effects": [],
  "raw_text": "AC 11 \tInitiative +0 (10)\nHP 13 (2d8 + 4)\nSpeed 40 ft.\nMOD \tSAVE\nSTR \t13 \t+1 \t+1\nDEX \t11 \t+0 \t+0\nCON \t14 \t+2 \t+2\nMOD \tSAVE\nINT \t2 \t−4 \t−4\nWIS \t9 \t−1 \t−1\nCHA \t5 \t−3 \t−3\nSenses Passive Perception 9\nLanguages None\nCR 1/4 (XP 50; PB +2)\nTraits\nBloodied Fury. While Bloodied, the boar has Advantage on attack rolls.\nActions\nGore. Melee Attack Roll: +3, reach 5 ft.\nHit: 4 (1d6 + 1) Piercing damage. If the\ntarget is a Medium or smaller creature and the boar moved 20+ feet straight\ntoward it immediately before the hit, the target takes an extra 3 (1d6) Piercing\ndamage and has the Prone condition.\nMedium Beast, Unaligned",
  "sourceRef": {
    "file": "docs/sources/Monster Manual/Animals - Monster Manual - Dungeons & Dragons - Sources - D&D Beyond.pdf",
    "pages": [],
    "section": "Animals"
  },
  "notes": []
}
