{
  "id": "animal.giant_boar",
  "name": "GIANT BOAR",
  "status": "complete",
  "size_type_alignment": "Large Beast, Unaligned",
  "size": "Large",
  "creature_type": "Beast",
  "alignment": "Unaligned",
  "armor_class": 13,
  "hit_points": 42,
  "hit_dice": "5d10 + 15",
  "speed": "40 ft.",
  "abilities": {
    "STR": {
      "score": 17,
      "mod": "+3"
    },
    "DEX": {
      "score": 10,
      "mod": "+0"
    },
    "CON": {
      "score": 16,
      "mod": "+3"
    },
    "INT": {
      "score": 2,
      "mod": "-4"
    },
    "WIS": {
      "score": 7,
      "mod": "-2"
    },
    "CHA": {
      "score": 5,
      "mod": "-3"
    }
  },
  "saves": null,
  "skills": null,
  "resistances": null,
  "immunities": null,
  "vulnerabilities": null,
  "condition_immunities": null,
  "senses": "Passive Perception 8",
  "languages": "None",
  "cr": "2 (XP 450; PB +2)",
  "traits": [
    {
      "name": "Bloodied Fury",
      "text": "The boar has Advantage on melee attack rolls while it is Bloodied."
    }
  ],
  "actions": [
    {
      "name": "Gore",
      "text": "Melee Attack Roll: +5, reach 5 ft. Hit: 10 (2d6 + 3) Piercing damage. If the target is a Large or smaller creature and the boar moved 20+ feet straight toward it immediately before the hit, the target takes an extra 7 (2d6) Piercing damage and has the Prone condition."
    }
  ],
  "bonus_actions": [],
  "reactions": [],
  "legendary_actions": [],
  "lair_actions": [],
  "regional_effects": [],
  "raw_text": "AC 13 \tInitiative +0 (10)\tLarge Beast, Unaligned\nHP 42 (5d10 + 15)\nSpeed 40 ft.\nMOD \tSAVE\nSTR \t17 \t+3 \t+5\nDEX \t10 \t+0 \t+0\nCON \t16 \t+3 \t+3\nMOD \tSAVE\nINT \t2 \t−4 \t−4\nWIS \t7 \t−2 \t−2\nCHA \t5 \t−3 \t−3\nSenses Passive Perception 8\nLanguages None\nCR 2 (XP 450; PB +2)\nTraits\nBloodied Fury. The boar has Advantage on melee attack rolls while it\nis Bloodied.\nActions\nGore. Melee Attack Roll: +5, reach 5 ft.\nHit: 10 (2d6 + 3) Piercing damage. If the\ntarget is a Large or smaller creature and the boar moved 20+ feet straight\ntoward it immediately before the hit, the target takes an extra 7 (2d6) Piercing\ndamage and has the Prone condition.",
  "sourceRef": {
    "file": "docs/sources/Monster Manual/Animals - Monster Manual - Dungeons & Dragons - Sources - D&D Beyond.pdf",
    "pages": [],
    "section": "Animals"
  },
  "notes": []
}
