{
  "id": "animal.saber_toothed_tiger",
  "name": "SABER-TOOTHED TIGER",
  "status": "complete",
  "size_type_alignment": "Large Beast, Unaligned",
  "size": "Large",
  "creature_type": "Beast",
  "alignment": "Unaligned",
  "armor_class": 13,
  "hit_points": 52,
  "hit_dice": "7d10 + 14",
  "speed": "40 ft.",
  "abilities": {
    "STR": {
      "score": 18,
      "mod": "+4"
    },
    "DEX": {
      "score": 17,
      "mod": "+3"
    },
    "CON": {
      "score": 15,
      "mod": "+2"
    },
    "INT": {
      "score": 3,
      "mod": "-4"
    },
    "WIS": {
      "score": 12,
      "mod": "+1"
    },
    "CHA": {
      "score": 8,
      "mod": "-1"
    }
  },
  "saves": null,
  "skills": "Perception +5, Stealth +7",
  "resistances": null,
  "immunities": null,
  "vulnerabilities": null,
  "condition_immunities": null,
  "senses": "Darkvision 60 ft.; Passive Perception 15",
  "languages": "None",
  "cr": "2 (XP 450; PB +2)",
  "traits": [
    {
      "name": "Running Leap",
      "text": "With a 10-foot running start, the tiger can Long Jump up to 25 feet."
    }
  ],
  "actions": [
    {
      "name": "Multiattack",
      "text": "The tiger makes two Rend attacks."
    },
    {
      "name": "Rend",
      "text": "Melee Attack Roll: +6, reach 5 ft. Hit: 11 (2d6 + 4) Slashing damage."
    }
  ],
  "bonus_actions": [
    {
      "name": "Nimble Escape",
      "text": "The tiger takes the Disengage or Hide action."
    }
  ],
  "reactions": [],
  "legendary_actions": [],
  "lair_actions": [],
  "regional_effects": [],
  "raw_text": "AC 13 \tInitiative +3 (13)\nHP 52 (7d10 + 14)\nSpeed 40 ft.\nMOD \tSAVE\nSTR \t18 \t+4 \t+6\nDEX \t17 \t+3 \t+5\nCON \t15 \t+2 \t+2\nMOD \tSAVE\nINT \t3 \t−4 \t−4\nWIS \t12 \t+1 \t+1\nCHA \t8 \t−1 \t−1\nSkills Perception +5, Stealth +7\nSenses Darkvision 60 ft.; Passive Perception 15\nLanguages None\nCR 2 (XP 450; PB +2)\nTraits\nRunning Leap. With a 10-foot running start, the tiger can Long Jump up to\n25 feet.\nActions\nMultiattack. The tiger makes two Rend attacks.\nRend. Melee Attack Roll: +6, reach 5 ft.\nHit: 11 (2d6 + 4) Slashing damage.\nBonus Actions\nNimble Escape. The tiger takes the Disengage or Hide action.\nLarge Beast, Unaligned",
  "sourceRef": {
    "file": "docs/sources/Monster Manual/Animals - Monster Manual - Dungeons & Dragons - Sources - D&D Beyond.pdf",
    "pages": [],
    "section": "Animals"
  },
  "notes": []
}
