{
  "id": "animal.giant_owl",
  "name": "GIANT OWL",
  "status": "complete",
  "size_type_alignment": "Large Celestial, Neutral",
  "size": "Large",
  "creature_type": "Celestial",
  "alignment": "Neutral",
  "armor_class": 12,
  "hit_points": 19,
  "hit_dice": "3d10 + 3",
  "speed": "5 ft., Fly 60 ft.",
  "abilities": {
    "STR": {
      "score": 13,
      "mod": "+1"
    },
    "DEX": {
      "score": 15,
      "mod": "+2"
    },
    "CON": {
      "score": 12,
      "mod": "+1"
    },
    "INT": {
      "score": 10,
      "mod": "+0"
    },
    "WIS": {
      "score": 14,
      "mod": "+2"
    },
    "CHA": {
      "score": 10,
      "mod": "+0"
    }
  },
  "saves": null,
  "skills": "Perception +6, Stealth +6",
  "resistances": null,
  "immunities": null,
  "vulnerabilities": null,
  "condition_immunities": null,
  "senses": "Darkvision 120 ft.; Passive Perception 16",
  "languages": "Celestial; understands Common, Elvish, and Sylvan but can’t",
  "cr": "1/4 (XP 50; PB +2)",
  "traits": [
    {
      "name": "Flyby",
      "text": "The owl doesn't provoke an Opportunity Attack when it flies out of an enemy's reach."
    }
  ],
  "actions": [
    {
      "name": "Talons",
      "text": "Melee Attack Roll: +4, reach 5 ft. Hit: 7 (1d10 + 2) Slashing damage."
    },
    {
      "name": "Spellcasting",
      "text": "The owl casts one of the following spells, requiring no spell components and using Wisdom as the spellcasting ability: At Will:"
    }
  ],
  "bonus_actions": [],
  "reactions": [],
  "legendary_actions": [],
  "lair_actions": [],
  "regional_effects": [],
  "raw_text": "AC 12 \tInitiative +2 (12)\nHP 19 (3d10 + 3)\nSpeed 5 ft., Fly 60 ft.\nMOD \tSAVE\nSTR \t13 \t+1 \t+1\nDEX \t15 \t+2 \t+2\nCON \t12 \t+1 \t+1\nMOD \tSAVE\nINT \t10 \t+0 \t+0\nWIS \t14 \t+2 \t+4\nCHA \t10 \t+0 \t+0\nSkills Perception +6, Stealth +6\nResistances Necrotic, Radiant\nSenses Darkvision 120 ft.; Passive Perception 16\nLanguages Celestial; understands Common, Elvish, and Sylvan but can’t\nspeak them\nCR 1/4 (XP 50; PB +2)\nTraits\nFlyby. The owl doesn’t provoke an Opportunity Attack when it flies out of an\nenemy’s reach.\nActions\nTalons. Melee Attack Roll: +4, reach 5 ft.\nHit: 7 (1d10 + 2) Slashing damage.\nSpellcasting. The owl casts one of the following spells, requiring no spell\ncomponents and using Wisdom as the spellcasting ability:\nAt Will:\nDetect Evil and Good,\nDetect Magic\n1/Day:\nClairvoyance\nLarge Celestial, Neutral",
  "sourceRef": {
    "file": "docs/sources/Monster Manual/Animals - Monster Manual - Dungeons & Dragons - Sources - D&D Beyond.pdf",
    "pages": [],
    "section": "Animals"
  },
  "notes": []
}
