{
  "id": "animal.constrictor_snake",
  "name": "CONSTRICTOR SNAKE",
  "status": "complete",
  "size_type_alignment": "Large Beast, Unaligned",
  "size": "Large",
  "creature_type": "Beast",
  "alignment": "Unaligned",
  "armor_class": 13,
  "hit_points": 13,
  "hit_dice": "2d10 + 2",
  "speed": "30 ft., Swim 30 ft.",
  "abilities": {
    "STR": {
      "score": 15,
      "mod": "+2"
    },
    "DEX": {
      "score": 14,
      "mod": "+2"
    },
    "CON": {
      "score": 12,
      "mod": "+1"
    },
    "INT": {
      "score": 1,
      "mod": "-5"
    },
    "WIS": {
      "score": 10,
      "mod": "+0"
    },
    "CHA": {
      "score": 3,
      "mod": "-4"
    }
  },
  "saves": null,
  "skills": "Perception +2, Stealth +4",
  "resistances": null,
  "immunities": null,
  "vulnerabilities": null,
  "condition_immunities": null,
  "senses": "Blindsight 10 ft.; Passive Perception 12",
  "languages": "None",
  "cr": "1/4 (XP 50; PB +2)",
  "traits": [],
  "actions": [
    {
      "name": "Bite",
      "text": "Melee Attack Roll: +4, reach 5 ft. Hit: 6 (1d8 + 2) Piercing damage."
    },
    {
      "name": "Constrict",
      "text": "Strength Saving Throw: DC 12, one Medium or smaller creature the snake can see within 5 feet. Failure: 7 (3d4) Bludgeoning damage, and the target has the Grappled condition (escape DC 12)."
    }
  ],
  "bonus_actions": [],
  "reactions": [],
  "legendary_actions": [],
  "lair_actions": [],
  "regional_effects": [],
  "raw_text": "AC 13 \tInitiative +2 (12)\tLarge Beast, Unaligned\nHP 13 (2d10 + 2)\nSpeed 30 ft., Swim 30 ft.\nMOD \tSAVE\nSTR \t15 \t+2 \t+2\nDEX \t14 \t+2 \t+2\nCON \t12 \t+1 \t+1\nMOD \tSAVE\nINT \t1 \t−5 \t−5\nWIS \t10 \t+0 \t+0\nCHA \t3 \t−4 \t−4\nSkills Perception +2, Stealth +4\nSenses Blindsight 10 ft.; Passive Perception 12\nLanguages None\nCR 1/4 (XP 50; PB +2)\nActions\nBite. Melee Attack Roll: +4, reach 5 ft.\nHit: 6 (1d8 + 2) Piercing damage.\nConstrict. Strength Saving Throw: DC 12, one Medium or smaller creature the\nsnake can see within 5 feet.\nFailure: 7 (3d4) Bludgeoning damage, and the\ntarget has the Grappled condition (escape DC 12).\nCONSTRICTOR SNAKE",
  "sourceRef": {
    "file": "docs/sources/Monster Manual/Animals - Monster Manual - Dungeons & Dragons - Sources - D&D Beyond.pdf",
    "pages": [],
    "section": "Animals"
  },
  "notes": []
}
