{
  "id": "animal.allosaurus",
  "name": "ALLOSAURUS",
  "status": "complete",
  "size_type_alignment": "Large Beast (Dinosaur), Unaligned",
  "size": "Large",
  "creature_type": "Beast (Dinosaur)",
  "alignment": "Unaligned",
  "armor_class": 13,
  "hit_points": 51,
  "hit_dice": "6d10 + 18",
  "speed": "60 ft.",
  "abilities": {
    "STR": {
      "score": 19,
      "mod": "+4"
    },
    "DEX": {
      "score": 13,
      "mod": "+1"
    },
    "CON": {
      "score": 17,
      "mod": "+3"
    },
    "INT": {
      "score": 2,
      "mod": "-4"
    },
    "WIS": {
      "score": 12,
      "mod": "+1"
    },
    "CHA": {
      "score": 5,
      "mod": "-3"
    }
  },
  "saves": null,
  "skills": "Perception +5",
  "resistances": null,
  "immunities": null,
  "vulnerabilities": null,
  "condition_immunities": null,
  "senses": "Passive Perception 15",
  "languages": "None",
  "cr": "2 (XP 450; PB +2)",
  "traits": [],
  "actions": [
    {
      "name": "Bite",
      "text": "Melee Attack Roll: +6, reach 5 ft. Hit: 15 (2d10 + 4) Piercing damage."
    },
    {
      "name": "Claws",
      "text": "Melee Attack Roll: +6, reach 5 ft. Hit: 8 (1d8 + 4) Slashing damage. If the target is a Large or smaller creature and the allosaurus moved 30+ feet straight toward it immediately before the hit, the target has the Prone condition, and the allosaurus can make one Bite attack against it."
    }
  ],
  "bonus_actions": [],
  "reactions": [],
  "legendary_actions": [],
  "lair_actions": [],
  "regional_effects": [],
  "raw_text": "AC 13 \tInitiative +1 (11)\nHP 51 (6d10 + 18)\nSpeed 60 ft.\nMOD \tSAVE\nSTR \t19 \t+4 \t+4\nDEX \t13 \t+1 \t+1\nCON \t17 \t+3 \t+3\nMOD \tSAVE\nINT \t2 \t−4 \t−4\nWIS \t12 \t+1 \t+1\nCHA \t5 \t−3 \t−3\nSkills Perception +5\nSenses Passive Perception 15\nLanguages None\nCR 2 (XP 450; PB +2)\nActions\nBite. Melee Attack Roll: +6, reach 5 ft.\nHit: 15 (2d10 + 4) Piercing damage.\nClaws. Melee Attack Roll: +6, reach 5 ft.\nHit: 8 (1d8 + 4) Slashing damage. If\nthe target is a Large or smaller creature and the allosaurus moved 30+ feet\nstraight toward it immediately before the hit, the target has the Prone\ncondition, and the allosaurus can make one Bite attack against it.\nLarge Beast (Dinosaur), Unaligned",
  "sourceRef": {
    "file": "docs/sources/Monster Manual/Animals - Monster Manual - Dungeons & Dragons - Sources - D&D Beyond.pdf",
    "pages": [],
    "section": "Animals"
  },
  "notes": []
}
