{
  "id": "monster.centaur_trooper",
  "name": "CENTAUR TROOPER",
  "status": "complete",
  "size_type_alignment": "Large Fey, Neutral Good",
  "size": "Large",
  "creature_type": "Fey",
  "alignment": "Neutral Good",
  "armor_class": 16,
  "hit_points": 45,
  "hit_dice": "6d10 + 12",
  "speed": "50 ft.",
  "abilities": {
    "STR": {
      "score": 18,
      "mod": "+4"
    },
    "DEX": {
      "score": 14,
      "mod": "+2"
    },
    "CON": {
      "score": 14,
      "mod": "+2"
    },
    "INT": {
      "score": 9,
      "mod": "-1"
    },
    "WIS": {
      "score": 13,
      "mod": "+1"
    },
    "CHA": {
      "score": 11,
      "mod": "+0"
    }
  },
  "saves": null,
  "skills": "Athletics +6, Perception +3",
  "resistances": null,
  "immunities": null,
  "vulnerabilities": null,
  "condition_immunities": null,
  "senses": "Passive Perception 13",
  "languages": "Elvish, Sylvan",
  "cr": "2 (XP 450; PB +2)",
  "traits": [],
  "actions": [
    {
      "name": "Multiattack",
      "text": "The centaur makes two attacks, using Pike or Longbow in any combination."
    },
    {
      "name": "Pike",
      "text": "Melee Attack Roll: +6, reach 10 ft. Hit: 9 (1d10 + 4) Piercing damage."
    },
    {
      "name": "Longbow",
      "text": "Ranged Attack Roll: +4, range 150/600 ft. Hit: 6 (1d8 + 2) Piercing damage."
    }
  ],
  "bonus_actions": [
    {
      "name": "Trampling Charge (Recharge 5-6)",
      "text": "The centaur moves up to its Speed without provoking Opportunity Attacks and can move through the spaces of Medium or smaller creatures. Each creature whose space the centaur enters is targeted once by the following effect. Strength Saving Throw: DC 14. Failure: 7 (1d6 + 4) Bludgeoning damage, and the target has the Prone condition."
    }
  ],
  "reactions": [],
  "legendary_actions": [],
  "lair_actions": [],
  "regional_effects": [],
  "raw_text": "AC 16 \tInitiative +2 (12)\nHP 45 (6d10 + 12)\nSpeed 50 ft.\nMOD \tSAVE\nSTR \t18 \t+4 \t+4\nDEX \t14 \t+2 \t+2\nCON \t14 \t+2 \t+2\nMOD \tSAVE\nINT \t9 \t−1 \t−1\nWIS \t13 \t+1 \t+1\nCHA \t11 \t+0 \t+0\nSkills Athletics +6, Perception +3\nGear Breastplate, Longbow, Pike\nSenses Passive Perception 13\nLanguages Elvish, Sylvan\nCR 2 (XP 450; PB +2)\nActions\nMultiattack. The centaur makes two attacks, using Pike or Longbow in\nany combination.\nPike. Melee Attack Roll: +6, reach 10 ft.\nHit: 9 (1d10 + 4) Piercing damage.\nLongbow. Ranged Attack Roll: +4, range 150/600 ft.\nHit: 6 (1d8 + 2)\nPiercing damage.\nBonus Actions\nTrampling Charge (Recharge 5–6). The centaur moves up to its Speed without\nprovoking Opportunity Attacks and can move through the spaces of Medium or\nsmaller creatures. Each creature whose space the centaur enters is targeted\nonce by the following effect.\nStrength Saving Throw: DC 14.\nFailure: 7 (1d6 + 4)\nBludgeoning damage, and the target has the Prone condition.\nLarge Fey, Neutral Good\nAlso known as kytons, chain devils consider themselves morbid artisans\nwho use deception, menace, and vicious metal to coerce prisoners into\nbetraying themselves. Many serve powerful devils, wrenching secrets from\nimprisoned souls using deadly, animate chains. Left to their own devices,\nchain devils encourage ruthless individuals to pursue forbidden magic,\nleading their pupils down paths to the Nine Hells.\nAlong with psychological threats and physical harm, a chain devil uses its\nunnerving gaze to make its victims perceive their worst fear rather than the\nmonster. Roll on or choose a result from the Chain Devil Masks table to\ninspire a chain devil’s fearful appearance.\nChain Devil Masks\n1d4 \tTo a Viewer, the Chain Devil Looks Like...\n1 \tThe corpse of a loved one.\n2 \tA disapproving deity.\n3 \tA harsh instructor or superior.\n4 \tThe viewer at their lowest point in life.\nChasme",
  "sourceRef": {
    "file": "docs/sources/Monster Manual/Monsters (C) - Monster Manual - Dungeons & Dragons - Sources - D&D Beyond.pdf",
    "pages": [],
    "section": "Monsters"
  },
  "notes": []
}
