{
  "id": "monster.bone_naga",
  "name": "BONE NAGA",
  "status": "complete",
  "size_type_alignment": "Large Undead, Neutral Evil",
  "size": "Large",
  "creature_type": "Undead",
  "alignment": "Neutral Evil",
  "armor_class": 15,
  "hit_points": 65,
  "hit_dice": "10d10 + 10",
  "speed": "40 ft.",
  "abilities": {
    "STR": {
      "score": 15,
      "mod": "+2"
    },
    "DEX": {
      "score": 16,
      "mod": "+3"
    },
    "CON": {
      "score": 12,
      "mod": "+1"
    },
    "INT": {
      "score": 16,
      "mod": "+3"
    },
    "WIS": {
      "score": 15,
      "mod": "+2"
    },
    "CHA": {
      "score": 15,
      "mod": "+2"
    }
  },
  "saves": null,
  "skills": null,
  "resistances": null,
  "immunities": null,
  "vulnerabilities": null,
  "condition_immunities": null,
  "senses": "Darkvision 60 ft.; Passive Perception 12",
  "languages": "Common plus one other language",
  "cr": "4 (XP 1,100; PB +2)",
  "traits": [],
  "actions": [
    {
      "name": "Multiattack",
      "text": "The naga makes two Bite attacks. It can replace any attack with a use of Serpentine Gaze."
    },
    {
      "name": "Bite",
      "text": "Melee Attack Roll: +5, reach 10 ft. Hit: 10 (2d6 + 3) Piercing damage plus 7 (2d6) Necrotic damage."
    },
    {
      "name": "Serpentine Gaze",
      "text": "Wisdom Saving Throw: DC 13, one creature the naga can see within 60 feet. Failure: 13 (3d6 + 3) Psychic damage, and the target has the Charmed condition until the start of the naga's next turn."
    },
    {
      "name": "Spellcasting",
      "text": "The naga casts one of the following spells, requiring no Material components and using Intelligence as the spellcasting ability (spell save DC 13): At Will: Mage Hand, Thaumaturgy 1/Day Each: Command, Detect Thoughts, Lightning Bolt BRASS DRAGON WYRMLING"
    }
  ],
  "bonus_actions": [],
  "reactions": [],
  "legendary_actions": [],
  "lair_actions": [],
  "regional_effects": [],
  "raw_text": "AC 15 \tInitiative +3 (13)\nHP 65 (10d10 + 10)\nSpeed 40 ft.\nMOD \tSAVE\nSTR \t15 \t+2 \t+2\nDEX \t16 \t+3 \t+3\nCON \t12 \t+1 \t+1\nMOD \tSAVE\nINT \t16 \t+3 \t+3\nWIS \t15 \t+2 \t+2\nCHA \t15 \t+2 \t+2\nImmunities Poison; Charmed, Exhaustion, Paralyzed, Poisoned\nSenses Darkvision 60 ft.; Passive Perception 12\nLanguages Common plus one other language\nCR 4 (XP 1,100; PB +2)\nActions\nMultiattack. The naga makes two Bite attacks. It can replace any attack with a\nuse of Serpentine Gaze.\nBite. Melee Attack Roll: +5, reach 10 ft.\nHit: 10 (2d6 + 3) Piercing damage plus\n7 (2d6) Necrotic damage.\nSerpentine Gaze. Wisdom Saving Throw: DC 13, one creature the naga can see\nwithin 60 feet.\nFailure: 13 (3d6 + 3) Psychic damage, and the target has the\nCharmed condition until the start of the nagaâ€™s next turn.\nSpellcasting. The naga casts one of the following spells, requiring no Material\ncomponents and using Intelligence as the spellcasting ability (spell save\nDC 13):\nAt Will:\nMage Hand,\nThaumaturgy\n1/Day Each:\nCommand,\nDetect Thoughts,\nLightning Bolt\nLarge Undead, Neutral Evil\nBRASS DRAGON WYRMLING",
  "sourceRef": {
    "file": "docs/sources/Monster Manual/Monsters (B) - Monster Manual - Dungeons & Dragons - Sources - D&D Beyond.pdf",
    "pages": [],
    "section": "Monsters"
  },
  "notes": []
}
