{
  "id": "monster.young_red_dragon",
  "name": "YOUNG RED DRAGON",
  "status": "complete",
  "size_type_alignment": "Large Dragon (Chromatic), Chaotic Evil",
  "size": "Large",
  "creature_type": "Dragon (Chromatic)",
  "alignment": "Chaotic Evil",
  "armor_class": 18,
  "hit_points": 178,
  "hit_dice": "17d10 + 85",
  "speed": "40 ft., Climb 40 ft., Fly 80 ft.",
  "abilities": {
    "STR": {
      "score": 23,
      "mod": "+6"
    },
    "DEX": {
      "score": 10,
      "mod": "+0"
    },
    "CON": {
      "score": 21,
      "mod": "+5"
    },
    "INT": {
      "score": 14,
      "mod": "+2"
    },
    "WIS": {
      "score": 11,
      "mod": "+0"
    },
    "CHA": {
      "score": 19,
      "mod": "+4"
    }
  },
  "saves": null,
  "skills": "Perception +8, Stealth +4",
  "resistances": null,
  "immunities": null,
  "vulnerabilities": null,
  "condition_immunities": null,
  "senses": "Blindsight 30 ft., Darkvision 120 ft.; Passive Perception 18",
  "languages": "Common, Draconic",
  "cr": "10 (XP 5,900; PB +4)",
  "traits": [],
  "actions": [
    {
      "name": "Multiattack",
      "text": "The dragon makes three Rend attacks."
    },
    {
      "name": "Rend",
      "text": "Melee Attack Roll: +10, reach 10 ft. Hit: 13 (2d6 + 6) Slashing damage plus 3 (1d6) Fire damage."
    },
    {
      "name": "Fire Breath (Recharge 5-6)",
      "text": "Dexterity Saving Throw: DC 17, each creature in a 30-foot Cone. Failure: 56 (16d6) Fire damage. Success: Half damage."
    }
  ],
  "bonus_actions": [],
  "reactions": [],
  "legendary_actions": [],
  "lair_actions": [],
  "regional_effects": [],
  "raw_text": "AC 18 \tInitiative +4 (14)\nHP 178 (17d10 + 85)\nSpeed 40 ft., Climb 40 ft., Fly 80 ft.\nMOD \tSAVE\nSTR \t23 \t+6 \t+6\nDEX \t10 \t+0 \t+4\nCON \t21 \t+5 \t+5\nMOD \tSAVE\nINT \t14 \t+2 \t+2\nWIS \t11 \t+0 \t+4\nCHA \t19 \t+4 \t+4\nSkills Perception +8, Stealth +4\nImmunities Fire\nSenses Blindsight 30 ft., Darkvision 120 ft.; Passive Perception 18\nLanguages Common, Draconic\nCR 10 (XP 5,900; PB +4)\nActions\nMultiattack. The dragon makes three Rend attacks.\nRend. Melee Attack Roll: +10, reach 10 ft.\nHit: 13 (2d6 + 6) Slashing damage\nplus 3 (1d6) Fire damage.\nFire Breath (Recharge 5â€“6). Dexterity Saving Throw: DC 17, each creature in a\n30-foot Cone.\nFailure: 56 (16d6) Fire damage.\nSuccess: Half damage.\nLarge Dragon (Chromatic), Chaotic Evil\nAdult red dragons are tyrants that claim vast domains and might command armies of followers or significant magical resources. Red dragons rarely pay\nattention to the nations and claims of smaller creatures, and they might consider entire cities part of their realm. Most red dragons are inattentive rulers,\nthough, spending decades focused on their own comforts, hoards, or magical concerns within their lairs. But when their attention returns to their territories,\nif they find matters not to their liking, whole lands might burn.\nAncient Red Dragon\nAN ADULT RED DRAGON UNLEASHES ITS FURY, REDUCING A CITY TO RUIN",
  "sourceRef": {
    "file": "docs/sources/Monster Manual/Monsters (R) - Monster Manual - Dungeons & Dragons - Sources - D&D Beyond.pdf",
    "pages": [],
    "section": "Monsters"
  },
  "notes": []
}
