{
  "id": "monster.modron_quadrone",
  "name": "MODRON QUADRONE",
  "status": "complete",
  "size_type_alignment": "Medium Construct, Lawful Neutral",
  "size": "Medium",
  "creature_type": "Construct",
  "alignment": "Lawful Neutral",
  "armor_class": 16,
  "hit_points": 22,
  "hit_dice": "4d8 + 4",
  "speed": "30 ft., Fly 30 ft.",
  "abilities": {
    "STR": {
      "score": 12,
      "mod": "+1"
    },
    "DEX": {
      "score": 14,
      "mod": "+2"
    },
    "CON": {
      "score": 12,
      "mod": "+1"
    },
    "INT": {
      "score": 10,
      "mod": "+0"
    },
    "WIS": {
      "score": 10,
      "mod": "+0"
    },
    "CHA": {
      "score": 11,
      "mod": "+0"
    }
  },
  "saves": null,
  "skills": "Perception +2",
  "resistances": null,
  "immunities": null,
  "vulnerabilities": null,
  "condition_immunities": null,
  "senses": "Truesight 120 ft.; Passive Perception 12",
  "languages": "Modron",
  "cr": "1 (XP 200; PB +2)",
  "traits": [
    {
      "name": "Disintegration",
      "text": "If the modron dies, it disintegrates into dust, leaving behind anything it was wearing or carrying."
    }
  ],
  "actions": [
    {
      "name": "Multiattack",
      "text": "The modron makes four Slam attacks or four Gears Launcher attacks."
    },
    {
      "name": "Slam",
      "text": "Melee Attack Roll: +4, reach 5 ft. Hit: 4 (1d4 + 2) Force damage."
    },
    {
      "name": "Gears Launcher",
      "text": "Ranged Attack Roll: +4, range 320 ft. Hit: 4 (1d4 + 2) Force damage."
    }
  ],
  "bonus_actions": [],
  "reactions": [],
  "legendary_actions": [],
  "lair_actions": [],
  "regional_effects": [],
  "raw_text": "AC 16 \tInitiative +2 (12)\nHP 22 (4d8 + 4)\nSpeed 30 ft., Fly 30 ft.\nMOD \tSAVE\nSTR \t12 \t+1 \t+1\nDEX \t14 \t+2 \t+2\nCON \t12 \t+1 \t+1\nMOD \tSAVE\nINT \t10 \t+0 \t+0\nWIS \t10 \t+0 \t+0\nCHA \t11 \t+0 \t+0\nSkills Perception +2\nImmunities Charmed\nSenses Truesight 120 ft.; Passive Perception 12\nLanguages Modron\nCR 1 (XP 200; PB +2)\nTraits\nDisintegration. If the modron dies, it disintegrates into dust, leaving behind\nanything it was wearing or carrying.\nActions\nMultiattack. The modron makes four Slam attacks or four Gears\nLauncher attacks.\nSlam. Melee Attack Roll: +4, reach 5 ft.\nHit: 4 (1d4 + 2) Force damage.\nGears Launcher. Ranged Attack Roll: +4, range 320 ft.\nHit: 4 (1d4 + 2)\nForce damage.\nMedium Construct, Lawful Neutral",
  "sourceRef": {
    "file": "docs/sources/Monster Manual/Monsters (M) - Monster Manual - Dungeons & Dragons - Sources - D&D Beyond.pdf",
    "pages": [],
    "section": "Monsters"
  },
  "notes": []
}
