{
  "id": "monster.cultist_hierophant",
  "name": "CULTIST HIEROPHANT",
  "status": "complete",
  "size_type_alignment": "Medium or Small Humanoid, Neutral",
  "size": "Medium",
  "creature_type": "Humanoid",
  "alignment": "Neutral",
  "armor_class": 16,
  "hit_points": 144,
  "hit_dice": "17d8 + 68",
  "speed": "30 ft.",
  "abilities": {
    "STR": {
      "score": 14,
      "mod": "+2"
    },
    "DEX": {
      "score": 18,
      "mod": "+4"
    },
    "CON": {
      "score": 18,
      "mod": "+4"
    },
    "INT": {
      "score": 13,
      "mod": "+1"
    },
    "WIS": {
      "score": 16,
      "mod": "+3"
    },
    "CHA": {
      "score": 20,
      "mod": "+5"
    }
  },
  "saves": null,
  "skills": "Perception +7, Persuasion +9, Religion +5",
  "resistances": null,
  "immunities": null,
  "vulnerabilities": null,
  "condition_immunities": null,
  "senses": "Passive Perception 17",
  "languages": "Celestial, Common",
  "cr": "10 (XP 5,900; PB +4)",
  "traits": [],
  "actions": [
    {
      "name": "Multiattack",
      "text": "The cultist makes three attacks, using Pact Blade or Radiant Ray in any combination."
    },
    {
      "name": "Pact Blade",
      "text": "Melee Attack Roll: +9, reach 5 ft. Hit: 12 (2d6 + 5) Slashing damage plus 18 (4d8) Radiant damage."
    },
    {
      "name": "Radiant Ray",
      "text": "Ranged Attack Roll: +9, range 120 ft. Hit: 31 (4d12 + 5) Radiant damage."
    },
    {
      "name": "Spellcasting",
      "text": "The cultist casts one of the following spells, using Charisma as the spellcasting ability (spell save DC 17): At Will: Thaumaturgy 1/Day Each:"
    }
  ],
  "bonus_actions": [],
  "reactions": [],
  "legendary_actions": [],
  "lair_actions": [],
  "regional_effects": [],
  "raw_text": "AC 16 \tInitiative +8 (18)\nHP 144 (17d8 + 68)\nSpeed 30 ft.\nMOD \tSAVE\nSTR \t14 \t+2 \t+2\nDEX \t18 \t+4 \t+4\nCON \t18 \t+4 \t+4\nMOD \tSAVE\nINT \t13 \t+1 \t+1\nWIS \t16 \t+3 \t+7\nCHA \t20 \t+5 \t+9\nSkills Perception +7, Persuasion +9, Religion +5\nGear Breastplate, Holy Symbol\nSenses Passive Perception 17\nLanguages Celestial, Common\nCR 10 (XP 5,900; PB +4)\nActions\nMultiattack. The cultist makes three attacks, using Pact Blade or Radiant Ray\nin any combination.\nPact Blade. Melee Attack Roll: +9, reach 5 ft.\nHit: 12 (2d6 + 5) Slashing\ndamage plus 18 (4d8) Radiant damage.\nRadiant Ray. Ranged Attack Roll: +9, range 120 ft.\nHit: 31 (4d12 + 5)\nRadiant damage.\nSpellcasting. The cultist casts one of the following spells, using Charisma as\nthe spellcasting ability (spell save DC 17):\nAt Will:\nThaumaturgy\n1/Day Each:\nJallarziâ€™s Storm of Radiance (level 7 version),\nMass Suggestion\nMedium or Small Humanoid, Neutral\nCults can organize around any mystical tradition, but many serve supernatural beings. Cult members often have abilities tied to the forces they worship.\nAberrant Cultist\nAberrant cultists pursue mind-bending powers from alien forces. Aberrant cultists align with monsters such as aboleths and mind flayers or forces such as\nCthulhu, Hadar, Ityak-Ortheel the Elf Eater, Nyarlathotep, malicious solar bodies, or entities from the Far Realm.\nDeath Cultist\nDeath cultists revel in nihilistic forces, embracing them as paths to undeath, multiversal purity, or entropic inevitability. These cultists serve powerful\nundead beings, apocalyptic prophecies, or immortals with power over death, such as Acererak, Kyuss, Orcus, Vecna, or Wee Jas.\nAN ABERRANT CULTIST AND AN ELEMENTAL CULTIST CLASH, UNLEASHING THE MAGIC OF THEIR OTHERWORLDLY PATRONS",
  "sourceRef": {
    "file": "docs/sources/Monster Manual/Monsters (C) - Monster Manual - Dungeons & Dragons - Sources - D&D Beyond.pdf",
    "pages": [],
    "section": "Monsters"
  },
  "notes": []
}
