{
  "id": "monster.roper",
  "name": "ROPER",
  "status": "complete",
  "size_type_alignment": "Large Aberration, Neutral Evil",
  "size": "Large",
  "creature_type": "Aberration",
  "alignment": "Neutral Evil",
  "armor_class": 20,
  "hit_points": 93,
  "hit_dice": "11d10 + 33",
  "speed": "10 ft., Climb 20 ft.",
  "abilities": {
    "STR": {
      "score": 18,
      "mod": "+4"
    },
    "DEX": {
      "score": 8,
      "mod": "-1"
    },
    "CON": {
      "score": 17,
      "mod": "+3"
    },
    "INT": {
      "score": 7,
      "mod": "-2"
    },
    "WIS": {
      "score": 16,
      "mod": "+3"
    },
    "CHA": {
      "score": 6,
      "mod": "-2"
    }
  },
  "saves": null,
  "skills": "Perception +6, Stealth +5",
  "resistances": null,
  "immunities": null,
  "vulnerabilities": null,
  "condition_immunities": null,
  "senses": "Darkvision 60 ft.; Passive Perception 16",
  "languages": "None",
  "cr": "5 (XP 1,800; PB +3)",
  "traits": [
    {
      "name": "Spider Climb",
      "text": "The roper can climb difficult surfaces, including along ceilings, without needing to make an ability check."
    }
  ],
  "actions": [
    {
      "name": "Multiattack",
      "text": "The roper makes two Tentacle attacks, uses Reel, and makes two Bite attacks."
    },
    {
      "name": "Bite",
      "text": "Melee Attack Roll: +7, reach 5 ft. Hit: 17 (3d8 + 4) Piercing damage."
    },
    {
      "name": "Tentacle",
      "text": "Melee Attack Roll: +7, reach 60 ft. Hit: The target has the Grappled condition (escape DC 14) from one of six tentacles, and the target has the"
    },
    {
      "name": "Poisoned condition until the grapple ends",
      "text": "The tentacle can be damaged, freeing a creature it has Grappled when destroyed (AC 20, HP 10, Immunity to Poison and Psychic damage). Damaging the tentacle deals no damage to the roper, and a destroyed tentacle regrows at the start of the roper's next turn."
    },
    {
      "name": "Reel",
      "text": "The roper pulls each creature Grappled by it up to 30 feet straight toward it."
    }
  ],
  "bonus_actions": [],
  "reactions": [],
  "legendary_actions": [],
  "lair_actions": [],
  "regional_effects": [],
  "raw_text": "AC 20 \tInitiative +5 (15)\nHP 93 (11d10 + 33)\nSpeed 10 ft., Climb 20 ft.\nMOD \tSAVE\nSTR \t18 \t+4 \t+4\nDEX \t8 \t−1 \t−1\nCON \t17 \t+3 \t+3\nMOD \tSAVE\nINT \t7 \t−2 \t−2\nWIS \t16 \t+3 \t+3\nCHA \t6 \t−2 \t−2\nSkills Perception +6, Stealth +5\nSenses Darkvision 60 ft.; Passive Perception 16\nLanguages None\nCR 5 (XP 1,800; PB +3)\nTraits\nSpider Climb. The roper can climb difficult surfaces, including along ceilings,\nwithout needing to make an ability check.\nActions\nMultiattack. The roper makes two Tentacle attacks, uses Reel, and makes two\nBite attacks.\nBite. Melee Attack Roll: +7, reach 5 ft.\nHit: 17 (3d8 + 4) Piercing damage.\nTentacle. Melee Attack Roll: +7, reach 60 ft.\nHit: The target has the Grappled\ncondition (escape DC 14) from one of six tentacles, and the target has the\nPoisoned condition until the grapple ends.\nThe tentacle can be damaged, freeing a creature it has Grappled when\ndestroyed (AC 20, HP 10, Immunity to Poison and Psychic damage). Damaging\nthe tentacle deals no damage to the roper, and a destroyed tentacle regrows at\nthe start of the roper’s next turn.\nReel. The roper pulls each creature Grappled by it up to 30 feet straight\ntoward it.\nLarge Aberration, Neutral Evil",
  "sourceRef": {
    "file": "docs/sources/Monster Manual/Monsters (R) - Monster Manual - Dungeons & Dragons - Sources - D&D Beyond.pdf",
    "pages": [],
    "section": "Monsters"
  },
  "notes": []
}
