{
  "id": "monster.adult_green_dragon",
  "name": "ADULT GREEN DRAGON",
  "status": "complete",
  "size_type_alignment": "Huge Dragon (Chromatic), Lawful Evil",
  "size": "Huge",
  "creature_type": "Dragon (Chromatic)",
  "alignment": "Lawful Evil",
  "armor_class": 19,
  "hit_points": 207,
  "hit_dice": "18d12 + 90",
  "speed": "40 ft., Fly 80 ft., Swim 40 ft.",
  "abilities": {
    "STR": {
      "score": 23,
      "mod": "+6"
    },
    "DEX": {
      "score": 12,
      "mod": "+1"
    },
    "CON": {
      "score": 21,
      "mod": "+5"
    },
    "INT": {
      "score": 18,
      "mod": "+4"
    },
    "WIS": {
      "score": 15,
      "mod": "+2"
    },
    "CHA": {
      "score": 18,
      "mod": "+4"
    }
  },
  "saves": null,
  "skills": "Deception +9, Perception +12, Persuasion +9, Stealth +6",
  "resistances": null,
  "immunities": null,
  "vulnerabilities": null,
  "condition_immunities": null,
  "senses": "Blindsight 60 ft., Darkvision 120 ft.; Passive Perception 22",
  "languages": "Common, Draconic",
  "cr": "15 (XP 13,000, or 15,000 in lair; PB +5)",
  "traits": [
    {
      "name": "Amphibious",
      "text": "The dragon can breathe air and water."
    },
    {
      "name": "Legendary Resistance (3/Day, or 4/Day in Lair)",
      "text": "If the dragon fails a saving throw, it can choose to succeed instead."
    }
  ],
  "actions": [
    {
      "name": "Multiattack",
      "text": "The dragon makes three Rend attacks. It can replace one attack with a use of Spellcasting to cast Mind Spike (level 3 version)."
    },
    {
      "name": "Rend",
      "text": "Melee Attack Roll: +11, reach 10 ft. Hit: 15 (2d8 + 6) Slashing damage plus 7 (2d6) Poison damage."
    },
    {
      "name": "Poison Breath (Recharge 5-6)",
      "text": "Constitution Saving Throw: DC 18, each creature in a 60-foot Cone. Failure: 56 (16d6) Poison damage. Success: Half damage."
    },
    {
      "name": "Spellcasting",
      "text": "The dragon casts one of the following spells, requiring no Material components and using Charisma as the spellcasting ability (spell save DC 17): At Will: Detect Magic, Mind Spike (level 3 version) 1/Day: Geas"
    }
  ],
  "bonus_actions": [],
  "reactions": [],
  "legendary_actions": [
    {
      "name": "Mind Invasion",
      "text": "The dragon uses Spellcasting to cast Mind Spike (level 3 version)."
    }
  ],
  "lair_actions": [],
  "regional_effects": [],
  "raw_text": "AC 19 \tInitiative +11 (21)\nHP 207 (18d12 + 90)\nSpeed 40 ft., Fly 80 ft., Swim 40 ft.\nMOD \tSAVE\nSTR \t23 \t+6 \t+6\nDEX \t12 \t+1 \t+6\nCON \t21 \t+5 \t+5\nMOD \tSAVE\nINT \t18 \t+4 \t+4\nWIS \t15 \t+2 \t+7\nCHA \t18 \t+4 \t+4\nSkills Deception +9, Perception +12, Persuasion +9, Stealth +6\nImmunities Poison; Poisoned\nSenses Blindsight 60 ft., Darkvision 120 ft.; Passive Perception 22\nLanguages Common, Draconic\nCR 15 (XP 13,000, or 15,000 in lair; PB +5)\nTraits\nAmphibious. The dragon can breathe air and water.\nLegendary Resistance (3/Day, or 4/Day in Lair). If the dragon fails a saving\nthrow, it can choose to succeed instead.\nActions\nMultiattack. The dragon makes three Rend attacks. It can replace one attack\nwith a use of Spellcasting to cast\nMind Spike (level 3 version).\nRend. Melee Attack Roll: +11, reach 10 ft.\nHit: 15 (2d8 + 6) Slashing damage\nplus 7 (2d6) Poison damage.\nPoison Breath (Recharge 5–6). Constitution Saving Throw: DC 18, each\ncreature in a 60-foot Cone.\nFailure: 56 (16d6) Poison damage.\nSuccess:\nHalf damage.\nSpellcasting. The dragon casts one of the following spells, requiring no\nMaterial components and using Charisma as the spellcasting ability (spell\nsave DC 17):\nAt Will:\nDetect Magic,\nMind Spike (level 3 version)\n1/Day:\nGeas\nLegendary Actions\nLegendary Action Uses: 3 (4 in Lair). Immediately after another creature’s turn,\nthe dragon can expend a use to take one of the following actions. The dragon\nregains all expended uses at the start of each of its turns.\nMind Invasion. The dragon uses Spellcasting to cast\nMind Spike (level\n3 version).\nHuge Dragon (Chromatic), Lawful Evil\nAncient Green Dragon\nAncient green dragons are creatures of legend, rarely seen by their servants or foes. Via magic and well-hidden agents, these dragons stoke suspicion\nbetween allies and undermine noble works. As bonds fray, the dragons reap rewards of greater wealth and control. Eventually the ambitions of ancient\ngreen dragons stretch beyond their territories as they seek control over empires, planar realms, or death itself.\nNoxious Miasma. Constitution Saving Throw: DC 17, each creature in a 20-\nfoot-radius Sphere centered on a point the dragon can see within 90 feet.\nFailure: 7 (2d6) Poison damage, and the target takes a −2 penalty to AC until\nthe end of its next turn.\nFailure or Success: The dragon can’t take this action\nagain until the start of its next turn.\nPounce. The dragon moves up to half its Speed, and it makes one Rend attack.\nAN ANCIENT GREEN DRAGON MANIPULATES THE FATES\nOF ITS PAWNS FROM DEEP WITHIN ITS FOREST LAIR",
  "sourceRef": {
    "file": "docs/sources/Monster Manual/Monsters (G) - Monster Manual - Dungeons & Dragons - Sources - D&D Beyond.pdf",
    "pages": [],
    "section": "Monsters"
  },
  "notes": [
    "Legendary Action Uses: 3 (4 in Lair). Immediately after another creature's turn, the dragon can expend a use to take one of the following actions. The dragon regains all expended uses at the start of each of its turns."
  ]
}
