{
  "id": "monster.bandit_captain",
  "name": "BANDIT CAPTAIN",
  "status": "complete",
  "size_type_alignment": "Medium or Small Humanoid, Neutral",
  "size": "Medium",
  "creature_type": "Humanoid",
  "alignment": "Neutral",
  "armor_class": 15,
  "hit_points": 52,
  "hit_dice": "8d8 + 16",
  "speed": "30 ft.",
  "abilities": {
    "STR": {
      "score": 15,
      "mod": "+2"
    },
    "DEX": {
      "score": 16,
      "mod": "+3"
    },
    "CON": {
      "score": 14,
      "mod": "+2"
    },
    "INT": {
      "score": 14,
      "mod": "+2"
    },
    "WIS": {
      "score": 11,
      "mod": "+0"
    },
    "CHA": {
      "score": 14,
      "mod": "+2"
    }
  },
  "saves": null,
  "skills": "Athletics +4, Deception +4",
  "resistances": null,
  "immunities": null,
  "vulnerabilities": null,
  "condition_immunities": null,
  "senses": "Passive Perception 10",
  "languages": "Common, Thieves’ Cant",
  "cr": "2 (XP 450; PB +2)",
  "traits": [],
  "actions": [
    {
      "name": "Multiattack",
      "text": "The bandit makes two attacks, using Scimitar and Pistol in any combination."
    },
    {
      "name": "Scimitar",
      "text": "Melee Attack Roll: +5, reach 5 ft. Hit: 6 (1d6 + 3) Slashing damage."
    },
    {
      "name": "Pistol",
      "text": "Ranged Attack Roll: +5, range 30/90 ft. Hit: 8 (1d10 + 3) Piercing damage."
    }
  ],
  "bonus_actions": [],
  "reactions": [
    {
      "name": "Parry",
      "text": "Trigger: The bandit is hit by a melee attack roll while holding a weapon. Response: The bandit adds 2 to its AC against that attack, possibly causing it to miss."
    }
  ],
  "legendary_actions": [],
  "lair_actions": [],
  "regional_effects": [],
  "raw_text": "AC 15 \tInitiative +3 (13)\nHP 52 (8d8 + 16)\nSpeed 30 ft.\nMOD \tSAVE\nSTR \t15 \t+2 \t+4\nDEX \t16 \t+3 \t+5\nCON \t14 \t+2 \t+2\nMOD \tSAVE\nINT \t14 \t+2 \t+2\nWIS \t11 \t+0 \t+2\nCHA \t14 \t+2 \t+2\nSkills Athletics +4, Deception +4\nGear Pistol, Scimitar, Studded Leather Armor\nSenses Passive Perception 10\nLanguages Common, Thieves’ Cant\nCR 2 (XP 450; PB +2)\nActions\nMultiattack. The bandit makes two attacks, using Scimitar and Pistol in\nany combination.\nScimitar. Melee Attack Roll: +5, reach 5 ft.\nHit: 6 (1d6 + 3) Slashing damage.\nPistol. Ranged Attack Roll: +5, range 30/90 ft.\nHit: 8 (1d10 + 3)\nPiercing damage.\nReactions\nParry. Trigger: The bandit is hit by a melee attack roll while holding a weapon.\nResponse: The bandit adds 2 to its AC against that attack, possibly causing it\nto miss.\nMedium or Small Humanoid, Neutral",
  "sourceRef": {
    "file": "docs/sources/Monster Manual/Monsters (B) - Monster Manual - Dungeons & Dragons - Sources - D&D Beyond.pdf",
    "pages": [],
    "section": "Monsters"
  },
  "notes": []
}
