{
  "id": "monster.adult_brass_dragon",
  "name": "ADULT BRASS DRAGON",
  "status": "complete",
  "size_type_alignment": "Huge Dragon (Metallic), Chaotic Good",
  "size": "Huge",
  "creature_type": "Dragon (Metallic)",
  "alignment": "Chaotic Good",
  "armor_class": 18,
  "hit_points": 172,
  "hit_dice": "15d12 + 75",
  "speed": "40 ft., Burrow 30 ft., Fly 80 ft.",
  "abilities": {
    "STR": {
      "score": 23,
      "mod": "+6"
    },
    "DEX": {
      "score": 10,
      "mod": "+0"
    },
    "CON": {
      "score": 21,
      "mod": "+5"
    },
    "INT": {
      "score": 14,
      "mod": "+2"
    },
    "WIS": {
      "score": 13,
      "mod": "+1"
    },
    "CHA": {
      "score": 17,
      "mod": "+3"
    }
  },
  "saves": null,
  "skills": "History +7, Perception +11, Persuasion +8, Stealth +5",
  "resistances": null,
  "immunities": null,
  "vulnerabilities": null,
  "condition_immunities": null,
  "senses": "Blindsight 60 ft., Darkvision 120 ft.; Passive Perception 21",
  "languages": "Common, Draconic",
  "cr": "13 (XP 10,000, or 11,500 in lair; PB +5)",
  "traits": [
    {
      "name": "Legendary Resistance (3/Day, or 4/Day in Lair)",
      "text": "If the dragon fails a saving throw, it can choose to succeed instead."
    }
  ],
  "actions": [
    {
      "name": "Multiattack",
      "text": "The dragon makes three Rend attacks. It can replace one attack with a use of (A) Sleep Breath or (B) Spellcasting to cast Scorching Ray."
    },
    {
      "name": "Rend",
      "text": "Melee Attack Roll: +11, reach 10 ft. Hit: 17 (2d10 + 6) Slashing damage plus 4 (1d8) Fire damage."
    },
    {
      "name": "Fire Breath (Recharge 5-6)",
      "text": "Dexterity Saving Throw: DC 18, each creature in a 60-foot-long, 5-foot-wide Line. Failure: 45 (10d8) Fire damage. Success: Half damage."
    },
    {
      "name": "Sleep Breath",
      "text": "Constitution Saving Throw: DC 18, each creature in a 60-foot Cone. Failure: The target has the Incapacitated condition until the end of its next turn, at which point it repeats the save. Second Failure: The target has the Unconscious condition for 10 minutes. This effect ends for the target if it takes damage or a creature within 5 feet of it takes an action to wake it."
    },
    {
      "name": "Spellcasting",
      "text": "The dragon casts one of the following spells, requiring no Material components and using Charisma as the spellcasting ability (spell save DC 16): At Will: Detect Magic, Minor Illusion, Scorching Ray, Shapechange (Beast or Humanoid form only, no Temporary Hit Points gained from the spell, and no"
    }
  ],
  "bonus_actions": [],
  "reactions": [],
  "legendary_actions": [
    {
      "name": "Blazing Light",
      "text": "The dragon uses Spellcasting to cast Scorching Ray."
    },
    {
      "name": "Pounce",
      "text": "The dragon moves up to half its Speed, and it makes one Rend attack."
    },
    {
      "name": "Scorching Sands",
      "text": "Dexterity Saving Throw: DC 16, one creature the dragon can see within 120 feet. Failure: 27 (6d8) Fire damage, and the target's Speed is halved until the end of its next turn. Failure or Success: The dragon can't take this action again until the start of its next turn. Ancient Brass Dragon"
    },
    {
      "name": "Ancient brass dragons create worlds-spanning networks",
      "text": "They combat forces of repression and misinformation, helping people learn from the mistakes of the past. Either personally or through webs of messengers, ancient brass dragons keep allies informed about challenges they can face together. AN ANCIENT BRASS DRAGON PROTECTS TRAVELERS FROM AN ONCOMING SANDSTORM"
    }
  ],
  "lair_actions": [],
  "regional_effects": [],
  "raw_text": "AC 18 \tInitiative +10 (20)\nHP 172 (15d12 + 75)\nSpeed 40 ft., Burrow 30 ft., Fly 80 ft.\nMOD \tSAVE\nSTR \t23 \t+6 \t+6\nDEX \t10 \t+0 \t+5\nCON \t21 \t+5 \t+5\nMOD \tSAVE\nINT \t14 \t+2 \t+2\nWIS \t13 \t+1 \t+6\nCHA \t17 \t+3 \t+3\nSkills History +7, Perception +11, Persuasion +8, Stealth +5\nImmunities Fire\nSenses Blindsight 60 ft., Darkvision 120 ft.; Passive Perception 21\nLanguages Common, Draconic\nCR 13 (XP 10,000, or 11,500 in lair; PB +5)\nTraits\nLegendary Resistance (3/Day, or 4/Day in Lair). If the dragon fails a saving\nthrow, it can choose to succeed instead.\nActions\nMultiattack. The dragon makes three Rend attacks. It can replace one attack\nwith a use of (A) Sleep Breath or (B) Spellcasting to cast\nScorching Ray.\nRend. Melee Attack Roll: +11, reach 10 ft.\nHit: 17 (2d10 + 6) Slashing damage\nplus 4 (1d8) Fire damage.\nFire Breath (Recharge 5–6).\nDexterity Saving Throw: DC 18, each creature\nin a 60-foot-long, 5-foot-wide Line.\nFailure: 45 (10d8) Fire damage.\nSuccess:\nHalf damage.\nSleep Breath. Constitution Saving Throw: DC 18, each creature in a 60-foot\nCone.\nFailure: The target has the Incapacitated condition until the end of its\nnext turn, at which point it repeats the save.\nSecond Failure: The target has the\nUnconscious condition for 10 minutes. This effect ends for the target if it\ntakes damage or a creature within 5 feet of it takes an action to wake it.\nSpellcasting. The dragon casts one of the following spells, requiring no\nMaterial components and using Charisma as the spellcasting ability (spell\nsave DC 16):\nAt Will:\nDetect Magic,\nMinor Illusion,\nScorching Ray,\nShapechange (Beast or\nHumanoid form only, no Temporary Hit Points gained from the spell, and no\nConcentration or Temporary Hit Points required to maintain the spell),\nSpeak\nwith Animals\n1/Day Each:\nDetect Thoughts,\nControl Weather\nLegendary Actions\nLegendary Action Uses: 3 (4 in Lair). Immediately after another creature’s turn,\nthe dragon can expend a use to take one of the following actions. The dragon\nregains all expended uses at the start of each of its turns.\nBlazing Light. The dragon uses Spellcasting to cast\nScorching Ray.\nPounce. The dragon moves up to half its Speed, and it makes one Rend attack.\nScorching Sands. Dexterity Saving Throw: DC 16, one creature the dragon can\nsee within 120 feet.\nFailure: 27 (6d8) Fire damage, and the target’s Speed is\nhalved until the end of its next turn.\nFailure or Success: The dragon can’t take\nthis action again until the start of its next turn.\nHuge Dragon (Metallic), Chaotic Good\nAncient Brass Dragon\nAncient brass dragons create worlds-spanning networks. They combat forces of repression and misinformation, helping people learn from the mistakes of\nthe past. Either personally or through webs of messengers, ancient brass dragons keep allies informed about challenges they can face together.\nAN ANCIENT BRASS DRAGON PROTECTS TRAVELERS FROM AN ONCOMING SANDSTORM",
  "sourceRef": {
    "file": "docs/sources/Monster Manual/Monsters (B) - Monster Manual - Dungeons & Dragons - Sources - D&D Beyond.pdf",
    "pages": [],
    "section": "Monsters"
  },
  "notes": [
    "Legendary Action Uses: 3 (4 in Lair). Immediately after another creature's turn, the dragon can expend a use to take one of the following actions. The dragon regains all expended uses at the start of each of its turns."
  ]
}
