{
  "id": "monster.young_black_dragon",
  "name": "YOUNG BLACK DRAGON",
  "status": "complete",
  "size_type_alignment": "Large Dragon (Chromatic), Chaotic Evil",
  "size": "Large",
  "creature_type": "Dragon (Chromatic)",
  "alignment": "Chaotic Evil",
  "armor_class": 18,
  "hit_points": 127,
  "hit_dice": "15d10 + 45",
  "speed": "40 ft., Fly 80 ft., Swim 40 ft.",
  "abilities": {
    "STR": {
      "score": 19,
      "mod": "+4"
    },
    "DEX": {
      "score": 14,
      "mod": "+2"
    },
    "CON": {
      "score": 17,
      "mod": "+3"
    },
    "INT": {
      "score": 12,
      "mod": "+1"
    },
    "WIS": {
      "score": 11,
      "mod": "+0"
    },
    "CHA": {
      "score": 15,
      "mod": "+2"
    }
  },
  "saves": null,
  "skills": "Perception +6, Stealth +5",
  "resistances": null,
  "immunities": null,
  "vulnerabilities": null,
  "condition_immunities": null,
  "senses": "Blindsight 30 ft., Darkvision 120 ft.; Passive Perception 16",
  "languages": "Common, Draconic",
  "cr": "7 (XP 2,900; PB +3)",
  "traits": [
    {
      "name": "Amphibious",
      "text": "The dragon can breathe air and water."
    }
  ],
  "actions": [
    {
      "name": "Multiattack",
      "text": "The dragon makes three Rend attacks."
    },
    {
      "name": "Rend",
      "text": "Melee Attack Roll: +7, reach 10 ft. Hit: 9 (2d4 + 4) Slashing damage plus 3 (1d6) Acid damage."
    },
    {
      "name": "Acid Breath (Recharge 5-6)",
      "text": "Dexterity Saving Throw: DC 14, each creature in a 30-foot-long, 5-foot-wide Line. Failure: 49 (14d6) Acid damage. Success: Half damage."
    }
  ],
  "bonus_actions": [],
  "reactions": [],
  "legendary_actions": [],
  "lair_actions": [],
  "regional_effects": [],
  "raw_text": "AC 18 \tInitiative +5 (15)\nHP 127 (15d10 + 45)\nSpeed 40 ft., Fly 80 ft., Swim 40 ft.\nMOD \tSAVE\nSTR \t19 \t+4 \t+4\nDEX \t14 \t+2 \t+5\nCON \t17 \t+3 \t+3\nMOD \tSAVE\nINT \t12 \t+1 \t+1\nWIS \t11 \t+0 \t+3\nCHA \t15 \t+2 \t+2\nSkills Perception +6, Stealth +5\nImmunities Acid\nSenses Blindsight 30 ft., Darkvision 120 ft.; Passive Perception 16\nLanguages Common, Draconic\nCR 7 (XP 2,900; PB +3)\nTraits\nAmphibious. The dragon can breathe air and water.\nActions\nMultiattack. The dragon makes three Rend attacks.\nRend. Melee Attack Roll: +7, reach 10 ft.\nHit: 9 (2d4 + 4) Slashing damage plus\n3 (1d6) Acid damage.\nAcid Breath (Recharge 5–6). Dexterity Saving Throw: DC 14, each creature\nin a 30-foot-long, 5-foot-wide Line.\nFailure: 49 (14d6) Acid damage.\nSuccess:\nHalf damage.\nLarge Dragon (Chromatic), Chaotic Evil\nBy the time they’re adults, black dragons are among the greatest terrors in the lands they claim. Wretched swamps and monster-haunted ruins grow more\ndismal and spread under an adult black dragon’s influence. Morbid cultists and doomsayers frequently gather in the dragon’s service, bringing with them\nundead terrors that answer to the black dragon and aid it in spreading ruin to nearby bastions of beauty and peace.\nAN ADULT BLACK DRAGON USES ITS ACID BREATH TO MELT THE CONSTRUCT DEFENDERS OF A CLOCKWORK FORTRESS",
  "sourceRef": {
    "file": "docs/sources/Monster Manual/Monsters (B) - Monster Manual - Dungeons & Dragons - Sources - D&D Beyond.pdf",
    "pages": [],
    "section": "Monsters"
  },
  "notes": []
}
