{
  "id": "monster.druid",
  "name": "DRUID",
  "status": "complete",
  "size_type_alignment": "Medium or Small Humanoid, Neutral",
  "size": "Medium",
  "creature_type": "Humanoid",
  "alignment": "Neutral",
  "armor_class": 13,
  "hit_points": 44,
  "hit_dice": "8d8 + 8",
  "speed": "30 ft.",
  "abilities": {
    "STR": {
      "score": 10,
      "mod": "+0"
    },
    "DEX": {
      "score": 12,
      "mod": "+1"
    },
    "CON": {
      "score": 13,
      "mod": "+1"
    },
    "INT": {
      "score": 12,
      "mod": "+1"
    },
    "WIS": {
      "score": 16,
      "mod": "+3"
    },
    "CHA": {
      "score": 11,
      "mod": "+0"
    }
  },
  "saves": null,
  "skills": "Medicine +5, Nature +3, Perception +5",
  "resistances": null,
  "immunities": null,
  "vulnerabilities": null,
  "condition_immunities": null,
  "senses": "Passive Perception 15",
  "languages": "Common, Druidic, Sylvan",
  "cr": "2 (XP 450; PB +2)",
  "traits": [],
  "actions": [
    {
      "name": "Multiattack",
      "text": "The druid makes two attacks, using Vine Staff or Verdant Wisp in any combination."
    },
    {
      "name": "Vine Staff",
      "text": "Melee Attack Roll: +5, reach 5 ft. Hit: 7 (1d8 + 3) Bludgeoning damage plus 2 (1d4) Poison damage."
    },
    {
      "name": "Verdant Wisp",
      "text": "Ranged Attack Roll: +5, range 90 ft. Hit: 10 (3d6) Radiant damage."
    },
    {
      "name": "Spellcasting",
      "text": "The druid casts one of the following spells, using Wisdom as the spellcasting ability (spell save DC 13): At Will: Druidcraft, Speak with Animals 2/Day Each: Entangle, Thunderwave 1/Day Each: Animal Messenger, Longstrider, Moonbeam"
    }
  ],
  "bonus_actions": [],
  "reactions": [],
  "legendary_actions": [],
  "lair_actions": [],
  "regional_effects": [],
  "raw_text": "AC 13 \tInitiative +1 (11)\nHP 44 (8d8 + 8)\nSpeed 30 ft.\nMOD \tSAVE\nSTR \t10 \t+0 \t+0\nDEX \t12 \t+1 \t+1\nCON \t13 \t+1 \t+1\nMOD \tSAVE\nINT \t12 \t+1 \t+1\nWIS \t16 \t+3 \t+3\nCHA \t11 \t+0 \t+0\nSkills Medicine +5, Nature +3, Perception +5\nGear Studded Leather Armor\nSenses Passive Perception 15\nLanguages Common, Druidic, Sylvan\nCR 2 (XP 450; PB +2)\nActions\nMultiattack. The druid makes two attacks, using Vine Staff or Verdant Wisp in\nany combination.\nVine Staff. Melee Attack Roll: +5, reach 5 ft.\nHit: 7 (1d8 + 3) Bludgeoning\ndamage plus 2 (1d4) Poison damage.\nVerdant Wisp. Ranged Attack Roll: +5, range 90 ft.\nHit: 10 (3d6)\nRadiant damage.\nSpellcasting. The druid casts one of the following spells, using Wisdom as the\nspellcasting ability (spell save DC 13):\nAt Will:\nDruidcraft,\nSpeak with Animals\n2/Day Each:\nEntangle,\nThunderwave\n1/Day Each:\nAnimal Messenger,\nLongstrider,\nMoonbeam\nMedium or Small Humanoid, Neutral",
  "sourceRef": {
    "file": "docs/sources/Monster Manual/Monsters (D) - Monster Manual - Dungeons & Dragons - Sources - D&D Beyond.pdf",
    "pages": [],
    "section": "Monsters"
  },
  "notes": []
}
