{
  "id": "monster.pixie_wonderbringer",
  "name": "PIXIE WONDERBRINGER",
  "status": "complete",
  "size_type_alignment": "Tiny Fey, Neutral Good",
  "size": "Tiny",
  "creature_type": "Fey",
  "alignment": "Neutral Good",
  "armor_class": 15,
  "hit_points": 60,
  "hit_dice": "24d4",
  "speed": "10 ft., Fly 30 ft.",
  "abilities": {
    "STR": {
      "score": 2,
      "mod": "-4"
    },
    "DEX": {
      "score": 20,
      "mod": "+5"
    },
    "CON": {
      "score": 10,
      "mod": "+0"
    },
    "INT": {
      "score": 11,
      "mod": "+0"
    },
    "WIS": {
      "score": 14,
      "mod": "+2"
    },
    "CHA": {
      "score": 18,
      "mod": "+4"
    }
  },
  "saves": null,
  "skills": "Arcana +3, Perception +5, Stealth +8",
  "resistances": null,
  "immunities": null,
  "vulnerabilities": null,
  "condition_immunities": null,
  "senses": "Passive Perception 15",
  "languages": "Common, Elvish, Sylvan",
  "cr": "5 (XP 1,800; PB +3)",
  "traits": [
    {
      "name": "Magic Resistance",
      "text": "The pixie has Advantage on saving throws against spells and other magical effects."
    }
  ],
  "actions": [
    {
      "name": "Multiattack",
      "text": "The pixie makes two Faerie Dust attacks."
    },
    {
      "name": "Faerie Dust",
      "text": "Melee or Ranged Attack Roll: +7, reach 5 ft. or range 60 ft. Hit: 15 (2d10 + 4) Radiant damage, and the target has the Charmed or Poisoned condition (pixie's choice) until the start of the pixie's next turn."
    },
    {
      "name": "Spellcasting",
      "text": "The pixie casts one of the following spells, requiring no Material components and using Charisma as the spellcasting ability (spell save DC 15): At Will: Dancing Lights, Druidcraft, Invisibility (self only) 1/Day Each: Detect Thoughts, Fly, Major Image"
    }
  ],
  "bonus_actions": [
    {
      "name": "Burst of Wonder (Recharge 5-6)",
      "text": "The pixie casts Entangle, Polymorph, or Tasha's Hideous Laughter, requiring no Material components and using the same spellcasting ability as Spellcasting."
    }
  ],
  "reactions": [],
  "legendary_actions": [],
  "lair_actions": [],
  "regional_effects": [],
  "raw_text": "AC 15 \tInitiative +5 (15)\nHP 60 (24d4)\nSpeed 10 ft., Fly 30 ft.\nMOD \tSAVE\nSTR \t2 \t−4 \t−4\nDEX \t20 \t+5 \t+5\nCON \t10 \t+0 \t+0\nMOD \tSAVE\nINT \t11 \t+0 \t+0\nWIS \t14 \t+2 \t+2\nCHA \t18 \t+4 \t+4\nSkills Arcana +3, Perception +5, Stealth +8\nSenses Passive Perception 15\nLanguages Common, Elvish, Sylvan\nCR 5 (XP 1,800; PB +3)\nTraits\nMagic Resistance. The pixie has Advantage on saving throws against spells\nand other magical effects.\nActions\nMultiattack. The pixie makes two Faerie Dust attacks.\nFaerie Dust. Melee or Ranged Attack Roll: +7, reach 5 ft. or range 60 ft.\nHit: 15\n(2d10 + 4) Radiant damage, and the target has the Charmed or Poisoned\ncondition (pixie’s choice) until the start of the pixie’s next turn.\nSpellcasting. The pixie casts one of the following spells, requiring no Material\ncomponents and using Charisma as the spellcasting ability (spell save DC 15):\nAt Will:\nDancing Lights,\nDruidcraft,\nInvisibility (self only)\n1/Day Each:\nDetect Thoughts,\nFly,\nMajor Image\nBonus Actions\nBurst of Wonder (Recharge 5–6). The pixie casts\nEntangle,\nPolymorph, or\nTasha’s Hideous Laughter, requiring no Material components and using the\nsame spellcasting ability as Spellcasting.\nTiny Fey, Neutral Good\nRighteously Wrathful Angelic Warrior\nHabitat: Planar (Upper Planes); Treasure: Relics\nPlanetars deliver the punishment of righteous gods. These angels innately know truth from lies, and they use magic and blessed weapons to protect the\njust and root out wickedness across the Multiverse.\nThese angels act where they can against overwhelming evil, but to avoid the\nattention of the Lower Planes, they prefer to let mortals attend to affairs on\nthe Material Plane. Planetars often choose mortal champions to oppose\nthreats they’re loath to face directly, involving themselves only if necessary.\nRoll on or choose a result from the Planetar Quests table to inspire what evil\na planetar might recruit heroes to thwart.\nPlanetar Quests\n1d6 \tThe Planetar Entreats a Mortal Hero To...\n1 \tConvince a villain to meet with the angel.\n2 \tFind a loved one a villain believes is dead.\n3 \tHeal the loved one of an evil ruler.\n4 \tInspire the defenders of a besieged holy site.\n5 \tRecover and destroy an evil Artifact.\n6 \tReveal the true name of a devil to banish it.",
  "sourceRef": {
    "file": "docs/sources/Monster Manual/Monsters (P) - Monster Manual - Dungeons & Dragons - Sources - D&D Beyond.pdf",
    "pages": [],
    "section": "Monsters"
  },
  "notes": []
}
