{
  "id": "monster.green_slaad",
  "name": "GREEN SLAAD",
  "status": "complete",
  "size_type_alignment": "Large Aberration, Chaotic Neutral",
  "size": "Large",
  "creature_type": "Aberration",
  "alignment": "Chaotic Neutral",
  "armor_class": 16,
  "hit_points": 144,
  "hit_dice": "17d10 + 51",
  "speed": "30 ft.",
  "abilities": {
    "STR": {
      "score": 16,
      "mod": "+3"
    },
    "DEX": {
      "score": 15,
      "mod": "+2"
    },
    "CON": {
      "score": 16,
      "mod": "+3"
    },
    "INT": {
      "score": 11,
      "mod": "+0"
    },
    "WIS": {
      "score": 8,
      "mod": "-1"
    },
    "CHA": {
      "score": 18,
      "mod": "+4"
    }
  },
  "saves": null,
  "skills": "Arcana +3, Perception +2",
  "resistances": null,
  "immunities": null,
  "vulnerabilities": null,
  "condition_immunities": null,
  "senses": "Blindsight 30 ft., Darkvision 60 ft.; Passive Perception 12",
  "languages": "Common, Slaad; telepathy 60 ft.",
  "cr": "8 (XP 3,900; PB +3)",
  "traits": [
    {
      "name": "Magic Resistance",
      "text": "The slaad has Advantage on saving throws against spells and other magical effects."
    },
    {
      "name": "Regeneration",
      "text": "The slaad regains 10 Hit Points at the start of each of its turns if it has at least 1 Hit Point."
    }
  ],
  "actions": [
    {
      "name": "Multiattack",
      "text": "The slaad makes three Chaos Staff attacks."
    },
    {
      "name": "Chaos Staff",
      "text": "Melee or Ranged Attack Roll: +7, reach 10 ft. or range 60 ft. Hit: 8 (1d8 + 4) Force damage. Until the start of the slaad's next turn, the target has a condition determined by rolling 1d4: on a 1, Charmed; on a 2, Frightened; on a 3, Poisoned; or on a 4, Incapacitated."
    },
    {
      "name": "Spellcasting",
      "text": "The slaad casts one of the following spells, requiring no Material components and using Charisma as the spellcasting ability (spell save DC 14): At Will: Detect Magic, Detect Thoughts, Mage Hand 1/Day Each: Fireball, Invisibility (self only)"
    }
  ],
  "bonus_actions": [
    {
      "name": "Shape-Shift",
      "text": "The slaad shape-shifts into a Small or Medium Humanoid, or it returns to its true form. Other than its size, its game statistics are the same in each form. Any equipment it is wearing or carrying isn't transformed."
    }
  ],
  "reactions": [],
  "legendary_actions": [],
  "lair_actions": [],
  "regional_effects": [],
  "raw_text": "AC 16 \tInitiative +5 (15)\nHP 144 (17d10 + 51)\nSpeed 30 ft.\nMOD \tSAVE\nSTR \t16 \t+3 \t+3\nDEX \t15 \t+2 \t+2\nCON \t16 \t+3 \t+3\nMOD \tSAVE\nINT \t11 \t+0 \t+0\nWIS \t8 \t−1 \t−1\nCHA \t18 \t+4 \t+4\nSkills Arcana +3, Perception +2\nResistances Acid, Cold, Fire, Lightning, Thunder\nSenses Blindsight 30 ft., Darkvision 60 ft.; Passive Perception 12\nLanguages Common, Slaad; telepathy 60 ft.\nCR 8 (XP 3,900; PB +3)\nTraits\nMagic Resistance. The slaad has Advantage on saving throws against spells\nand other magical effects.\nRegeneration. The slaad regains 10 Hit Points at the start of each of its turns if\nit has at least 1 Hit Point.\nActions\nMultiattack. The slaad makes three Chaos Staff attacks.\nChaos Staff. Melee or Ranged Attack Roll: +7, reach 10 ft. or range 60 ft.\nHit: 8\n(1d8 + 4) Force damage. Until the start of the slaad’s next turn, the target has a\ncondition determined by rolling 1d4: on a 1, Charmed; on a 2, Frightened; on a\n3, Poisoned; or on a 4, Incapacitated.\nSpellcasting. The slaad casts one of the following spells, requiring no Material\ncomponents and using Charisma as the spellcasting ability (spell save DC 14):\nAt Will:\nDetect Magic,\nDetect Thoughts,\nMage Hand\n1/Day Each:\nFireball,\nInvisibility (self only)\nBonus Actions\nShape-Shift. The slaad shape-shifts into a Small or Medium Humanoid, or it\nreturns to its true form. Other than its size, its game statistics are the same in\neach form. Any equipment it is wearing or carrying isn’t transformed.\nLarge Aberration, Chaotic Neutral\nDeath Slaad\nSlaad lords create death slaadi by infusing gray slaadi with a portion of their chaotic energy. When groups of slaadi act deliberately, death slaadi are often\nbehind their designs.",
  "sourceRef": {
    "file": "docs/sources/Monster Manual/Monsters (S) - Monster Manual - Dungeons & Dragons - Sources - D&D Beyond.pdf",
    "pages": [],
    "section": "Monsters"
  },
  "notes": []
}
