{
  "id": "monster.adult_black_dragon",
  "name": "ADULT BLACK DRAGON",
  "status": "complete",
  "size_type_alignment": "Huge Dragon (Chromatic), Chaotic Evil",
  "size": "Huge",
  "creature_type": "Dragon (Chromatic)",
  "alignment": "Chaotic Evil",
  "armor_class": 19,
  "hit_points": 195,
  "hit_dice": "17d12 + 85",
  "speed": "40 ft., Fly 80 ft., Swim 40 ft.",
  "abilities": {
    "STR": {
      "score": 23,
      "mod": "+6"
    },
    "DEX": {
      "score": 14,
      "mod": "+2"
    },
    "CON": {
      "score": 21,
      "mod": "+5"
    },
    "INT": {
      "score": 14,
      "mod": "+2"
    },
    "WIS": {
      "score": 13,
      "mod": "+1"
    },
    "CHA": {
      "score": 19,
      "mod": "+4"
    }
  },
  "saves": null,
  "skills": "Perception +11, Stealth +7",
  "resistances": null,
  "immunities": null,
  "vulnerabilities": null,
  "condition_immunities": null,
  "senses": "Blindsight 60 ft., Darkvision 120 ft.; Passive Perception 21",
  "languages": "Common, Draconic",
  "cr": "14 (XP 11,500, or 13,000 in lair; PB +5)",
  "traits": [
    {
      "name": "Amphibious",
      "text": "The dragon can breathe air and water."
    },
    {
      "name": "Legendary Resistance (3/Day, or 4/Day in Lair)",
      "text": "If the dragon fails a saving throw, it can choose to succeed instead."
    }
  ],
  "actions": [
    {
      "name": "Multiattack",
      "text": "The dragon makes three Rend attacks. It can replace one attack with a use of Spellcasting to cast Melf's Acid Arrow (level 3 version)."
    },
    {
      "name": "Rend",
      "text": "Melee Attack Roll: +11, reach 10 ft. Hit: 13 (2d6 + 6) Slashing damage plus 4 (1d8) Acid damage."
    },
    {
      "name": "Acid Breath (Recharge 5-6)",
      "text": "Dexterity Saving Throw: DC 18, each creature in a 60-foot-long, 5-foot-wide Line. Failure: 54 (12d8) Acid damage. Success: Half damage."
    },
    {
      "name": "Spellcasting",
      "text": "The dragon casts one of the following spells, requiring no Material components and using Charisma as the spellcasting ability (spell save DC 17, +9 to hit with spell attacks): At Will: Detect Magic, Fear, Melf's Acid Arrow (level 3 version) 1/Day Each: Speak with Dead,"
    }
  ],
  "bonus_actions": [],
  "reactions": [],
  "legendary_actions": [
    {
      "name": "Cloud of Insects",
      "text": "Dexterity Saving Throw: DC 17, one creature the dragon can see within 120 feet. Failure: 22 (4d10) Poison damage, and the target has Disadvantage on saving throws to maintain Concentration until the end of its next turn. Failure or Success: The dragon can't take this action again until the start of its next turn."
    },
    {
      "name": "Frightful Presence",
      "text": "The dragon uses Spellcasting to cast Fear. The dragon can't take this action again until the start of its next turn."
    },
    {
      "name": "Pounce",
      "text": "The dragon moves up to half its Speed, and it makes one Rend attack. Ancient Black Dragon"
    },
    {
      "name": "Ancient black dragons plot the ruin of whole realms",
      "text": "They seek magic to corrupt the land, raise undead hordes, bind fiends, and replicate magical disasters."
    },
    {
      "name": "Ancient black dragons strive to create vast, dead domains where they are the greatest things that remain",
      "text": "AS TERRIFYING AS IT IS TITANIC, AN ANCIENT BLACK DRAGON ERADICATES UNWANTED LIFE IN ITS DESPOILED TERRITORY"
    }
  ],
  "lair_actions": [],
  "regional_effects": [],
  "raw_text": "AC 19 \tInitiative +12 (22)\nHP 195 (17d12 + 85)\nSpeed 40 ft., Fly 80 ft., Swim 40 ft.\nMOD \tSAVE\nSTR \t23 \t+6 \t+6\nDEX \t14 \t+2 \t+7\nCON \t21 \t+5 \t+5\nMOD \tSAVE\nINT \t14 \t+2 \t+2\nWIS \t13 \t+1 \t+6\nCHA \t19 \t+4 \t+4\nSkills Perception +11, Stealth +7\nImmunities Acid\nSenses Blindsight 60 ft., Darkvision 120 ft.; Passive Perception 21\nLanguages Common, Draconic\nCR 14 (XP 11,500, or 13,000 in lair; PB +5)\nTraits\nAmphibious. The dragon can breathe air and water.\nLegendary Resistance (3/Day, or 4/Day in Lair). If the dragon fails a saving\nthrow, it can choose to succeed instead.\nActions\nMultiattack. The dragon makes three Rend attacks. It can replace one attack\nwith a use of Spellcasting to cast\nMelf’s Acid Arrow (level 3 version).\nRend. Melee Attack Roll: +11, reach 10 ft.\nHit: 13 (2d6 + 6) Slashing damage\nplus 4 (1d8) Acid damage.\nAcid Breath (Recharge 5–6). Dexterity Saving Throw: DC 18, each creature\nin a 60-foot-long, 5-foot-wide Line.\nFailure: 54 (12d8) Acid damage.\nSuccess:\nHalf damage.\nSpellcasting. The dragon casts one of the following spells, requiring no\nMaterial components and using Charisma as the spellcasting ability (spell\nsave DC 17, +9 to hit with spell attacks):\nAt Will:\nDetect Magic,\nFear,\nMelf’s Acid Arrow (level 3 version)\n1/Day Each:\nSpeak with Dead,\nVitriolic Sphere\nLegendary Actions\nLegendary Action Uses: 3 (4 in Lair). Immediately after another creature’s turn,\nthe dragon can expend a use to take one of the following actions. The dragon\nregains all expended uses at the start of each of its turns.\nCloud of Insects. Dexterity Saving Throw: DC 17, one creature the dragon can\nsee within 120 feet.\nFailure: 22 (4d10) Poison damage, and the target has\nDisadvantage on saving throws to maintain Concentration until the end of its\nnext turn.\nFailure or Success: The dragon can’t take this action again until the\nstart of its next turn.\nFrightful Presence. The dragon uses Spellcasting to cast\nFear. The dragon\ncan’t take this action again until the start of its next turn.\nPounce. The dragon moves up to half its Speed, and it makes one Rend attack.\nHuge Dragon (Chromatic), Chaotic Evil\nAncient Black Dragon\nAncient black dragons plot the ruin of whole realms. They seek magic to corrupt the land, raise undead hordes, bind fiends, and replicate magical disasters.\nAncient black dragons strive to create vast, dead domains where they are the greatest things that remain.\nAS TERRIFYING AS IT IS TITANIC, AN ANCIENT BLACK DRAGON\nERADICATES UNWANTED LIFE IN ITS DESPOILED TERRITORY",
  "sourceRef": {
    "file": "docs/sources/Monster Manual/Monsters (B) - Monster Manual - Dungeons & Dragons - Sources - D&D Beyond.pdf",
    "pages": [],
    "section": "Monsters"
  },
  "notes": [
    "Legendary Action Uses: 3 (4 in Lair). Immediately after another creature's turn, the dragon can expend a use to take one of the following actions. The dragon regains all expended uses at the start of each of its turns."
  ]
}
