{
  "id": "monster.abominable_yeti",
  "name": "ABOMINABLE YETI",
  "status": "complete",
  "size_type_alignment": "Huge Monstrosity, Chaotic Evil",
  "size": "Huge",
  "creature_type": "Monstrosity",
  "alignment": "Chaotic Evil",
  "armor_class": 15,
  "hit_points": 137,
  "hit_dice": "11d12 + 66",
  "speed": "40 ft., Climb 40 ft.",
  "abilities": {
    "STR": {
      "score": 24,
      "mod": "+7"
    },
    "DEX": {
      "score": 10,
      "mod": "+0"
    },
    "CON": {
      "score": 22,
      "mod": "+6"
    },
    "INT": {
      "score": 9,
      "mod": "-1"
    },
    "WIS": {
      "score": 13,
      "mod": "+1"
    },
    "CHA": {
      "score": 9,
      "mod": "-1"
    }
  },
  "saves": null,
  "skills": "Perception +9, Stealth +8",
  "resistances": null,
  "immunities": "Cold",
  "vulnerabilities": null,
  "condition_immunities": null,
  "senses": "Darkvision 60 ft.; Passive Perception 19",
  "languages": "Yeti",
  "cr": "9 (XP 5,000; PB +4)",
  "traits": [
    {
      "name": "Fear of Fire",
      "text": "If the yeti takes Fire damage, it has Disadvantage on attack rolls and ability checks until the end of its next turn."
    }
  ],
  "actions": [
    {
      "name": "Multiattack",
      "text": "The yeti can use its Chilling Gaze and makes two attacks, using Claw or Ice Throw in any combination."
    },
    {
      "name": "Claw",
      "text": "Melee Attack Roll: +11, reach 5 ft. Hit: 14 (2d6 + 7) Slashing damage plus 7 (2d6) Cold damage."
    },
    {
      "name": "Ice Throw",
      "text": "Ranged Attack Roll: +11, range 60/240 ft. Hit: 12 (2d4 + 7) Bludgeoning damage plus 7 (2d6) Cold damage."
    },
    {
      "name": "Chilling Gaze",
      "text": "Constitution Saving Throw: DC 18, one creature the yeti can see within 30 feet. Failure: 21 (6d6) Cold damage, and the target has the Paralyzed condition until the start of the yeti's next turn unless the target has Immunity to Cold damage. Success: The target is immune to this yeti's Chilling Gaze for 1 hour."
    },
    {
      "name": "Cold Breath (Recharge 6)",
      "text": "Constitution Saving Throw: DC 18, each creature in a 30-foot Cone. Failure: 45 (10d8) Cold damage. Success: Half damage."
    }
  ],
  "bonus_actions": [],
  "reactions": [],
  "legendary_actions": [],
  "lair_actions": [],
  "regional_effects": [],
  "raw_text": "AC 15 \tInitiative +4 (14)\nHP 137 (11d12 + 66)\nSpeed 40 ft., Climb 40 ft.\nMOD \tSAVE\nSTR \t24 \t+7 \t+7\nDEX \t10 \t+0 \t+0\nCON \t22 \t+6 \t+6\nMOD \tSAVE\nINT \t9 \t-1 \t-1\nWIS \t13 \t+1 \t+1\nCHA \t9 \t-1 \t-1\nSkills Perception +9, Stealth +8\nImmunities Cold\nSenses Darkvision 60 ft.; Passive Perception 19\nLanguages Yeti\nCR 9 (XP 5,000; PB +4)\nTraits\nFear of Fire. If the yeti takes Fire damage, it has Disadvantage on attack rolls and ability checks until the end of its next turn.\nActions\nMultiattack. The yeti can use its Chilling Gaze and makes two attacks, using Claw or Ice Throw in any combination.\nClaw. Melee Attack Roll: +11, reach 5 ft.\nHit: 14 (2d6 + 7) Slashing damage plus 7 (2d6) Cold damage.\nIce Throw. Ranged Attack Roll: +11, range 60/240 ft.\nHit: 12 (2d4 + 7) Bludgeoning damage plus 7 (2d6) Cold damage.\nChilling Gaze. Constitution Saving Throw: DC 18, one creature the yeti can see within 30 feet.\nFailure: 21 (6d6) Cold damage, and the target has the Paralyzed condition until the start of the yeti's next turn unless the target has Immunity to Cold damage.\nSuccess: The target is immune to this yeti's Chilling Gaze for 1 hour.\nCold Breath (Recharge 6). Constitution Saving Throw: DC 18, each creature in a 30-foot Cone.\nFailure: 45 (10d8) Cold damage.\nSuccess: Half damage.\nHuge Monstrosity, Chaotic Evil",
  "sourceRef": {
    "file": "docs/sources/Monster Manual/Monsters (Y) - Monster Manual - Dungeons & Dragons - Sources - D&D Beyond.pdf",
    "pages": [],
    "section": "Monsters"
  },
  "notes": []
}
