{
  "id": "monster.modron_monodrone",
  "name": "MODRON MONODRONE",
  "status": "complete",
  "size_type_alignment": "Medium Construct, Lawful Neutral",
  "size": "Medium",
  "creature_type": "Construct",
  "alignment": "Lawful Neutral",
  "armor_class": 15,
  "hit_points": 5,
  "hit_dice": "1d8 + 1",
  "speed": "30 ft., Fly 30 ft.",
  "abilities": {
    "STR": {
      "score": 10,
      "mod": "+0"
    },
    "DEX": {
      "score": 14,
      "mod": "+2"
    },
    "CON": {
      "score": 12,
      "mod": "+1"
    },
    "INT": {
      "score": 4,
      "mod": "-3"
    },
    "WIS": {
      "score": 10,
      "mod": "+0"
    },
    "CHA": {
      "score": 5,
      "mod": "-3"
    }
  },
  "saves": null,
  "skills": null,
  "resistances": null,
  "immunities": null,
  "vulnerabilities": null,
  "condition_immunities": null,
  "senses": "Truesight 120 ft.; Passive Perception 10",
  "languages": "Modron",
  "cr": "1/8 (XP 25; PB +2)",
  "traits": [
    {
      "name": "Disintegration",
      "text": "If the modron dies, it disintegrates into dust, leaving behind anything it was wearing or carrying."
    }
  ],
  "actions": [
    {
      "name": "Gear",
      "text": "Melee Attack Roll: +4, reach 5 ft. Hit: 6 (1d8 + 2) Force damage. Hit: 6 (1d8 + 2) Force damage."
    }
  ],
  "bonus_actions": [],
  "reactions": [],
  "legendary_actions": [],
  "lair_actions": [],
  "regional_effects": [],
  "raw_text": "AC 15 \tInitiative +2 (12)\nHP 5 (1d8 + 1)\nSpeed 30 ft., Fly 30 ft.\nMOD \tSAVE\nSTR \t10 \t+0 \t+0\nDEX \t14 \t+2 \t+2\nCON \t12 \t+1 \t+1\nMOD \tSAVE\nINT \t4 \t−3 \t−3\nWIS \t10 \t+0 \t+0\nCHA \t5 \t−3 \t−3\nImmunities Charmed\nSenses Truesight 120 ft.; Passive Perception 10\nLanguages Modron\nCR 1/8 (XP 25; PB +2)\nTraits\nDisintegration. If the modron dies, it disintegrates into dust, leaving behind anything it\nwas wearing or carrying.\nActions\nGear. Melee Attack Roll: +4, reach 5 ft.\nHit: 6 (1d8 + 2) Force damage.\nGear Flinger. Ranged Attack Roll: +4, range 120 ft.\nHit: 6 (1d8 + 2) Force damage.\nMedium Construct, Lawful Neutral",
  "sourceRef": {
    "file": "docs/sources/Monster Manual/Monsters (M) - Monster Manual - Dungeons & Dragons - Sources - D&D Beyond.pdf",
    "pages": [],
    "section": "Monsters"
  },
  "notes": []
}
