{
  "id": "monster.ogre_zombie",
  "name": "OGRE ZOMBIE",
  "status": "complete",
  "size_type_alignment": "Large Undead, Neutral Evil",
  "size": "Large",
  "creature_type": "Undead",
  "alignment": "Neutral Evil",
  "armor_class": 8,
  "hit_points": 85,
  "hit_dice": "9d10 + 36",
  "speed": "30 ft.",
  "abilities": {
    "STR": {
      "score": 19,
      "mod": "+4"
    },
    "DEX": {
      "score": 6,
      "mod": "-2"
    },
    "CON": {
      "score": 18,
      "mod": "+4"
    },
    "INT": {
      "score": 3,
      "mod": "-4"
    },
    "WIS": {
      "score": 6,
      "mod": "-2"
    },
    "CHA": {
      "score": 5,
      "mod": "-3"
    }
  },
  "saves": null,
  "skills": null,
  "resistances": null,
  "immunities": "Poison",
  "vulnerabilities": null,
  "condition_immunities": "Exhaustion, Poisoned",
  "senses": "Darkvision 60 ft.; Passive Perception 8",
  "languages": "Understands Common and Giant but canâ€™t speak",
  "cr": "2 (XP 450; PB +2)",
  "traits": [
    {
      "name": "Undead Fortitude",
      "text": "If damage reduces the zombie to 0 Hit Points, it makes a Constitution saving throw (DC 5 plus the damage taken) unless the damage is Radiant or from a Critical Hit. On a successful save, the zombie drops to 1 Hit Point instead."
    }
  ],
  "actions": [
    {
      "name": "Slam",
      "text": "Melee Attack Roll: +6, reach 5 ft. Hit: 13 (2d8 + 4) Bludgeoning damage."
    }
  ],
  "bonus_actions": [],
  "reactions": [],
  "legendary_actions": [],
  "lair_actions": [],
  "regional_effects": [],
  "raw_text": "AC 8 \tInitiative -2 (8)\nHP 85 (9d10 + 36)\nSpeed 30 ft.\nMOD \tSAVE\nSTR \t19 \t+4 \t+4\nDEX \t6 \t-2 \t-2\nCON \t18 \t+4 \t+4\nMOD \tSAVE\nINT \t3 \t-4 \t-4\nWIS \t6 \t-2 \t+0\nCHA \t5 \t-3 \t-3\nImmunities Poison; Exhaustion, Poisoned\nSenses Darkvision 60 ft.; Passive Perception 8\nLanguages Understands Common and Giant but can't speak\nCR 2 (XP 450; PB +2)\nTraits\nUndead Fortitude. If damage reduces the zombie to 0 Hit Points, it makes a Constitution saving throw (DC 5 plus the damage taken) unless the damage is Radiant or from a Critical Hit. On a successful save, the zombie drops to 1 Hit Point instead.\nActions\nSlam. Melee Attack Roll: +6, reach 5 ft.\nHit: 13 (2d8 + 4) Bludgeoning damage.\nLarge Undead, Neutral Evil",
  "sourceRef": {
    "file": "docs/sources/Monster Manual/Monsters (Z) - Monster Manual - Dungeons & Dragons - Sources - D&D Beyond.pdf",
    "pages": [],
    "section": "Monsters"
  },
  "notes": []
}
