{
  "id": "monster.couatl",
  "name": "COUATL",
  "status": "complete",
  "size_type_alignment": "Medium Celestial, Lawful Good",
  "size": "Medium",
  "creature_type": "Celestial",
  "alignment": "Lawful Good",
  "armor_class": 19,
  "hit_points": 60,
  "hit_dice": "8d8 + 24",
  "speed": "30 ft., Fly 90 ft.",
  "abilities": {
    "STR": {
      "score": 16,
      "mod": "+3"
    },
    "DEX": {
      "score": 20,
      "mod": "+5"
    },
    "CON": {
      "score": 17,
      "mod": "+3"
    },
    "INT": {
      "score": 18,
      "mod": "+4"
    },
    "WIS": {
      "score": 20,
      "mod": "+5"
    },
    "CHA": {
      "score": 18,
      "mod": "+4"
    }
  },
  "saves": null,
  "skills": null,
  "resistances": null,
  "immunities": null,
  "vulnerabilities": null,
  "condition_immunities": null,
  "senses": "Truesight 120 ft.; Passive Perception 15",
  "languages": "All; telepathy 120 ft.",
  "cr": "4 (XP 1,100; PB +2)",
  "traits": [
    {
      "name": "Shielded Mind",
      "text": "The couatl's thoughts can't be read by any means, and other creatures can communicate with it telepathically only if it allows them."
    }
  ],
  "actions": [
    {
      "name": "Bite",
      "text": "Melee Attack Roll: +7, reach 5 ft. Hit: 11 (1d12 + 5) Piercing damage, and the target has the Poisoned condition until the end of the couatl's next turn."
    },
    {
      "name": "Constrict",
      "text": "Strength Saving Throw: DC 15, one Medium or smaller creature the couatl can see within 5 feet. Failure: 8 (1d6 + 5) Bludgeoning damage. The target has the Grappled condition (escape DC 13), and it has the Restrained condition until the grapple ends."
    },
    {
      "name": "Spellcasting",
      "text": "The couatl casts one of the following spells, requiring no spell components and using Wisdom as the spellcasting ability (spell save DC 15): At Will: Detect Evil and Good, Detect Magic, Detect Thoughts, Shapechange (Beast or Humanoid form only, no Temporary Hit Points gained from the spell, and no Concentration or Temporary Hit Points required to maintain the spell) 1/Day Each: Create Food and Water, Dream, Greater Restoration, Scrying, Sleep"
    }
  ],
  "bonus_actions": [
    {
      "name": "Divine Aid (2/Day)",
      "text": "The couatl casts Bless, Lesser Restoration, or Sanctuary, requiring no spell components and using the same spellcasting ability as Spellcasting."
    }
  ],
  "reactions": [],
  "legendary_actions": [],
  "lair_actions": [],
  "regional_effects": [],
  "raw_text": "AC 19 \tInitiative +5 (15)\nHP 60 (8d8 + 24)\nSpeed 30 ft., Fly 90 ft.\nMOD \tSAVE\nSTR \t16 \t+3 \t+3\nDEX \t20 \t+5 \t+5\nCON \t17 \t+3 \t+5\nMOD \tSAVE\nINT \t18 \t+4 \t+4\nWIS \t20 \t+5 \t+7\nCHA \t18 \t+4 \t+4\nResistances Bludgeoning, Piercing, Slashing\nImmunities Psychic, Radiant\nSenses Truesight 120 ft.; Passive Perception 15\nLanguages All; telepathy 120 ft.\nCR 4 (XP 1,100; PB +2)\nTraits\nShielded Mind. The couatl’s thoughts can’t be read by any means, and other\ncreatures can communicate with it telepathically only if it allows them.\nActions\nBite. Melee Attack Roll: +7, reach 5 ft.\nHit: 11 (1d12 + 5) Piercing damage, and\nthe target has the Poisoned condition until the end of the couatl’s next turn.\nConstrict. Strength Saving Throw: DC 15, one Medium or smaller creature the\ncouatl can see within 5 feet.\nFailure: 8 (1d6 + 5) Bludgeoning damage. The\ntarget has the Grappled condition (escape DC 13), and it has the Restrained\ncondition until the grapple ends.\nSpellcasting. The couatl casts one of the following spells, requiring no spell\ncomponents and using Wisdom as the spellcasting ability (spell save DC 15):\nAt Will:\nDetect Evil and Good,\nDetect Magic,\nDetect Thoughts,\nShapechange\n(Beast or Humanoid form only, no Temporary Hit Points gained from the spell,\nand no Concentration or Temporary Hit Points required to maintain the spell)\n1/Day Each:\nCreate Food and Water,\nDream,\nGreater Restoration,\nScrying,\nSleep\nBonus Actions\nDivine Aid (2/Day). The couatl casts\nBless,\nLesser Restoration, or\nSanctuary,\nrequiring no spell components and using the same spellcasting ability\nas Spellcasting.\nMedium Celestial, Lawful Good",
  "sourceRef": {
    "file": "docs/sources/Monster Manual/Monsters (C) - Monster Manual - Dungeons & Dragons - Sources - D&D Beyond.pdf",
    "pages": [],
    "section": "Monsters"
  },
  "notes": []
}
