{
  "id": "monster.scout",
  "name": "SCOUT",
  "status": "complete",
  "size_type_alignment": "Medium or Small Humanoid, Neutral",
  "size": "Medium",
  "creature_type": "Humanoid",
  "alignment": "Neutral",
  "armor_class": 13,
  "hit_points": 16,
  "hit_dice": "3d8 + 3",
  "speed": "30 ft.",
  "abilities": {
    "STR": {
      "score": 11,
      "mod": "+0"
    },
    "DEX": {
      "score": 14,
      "mod": "+2"
    },
    "CON": {
      "score": 12,
      "mod": "+1"
    },
    "INT": {
      "score": 11,
      "mod": "+0"
    },
    "WIS": {
      "score": 13,
      "mod": "+1"
    },
    "CHA": {
      "score": 11,
      "mod": "+0"
    }
  },
  "saves": null,
  "skills": "Nature +4, Perception +5, Stealth +6, Survival +5",
  "resistances": null,
  "immunities": null,
  "vulnerabilities": null,
  "condition_immunities": null,
  "senses": "Passive Perception 15",
  "languages": "Common plus one other language",
  "cr": "1/2 (XP 100; PB +2)",
  "traits": [],
  "actions": [
    {
      "name": "Multiattack",
      "text": "The scout makes two attacks, using Shortsword and Longbow in any combination."
    },
    {
      "name": "Shortsword",
      "text": "Melee Attack Roll: +4, reach 5 ft. Hit: 5 (1d6 + 2) Piercing damage."
    },
    {
      "name": "Longbow",
      "text": "Ranged Attack Roll: +4, range 150/600 ft. Hit: 6 (1d8 + 2) Piercing damage."
    }
  ],
  "bonus_actions": [],
  "reactions": [],
  "legendary_actions": [],
  "lair_actions": [],
  "regional_effects": [],
  "raw_text": "AC 13 \tInitiative +2 (12)\nHP 16 (3d8 + 3)\nSpeed 30 ft.\nMOD \tSAVE\nSTR \t11 \t+0 \t+0\nDEX \t14 \t+2 \t+2\nCON \t12 \t+1 \t+1\nMOD \tSAVE\nINT \t11 \t+0 \t+0\nWIS \t13 \t+1 \t+1\nCHA \t11 \t+0 \t+0\nSkills Nature +4, Perception +5, Stealth +6, Survival +5\nGear Leather Armor, Longbow, Shortsword\nSenses Passive Perception 15\nLanguages Common plus one other language\nCR 1/2 (XP 100; PB +2)\nActions\nMultiattack. The scout makes two attacks, using Shortsword and\nLongbow in any combination.\nShortsword. Melee Attack Roll: +4, reach 5 ft.\nHit: 5 (1d6 + 2)\nPiercing damage.\nLongbow. Ranged Attack Roll: +4, range 150/600 ft.\nHit: 6 (1d8 + 2)\nPiercing damage.\nMedium or Small Humanoid, Neutral",
  "sourceRef": {
    "file": "docs/sources/Monster Manual/Monsters (S) - Monster Manual - Dungeons & Dragons - Sources - D&D Beyond.pdf",
    "pages": [],
    "section": "Monsters"
  },
  "notes": []
}
