{
  "id": "monster.water_weird",
  "name": "WATER WEIRD",
  "status": "complete",
  "size_type_alignment": "Large Elemental, Neutral",
  "size": "Large",
  "creature_type": "Elemental",
  "alignment": "Neutral",
  "armor_class": 13,
  "hit_points": 65,
  "hit_dice": "10d10 + 10",
  "speed": "5 ft., Swim 60 ft.",
  "abilities": {
    "STR": {
      "score": 17,
      "mod": "+3"
    },
    "DEX": {
      "score": 16,
      "mod": "+3"
    },
    "CON": {
      "score": 13,
      "mod": "+1"
    },
    "INT": {
      "score": 11,
      "mod": "+0"
    },
    "WIS": {
      "score": 10,
      "mod": "+0"
    },
    "CHA": {
      "score": 10,
      "mod": "+0"
    }
  },
  "saves": null,
  "skills": null,
  "resistances": null,
  "immunities": null,
  "vulnerabilities": null,
  "condition_immunities": null,
  "senses": "Blindsight 30 ft.; Passive Perception 10",
  "languages": "Understands Primordial but can’t speak",
  "cr": "3 (XP 700; PB +2)",
  "traits": [
    {
      "name": "Invisible in Water",
      "text": "The water weird has the Invisible condition while fully immersed in water."
    },
    {
      "name": "Water Bound",
      "text": "The water weird dies if it leaves the water to which it is bound or if that water is destroyed."
    }
  ],
  "actions": [
    {
      "name": "Surge",
      "text": "Melee Attack Roll: +5, reach 10 ft. Hit: 13 (3d6 + 3) Cold damage. If the target is a Medium or smaller creature, it has the Grappled condition (escape DC 13), and it has the Restrained condition until the grapple ends."
    }
  ],
  "bonus_actions": [],
  "reactions": [],
  "legendary_actions": [],
  "lair_actions": [],
  "regional_effects": [],
  "raw_text": "AC 13 \tInitiative +3 (13)\nHP 65 (10d10 + 10)\nSpeed 5 ft., Swim 60 ft.\nMOD \tSAVE\nSTR \t17 \t+3 \t+3\nDEX \t16 \t+3 \t+3\nCON \t13 \t+1 \t+1\nMOD \tSAVE\nINT \t11 \t+0 \t+0\nWIS \t10 \t+0 \t+0\nCHA \t10 \t+0 \t+0\nResistances Fire\nImmunities Poison; Exhaustion, Grappled, Paralyzed, Petrified, Poisoned, Prone,\nRestrained, Unconscious\nSenses Blindsight 30 ft.; Passive Perception 10\nLanguages Understands Primordial but can’t speak\nCR 3 (XP 700; PB +2)\nTraits\nInvisible in Water. The water weird has the Invisible condition while fully immersed in water.\nWater Bound. The water weird dies if it leaves the water to which it is bound or if that water\nis destroyed.\nActions\nSurge. Melee Attack Roll: +5, reach 10 ft.\nHit: 13 (3d6 + 3) Cold damage. If the target is a Medium or\nsmaller creature, it has the Grappled condition (escape DC 13), and it has the Restrained condition\nuntil the grapple ends.\nLarge Elemental, Neutral",
  "sourceRef": {
    "file": "docs/sources/Monster Manual/Monsters (W) - Monster Manual - Dungeons & Dragons - Sources - D&D Beyond.pdf",
    "pages": [],
    "section": "Monsters"
  },
  "notes": []
}
