{
  "id": "monster.scout_captain",
  "name": "SCOUT CAPTAIN",
  "status": "complete",
  "size_type_alignment": "Medium or Small Humanoid, Neutral",
  "size": "Medium",
  "creature_type": "Humanoid",
  "alignment": "Neutral",
  "armor_class": 15,
  "hit_points": 66,
  "hit_dice": "12d8 + 12",
  "speed": "30 ft., Climb 30 ft.",
  "abilities": {
    "STR": {
      "score": 11,
      "mod": "+0"
    },
    "DEX": {
      "score": 16,
      "mod": "+3"
    },
    "CON": {
      "score": 12,
      "mod": "+1"
    },
    "INT": {
      "score": 14,
      "mod": "+2"
    },
    "WIS": {
      "score": 15,
      "mod": "+2"
    },
    "CHA": {
      "score": 11,
      "mod": "+0"
    }
  },
  "saves": null,
  "skills": "Perception +6, Stealth +7, Survival +6",
  "resistances": null,
  "immunities": null,
  "vulnerabilities": null,
  "condition_immunities": null,
  "senses": "Passive Perception 16",
  "languages": "Common plus one other language",
  "cr": "3 (XP 700; PB +2)",
  "traits": [],
  "actions": [
    {
      "name": "Multiattack",
      "text": "The scout makes two attacks, using Shortsword or Longbow in any combination."
    },
    {
      "name": "Shortsword",
      "text": "Melee Attack Roll: +5, reach 5 ft. Hit: 6 (1d6 + 3) Piercing damage, plus 10 (3d6) Piercing damage if the attack was made with Advantage."
    },
    {
      "name": "Longbow",
      "text": "Ranged Attack Roll: +5, range 150/600 ft. Hit: 7 (1d8 + 3) Piercing damage, plus 10 (3d6) Piercing damage if the attack was made with Advantage."
    }
  ],
  "bonus_actions": [],
  "reactions": [],
  "legendary_actions": [],
  "lair_actions": [],
  "regional_effects": [],
  "raw_text": "AC 15 \tInitiative +5 (15)\nHP 66 (12d8 + 12)\nSpeed 30 ft., Climb 30 ft.\nMOD \tSAVE\nSTR \t11 \t+0 \t+0\nDEX \t16 \t+3 \t+5\nCON \t12 \t+1 \t+1\nMOD \tSAVE\nINT \t14 \t+2 \t+4\nWIS \t15 \t+2 \t+2\nCHA \t11 \t+0 \t+0\nSkills Perception +6, Stealth +7, Survival +6\nGear Longbow, Shortsword, Studded Leather Armor\nSenses Passive Perception 16\nLanguages Common plus one other language\nCR 3 (XP 700; PB +2)\nActions\nMultiattack. The scout makes two attacks, using Shortsword or Longbow in\nany combination.\nShortsword. Melee Attack Roll: +5, reach 5 ft.\nHit: 6 (1d6 + 3) Piercing damage,\nplus 10 (3d6) Piercing damage if the attack was made with Advantage.\nLongbow. Ranged Attack Roll: +5, range 150/600 ft.\nHit: 7 (1d8 + 3) Piercing\ndamage, plus 10 (3d6) Piercing damage if the attack was made with Advantage.\nMedium or Small Humanoid, Neutral\nSea Hag\nHag of Despair and the Dismal Deep\nHabitat: Coastal, Underwater; Treasure: Arcana\nSea hags loathe peace and beauty. Bitter, jealous creatures, they spread chaos\nand undermine joy however they can, undertaking elaborate deceptions to sow\ndiscord for its own sake. The hags’ true forms are supernaturally vile, and their\nbaleful gazes can strike down creatures frightened by their appearance.\nSea hags cloak themselves in illusions to work their schemes. Roll on or choose a\nresult from the Sea Hag Disguises table to inspire a sea hag’s illusion and how\nthey might use it to wreak chaos and destruction.\nSea Hag Disguises\n1d6 \tThe Sea Hag Takes the Form of A...\n1 Captive and claims nearby villagers bound them and left them to\ndrown.\n2 Castaway and shares a cursed item’s location with would-be\nrescuers.\n3 \tHealer and passes off poisons as medicine.\n4 \tPanic-spreading prophesier of doom.\n5 \tShip captain and delivers passengers to the hag’s pet sea monster.\n6 Wounded sailor and claims their ship was destroyed by merfolk or\nother peaceful people.\nBonus Actions\nAim. The scout has Advantage on the next attack roll it makes during the\ncurrent turn.\nReactions\nUncanny Dodge. Trigger: The scout is hit by an attack roll.\nResponse: The\nscout halves the damage (round down) it takes from that attack.",
  "sourceRef": {
    "file": "docs/sources/Monster Manual/Monsters (S) - Monster Manual - Dungeons & Dragons - Sources - D&D Beyond.pdf",
    "pages": [],
    "section": "Monsters"
  },
  "notes": []
}
