{
  "id": "monster.cloud_giant",
  "name": "CLOUD GIANT",
  "status": "complete",
  "size_type_alignment": "Huge Giant, Neutral",
  "size": "Huge",
  "creature_type": "Giant",
  "alignment": "Neutral",
  "armor_class": 14,
  "hit_points": 200,
  "hit_dice": "16d12 + 96",
  "speed": "40 ft., Fly 20 ft. (hover)",
  "abilities": {
    "STR": {
      "score": 27,
      "mod": "+8"
    },
    "DEX": {
      "score": 10,
      "mod": "+0"
    },
    "CON": {
      "score": 22,
      "mod": "+6"
    },
    "INT": {
      "score": 12,
      "mod": "+1"
    },
    "WIS": {
      "score": 16,
      "mod": "+3"
    },
    "CHA": {
      "score": 16,
      "mod": "+3"
    }
  },
  "saves": null,
  "skills": "Insight +7, Perception +11",
  "resistances": null,
  "immunities": null,
  "vulnerabilities": null,
  "condition_immunities": null,
  "senses": "Passive Perception 21",
  "languages": "Common, Giant",
  "cr": "9 (XP 5,000; PB +4)",
  "traits": [],
  "actions": [
    {
      "name": "Multiattack",
      "text": "The giant makes two attacks, using Thunderous Mace or Thundercloud in any combination. It can replace one attack with a use of Spellcasting to cast Fog Cloud."
    },
    {
      "name": "Thunderous Mace",
      "text": "Melee Attack Roll: +12, reach 10 ft. Hit: 21 (3d8 + 8) Bludgeoning damage plus 7 (2d6) Thunder damage."
    },
    {
      "name": "Thundercloud",
      "text": "Ranged Attack Roll: +12, range 240 ft. Hit: 18 (3d6 + 8) Thunder damage, and the target has the Incapacitated condition until the end of its next turn."
    },
    {
      "name": "Spellcasting",
      "text": "The giant casts one of the following spells, requiring no Material components and using Charisma as the spellcasting ability (spell save DC 15): At Will: Detect Magic, Fog Cloud, Light 1/Day Each: Control Weather, Gaseous Form, Telekinesis"
    }
  ],
  "bonus_actions": [
    {
      "name": "Misty Step",
      "text": "The giant casts the Misty Step spell, using the same spellcasting ability as Spellcasting."
    }
  ],
  "reactions": [],
  "legendary_actions": [],
  "lair_actions": [],
  "regional_effects": [],
  "raw_text": "AC 14 \tInitiative +4 (14)\nHP 200 (16d12 + 96)\nSpeed 40 ft., Fly 20 ft. (hover)\nMOD \tSAVE\nSTR \t27 \t+8 \t+8\nDEX \t10 \t+0 \t+0\nCON \t22 \t+6 \t+10\nMOD \tSAVE\nINT \t12 \t+1 \t+1\nWIS \t16 \t+3 \t+7\nCHA \t16 \t+3 \t+3\nSkills Insight +7, Perception +11\nSenses Passive Perception 21\nLanguages Common, Giant\nCR 9 (XP 5,000; PB +4)\nActions\nMultiattack. The giant makes two attacks, using Thunderous Mace or\nThundercloud in any combination. It can replace one attack with a use of\nSpellcasting to cast\nFog Cloud.\nThunderous Mace. Melee Attack Roll: +12, reach 10 ft.\nHit: 21 (3d8 + 8)\nBludgeoning damage plus 7 (2d6) Thunder damage.\nThundercloud. Ranged Attack Roll: +12, range 240 ft.\nHit: 18 (3d6 + 8) Thunder\ndamage, and the target has the Incapacitated condition until the end of its\nnext turn.\nSpellcasting. The giant casts one of the following spells, requiring no Material\ncomponents and using Charisma as the spellcasting ability (spell save DC 15):\nAt Will:\nDetect Magic,\nFog Cloud,\nLight\n1/Day Each:\nControl Weather,\nGaseous Form,\nTelekinesis\nBonus Actions\nMisty Step. The giant casts the\nMisty Step spell, using the same spellcasting\nability as Spellcasting.\nHuge Giant, Neutral\nCockatrices\nAccursed Avians with the Power to Petrify\nHabitat: Grassland; Treasure: None\nCockatrices combine the features of irate roosters and starving reptiles. They petrify those they bite, their slightest peck turning their prey to stone.\nCockatrice\nCockatrices often try to claim eye-catching structures—such as ruins and secluded farms—as roosts.\nCockatrice Regent\nBolder than their smaller cousins, cockatrice regents brim with unstable magical energy they use to restrain distant foes.",
  "sourceRef": {
    "file": "docs/sources/Monster Manual/Monsters (C) - Monster Manual - Dungeons & Dragons - Sources - D&D Beyond.pdf",
    "pages": [],
    "section": "Monsters"
  },
  "notes": []
}
