{
  "id": "monster.adult_blue_dragon",
  "name": "ADULT BLUE DRAGON",
  "status": "complete",
  "size_type_alignment": "Huge Dragon (Chromatic), Lawful Evil",
  "size": "Huge",
  "creature_type": "Dragon (Chromatic)",
  "alignment": "Lawful Evil",
  "armor_class": 19,
  "hit_points": 212,
  "hit_dice": "17d12 + 102",
  "speed": "40 ft., Burrow 30 ft., Fly 80 ft.",
  "abilities": {
    "STR": {
      "score": 25,
      "mod": "+7"
    },
    "DEX": {
      "score": 10,
      "mod": "+0"
    },
    "CON": {
      "score": 23,
      "mod": "+6"
    },
    "INT": {
      "score": 16,
      "mod": "+3"
    },
    "WIS": {
      "score": 15,
      "mod": "+2"
    },
    "CHA": {
      "score": 20,
      "mod": "+5"
    }
  },
  "saves": null,
  "skills": "Perception +12, Stealth +5",
  "resistances": null,
  "immunities": null,
  "vulnerabilities": null,
  "condition_immunities": null,
  "senses": "Blindsight 60 ft., Darkvision 120 ft.; Passive Perception 22",
  "languages": "Common, Draconic",
  "cr": "16 (XP 15,000, or 18,000 in lair; PB +5)",
  "traits": [
    {
      "name": "Legendary Resistance (3/Day, or 4/Day in Lair)",
      "text": "If the dragon fails a saving throw, it can choose to succeed instead."
    }
  ],
  "actions": [
    {
      "name": "Multiattack",
      "text": "The dragon makes three Rend attacks. It can replace one attack with a use of Spellcasting to cast Shatter."
    },
    {
      "name": "Rend",
      "text": "Melee Attack Roll: +12, reach 10 ft. Hit: 16 (2d8 + 7) Slashing damage plus 5 (1d10) Lightning damage."
    },
    {
      "name": "Lightning Breath (Recharge 5-6)",
      "text": "Dexterity Saving Throw: DC 19, each creature in a 90-foot-long, 5-foot-wide Line. Failure: 60 (11d10) Lightning damage. Success: Half damage."
    },
    {
      "name": "Spellcasting",
      "text": "The dragon casts one of the following spells, requiring no Material components and using Charisma as the spellcasting ability (spell save DC 18): At Will: Detect Magic, Invisibility, Mage Hand, Shatter 1/Day Each: Scrying,"
    }
  ],
  "bonus_actions": [],
  "reactions": [],
  "legendary_actions": [
    {
      "name": "Cloaked Flight",
      "text": "The dragon uses Spellcasting to cast Invisibility on itself, and it can fly up to half its Fly Speed. The dragon can't take this action again until the start of its next turn."
    },
    {
      "name": "Sonic Boom",
      "text": "The dragon uses Spellcasting to cast Shatter. The dragon can't take this action again until the start of its next turn."
    },
    {
      "name": "Tail Swipe",
      "text": "The dragon makes one Rend attack."
    },
    {
      "name": "Ancient blue dragons think beyond dominating groups of short-lived servants",
      "text": "Instead, they seek to claim their places above other dragons and their world's most powerful inhabitants. If world domination seems too tedious or cliché, these dragons might seek to seize control of extraplanar realms, multiworld empires, or forces of reality-like life, storms, or time itself. SHATTERING THE ENEMY'S DEFENSES, AN ANCIENT BLUE DRAGON LEADS ITS ARMIES IN CONQUEST"
    }
  ],
  "lair_actions": [],
  "regional_effects": [],
  "raw_text": "AC 19 \tInitiative +10 (20)\nHP 212 (17d12 + 102)\nSpeed 40 ft., Burrow 30 ft., Fly 80 ft.\nMOD \tSAVE\nSTR \t25 \t+7 \t+7\nDEX \t10 \t+0 \t+5\nCON \t23 \t+6 \t+6\nMOD \tSAVE\nINT \t16 \t+3 \t+3\nWIS \t15 \t+2 \t+7\nCHA \t20 \t+5 \t+5\nSkills Perception +12, Stealth +5\nImmunities Lightning\nSenses Blindsight 60 ft., Darkvision 120 ft.; Passive Perception 22\nLanguages Common, Draconic\nCR 16 (XP 15,000, or 18,000 in lair; PB +5)\nTraits\nLegendary Resistance (3/Day, or 4/Day in Lair). If the dragon fails a saving\nthrow, it can choose to succeed instead.\nActions\nMultiattack. The dragon makes three Rend attacks. It can replace one attack\nwith a use of Spellcasting to cast\nShatter.\nRend. Melee Attack Roll: +12, reach 10 ft.\nHit: 16 (2d8 + 7) Slashing damage\nplus 5 (1d10) Lightning damage.\nLightning Breath (Recharge 5–6). Dexterity Saving Throw: DC 19, each creature\nin a 90-foot-long, 5-foot-wide Line.\nFailure: 60 (11d10) Lightning damage.\nSuccess: Half damage.\nSpellcasting. The dragon casts one of the following spells, requiring no\nMaterial components and using Charisma as the spellcasting ability (spell\nsave DC 18):\nAt Will:\nDetect Magic,\nInvisibility,\nMage Hand,\nShatter\n1/Day Each:\nScrying,\nSending\nLegendary Actions\nLegendary Action Uses: 3 (4 in Lair). Immediately after another creature’s turn,\nthe dragon can expend a use to take one of the following actions. The dragon\nregains all expended uses at the start of each of its turns.\nCloaked Flight. The dragon uses Spellcasting to cast\nInvisibility on itself, and\nit can fly up to half its Fly Speed. The dragon can’t take this action again until\nthe start of its next turn.\nSonic Boom. The dragon uses Spellcasting to cast\nShatter. The dragon can’t\ntake this action again until the start of its next turn.\nTail Swipe. The dragon makes one Rend attack.\nHuge Dragon (Chromatic), Lawful Evil\nAncient blue dragons think beyond dominating groups of short-lived servants. Instead, they seek to claim their places above other dragons and their world’s\nmost powerful inhabitants. If world domination seems too tedious or cliché, these dragons might seek to seize control of extraplanar realms, multiworld\nempires, or forces of reality—like life, storms, or time itself.\nSHATTERING THE ENEMY’S DEFENSES, AN ANCIENT\nBLUE DRAGON LEADS ITS ARMIES IN CONQUEST",
  "sourceRef": {
    "file": "docs/sources/Monster Manual/Monsters (B) - Monster Manual - Dungeons & Dragons - Sources - D&D Beyond.pdf",
    "pages": [],
    "section": "Monsters"
  },
  "notes": [
    "Legendary Action Uses: 3 (4 in Lair). Immediately after another creature's turn, the dragon can expend a use to take one of the following actions. The dragon regains all expended uses at the start of each of its turns."
  ]
}
