{
  "id": "monster.bulette",
  "name": "BULETTE",
  "status": "complete",
  "size_type_alignment": "Large Monstrosity, Unaligned",
  "size": "Large",
  "creature_type": "Monstrosity",
  "alignment": "Unaligned",
  "armor_class": 17,
  "hit_points": 94,
  "hit_dice": "9d10 + 45",
  "speed": "40 ft., Burrow 40 ft.",
  "abilities": {
    "STR": {
      "score": 19,
      "mod": "+4"
    },
    "DEX": {
      "score": 11,
      "mod": "+0"
    },
    "CON": {
      "score": 21,
      "mod": "+5"
    },
    "INT": {
      "score": 2,
      "mod": "-4"
    },
    "WIS": {
      "score": 10,
      "mod": "+0"
    },
    "CHA": {
      "score": 5,
      "mod": "-3"
    }
  },
  "saves": null,
  "skills": "Perception +6",
  "resistances": null,
  "immunities": null,
  "vulnerabilities": null,
  "condition_immunities": null,
  "senses": "Darkvision 60 ft., Tremorsense 120 ft.; Passive Perception 16",
  "languages": "None",
  "cr": "5 (XP 1,800; PB +3)",
  "traits": [],
  "actions": [
    {
      "name": "Multiattack",
      "text": "The bulette makes two Bite attacks."
    },
    {
      "name": "Bite",
      "text": "Melee Attack Roll: +7, reach 5 ft. Hit: 17 (2d12 + 4) Piercing damage."
    },
    {
      "name": "Deadly Leap",
      "text": "The bulette spends 5 feet of movement to jump to a space within 15 feet that contains one or more Large or smaller creatures. Dexterity Saving Throw: DC 15, each creature in the bulette's destination space. Failure: 19 (3d12) Bludgeoning damage, and the target has the Prone condition. Success: Half damage, and the target is pushed 5 feet straight away from the bulette."
    }
  ],
  "bonus_actions": [
    {
      "name": "Leap",
      "text": "The bulette jumps up to 30 feet by spending 10 feet of movement."
    }
  ],
  "reactions": [],
  "legendary_actions": [],
  "lair_actions": [],
  "regional_effects": [],
  "raw_text": "AC 17 \tInitiative +0 (10)\nHP 94 (9d10 + 45)\nSpeed 40 ft., Burrow 40 ft.\tLarge Monstrosity, Unaligned\nBulette Pup\nJuvenile bulettes are known as pups. They travel in small groups, using their numbers to bring down larger foes. Their arrival frequently presages the\nappearance of an adult bulette.\nBullywugs\nAmphibious Appreciators of Marsh and Muck\nHabitat: Swamp; Treasure: Implements, Individual\nFey embodiments of swamplands, bullywugs protect the murky wilds and consider themselves cosmically favored for that role. These human-size, toad- or\nfrog-like creatures have close relationships with the creatures of the swamp.\nBullywug Bog Sage\nMOD \tSAVE\nSTR \t19 \t+4 \t+4\nDEX \t11 \t+0 \t+0\nCON \t21 \t+5 \t+5\nMOD \tSAVE\nINT \t2 \t−4 \t−4\nWIS \t10 \t+0 \t+0\nCHA \t5 \t−3 \t−3\nSkills Perception +6\nSenses Darkvision 60 ft., Tremorsense 120 ft.; Passive Perception 16\nLanguages None\nCR 5 (XP 1,800; PB +3)\nActions\nMultiattack. The bulette makes two Bite attacks.\nBite. Melee Attack Roll: +7, reach 5 ft.\nHit: 17 (2d12 + 4) Piercing damage.\nDeadly Leap. The bulette spends 5 feet of movement to jump to a space within\n15 feet that contains one or more Large or smaller creatures.\nDexterity Saving\nThrow: DC 15, each creature in the bulette’s destination space.\nFailure: 19\n(3d12) Bludgeoning damage, and the target has the Prone condition.\nSuccess:\nHalf damage, and the target is pushed 5 feet straight away from the bulette.\nBonus Actions\nLeap. The bulette jumps up to 30 feet by spending 10 feet of movement.",
  "sourceRef": {
    "file": "docs/sources/Monster Manual/Monsters (B) - Monster Manual - Dungeons & Dragons - Sources - D&D Beyond.pdf",
    "pages": [],
    "section": "Monsters"
  },
  "notes": []
}
