{
  "id": "monster.primeval_owlbear",
  "name": "PRIMEVAL OWLBEAR",
  "status": "complete",
  "size_type_alignment": "Huge Monstrosity, Unaligned",
  "size": "Huge",
  "creature_type": "Monstrosity",
  "alignment": "Unaligned",
  "armor_class": 16,
  "hit_points": 126,
  "hit_dice": "12d12 + 48",
  "speed": "40 ft., Climb 40 ft., Fly 5 ft.",
  "abilities": {
    "STR": {
      "score": 22,
      "mod": "+6"
    },
    "DEX": {
      "score": 14,
      "mod": "+2"
    },
    "CON": {
      "score": 19,
      "mod": "+4"
    },
    "INT": {
      "score": 8,
      "mod": "-1"
    },
    "WIS": {
      "score": 15,
      "mod": "+2"
    },
    "CHA": {
      "score": 7,
      "mod": "-2"
    }
  },
  "saves": null,
  "skills": "Perception +8",
  "resistances": null,
  "immunities": null,
  "vulnerabilities": null,
  "condition_immunities": null,
  "senses": "Darkvision 120 ft.; Passive Perception 18",
  "languages": "None",
  "cr": "7 (XP 2,900; PB +3)",
  "traits": [
    {
      "name": "Magic Resistance",
      "text": "The owlbear has Advantage on saving throws against spells and other magical effects."
    }
  ],
  "actions": [
    {
      "name": "Multiattack",
      "text": "The owlbear makes two Ravage attacks."
    },
    {
      "name": "Ravage",
      "text": "Melee Attack Roll: +9, reach 5 ft. Hit: 15 (2d8 + 6) Slashing damage. If the target is a Huge or smaller creature and the owlbear moved 20+ feet straight toward it immediately before the hit, the target takes an extra 9 (2d8) Slashing damage and has the Prone condition."
    },
    {
      "name": "Screech (Recharge 5-6)",
      "text": "Constitution Saving Throw: DC 15, each creature in a 30-foot Emanation originating from the owlbear. Failure: 27 (6d8) Thunder damage, and the target has the Incapacitated condition until the end of its next turn. Success: Half damage only."
    }
  ],
  "bonus_actions": [],
  "reactions": [],
  "legendary_actions": [],
  "lair_actions": [],
  "regional_effects": [],
  "raw_text": "AC 16 \tInitiative +5 (15)\nHP 126 (12d12 + 48)\nSpeed 40 ft., Climb 40 ft., Fly 5 ft.\nMOD \tSAVE\nSTR \t22 \t+6 \t+6\nDEX \t14 \t+2 \t+2\nCON \t19 \t+4 \t+7\nMOD \tSAVE\nINT \t8 \t−1 \t−1\nWIS \t15 \t+2 \t+5\nCHA \t7 \t−2 \t−2\nSkills Perception +8\nSenses Darkvision 120 ft.; Passive Perception 18\nLanguages None\nCR 7 (XP 2,900; PB +3)\nTraits\nMagic Resistance. The owlbear has Advantage on saving throws against\nspells and other magical effects.\nActions\nMultiattack. The owlbear makes two Ravage attacks.\nRavage. Melee Attack Roll: +9, reach 5 ft.\nHit: 15 (2d8 + 6) Slashing damage. If\nthe target is a Huge or smaller creature and the owlbear moved 20+ feet\nstraight toward it immediately before the hit, the target takes an extra 9 (2d8)\nSlashing damage and has the Prone condition.\nScreech (Recharge 5–6). Constitution Saving Throw: DC 15, each creature in a\n30-foot Emanation originating from the owlbear.\nFailure: 27 (6d8) Thunder\ndamage, and the target has the Incapacitated condition until the end of its next\nturn.\nSuccess: Half damage only.\nHuge Monstrosity, Unaligned",
  "sourceRef": {
    "file": "docs/sources/Monster Manual/Monsters (O) - Monster Manual - Dungeons & Dragons - Sources - D&D Beyond.pdf",
    "pages": [],
    "section": "Monsters"
  },
  "notes": []
}
