{
  "id": "monster.young_brass_dragon",
  "name": "YOUNG BRASS DRAGON",
  "status": "complete",
  "size_type_alignment": "Large Dragon (Metallic), Chaotic Good",
  "size": "Large",
  "creature_type": "Dragon (Metallic)",
  "alignment": "Chaotic Good",
  "armor_class": 17,
  "hit_points": 110,
  "hit_dice": "13d10 + 39",
  "speed": "40 ft., Burrow 20 ft., Fly 80 ft.",
  "abilities": {
    "STR": {
      "score": 19,
      "mod": "+4"
    },
    "DEX": {
      "score": 10,
      "mod": "+0"
    },
    "CON": {
      "score": 17,
      "mod": "+3"
    },
    "INT": {
      "score": 12,
      "mod": "+1"
    },
    "WIS": {
      "score": 11,
      "mod": "+0"
    },
    "CHA": {
      "score": 15,
      "mod": "+2"
    }
  },
  "saves": null,
  "skills": "Perception +6, Persuasion +5, Stealth +3",
  "resistances": null,
  "immunities": null,
  "vulnerabilities": null,
  "condition_immunities": null,
  "senses": "Blindsight 30 ft., Darkvision 120 ft.; Passive Perception 16",
  "languages": "Common, Draconic",
  "cr": "6 (XP 2,300; PB +3)",
  "traits": [],
  "actions": [
    {
      "name": "Multiattack",
      "text": "The dragon makes three Rend attacks. It can replace two attacks with a use of Sleep Breath."
    },
    {
      "name": "Rend",
      "text": "Melee Attack Roll: +7, reach 10 ft. Hit: 15 (2d10 + 4) Slashing damage."
    },
    {
      "name": "Fire Breath (Recharge 5-6)",
      "text": "Dexterity Saving Throw: DC 14, each creature in a 40-foot-long, 5-foot-wide Line. Failure: 38 (11d6) Fire damage. Success: Half damage."
    },
    {
      "name": "Sleep Breath",
      "text": "Constitution Saving Throw: DC 14, each creature in a 30-foot Cone. Failure: The target has the Incapacitated condition until the end of its next turn, at which point it repeats the save. Second Failure: The target has the Unconscious condition for 1 minute. This effect ends for the target if it takes damage or a creature within 5 feet of it takes an action to wake it."
    }
  ],
  "bonus_actions": [],
  "reactions": [],
  "legendary_actions": [],
  "lair_actions": [],
  "regional_effects": [],
  "raw_text": "AC 17 \tInitiative +3 (13)\nHP 110 (13d10 + 39)\nSpeed 40 ft., Burrow 20 ft., Fly 80 ft.\nMOD \tSAVE\nSTR \t19 \t+4 \t+4\nDEX \t10 \t+0 \t+3\nCON \t17 \t+3 \t+3\nMOD \tSAVE\nINT \t12 \t+1 \t+1\nWIS \t11 \t+0 \t+3\nCHA \t15 \t+2 \t+2\nSkills Perception +6, Persuasion +5, Stealth +3\nImmunities Fire\nSenses Blindsight 30 ft., Darkvision 120 ft.; Passive Perception 16\nLanguages Common, Draconic\nCR 6 (XP 2,300; PB +3)\nActions\nMultiattack. The dragon makes three Rend attacks. It can replace two attacks\nwith a use of Sleep Breath.\nRend. Melee Attack Roll: +7, reach 10 ft.\nHit: 15 (2d10 + 4) Slashing damage.\nFire Breath (Recharge 5–6).\nDexterity Saving Throw: DC 14, each creature\nin a 40-foot-long, 5-foot-wide Line.\nFailure: 38 (11d6) Fire damage.\nSuccess:\nHalf damage.\nSleep Breath. Constitution Saving Throw: DC 14, each creature in a 30-foot\nCone.\nFailure: The target has the Incapacitated condition until the end of its\nnext turn, at which point it repeats the save.\nSecond Failure: The target has the\nUnconscious condition for 1 minute. This effect ends for the target if it takes\ndamage or a creature within 5 feet of it takes an action to wake it.\nLarge Dragon (Metallic), Chaotic Good\nAdult brass dragons know many secrets and have vast networks of contacts. These dragons share perspectives they’ve learned from across the world and\npassionately combat the lies of con artists and villains that lead people astray.\nAN ADULT BRASS DRAGON RIDS ITS NEW LAIR OF UNWELCOME UNDEAD",
  "sourceRef": {
    "file": "docs/sources/Monster Manual/Monsters (B) - Monster Manual - Dungeons & Dragons - Sources - D&D Beyond.pdf",
    "pages": [],
    "section": "Monsters"
  },
  "notes": []
}
