{
  "id": "monster.dryad",
  "name": "DRYAD",
  "status": "complete",
  "size_type_alignment": "Medium Fey, Neutral",
  "size": "Medium",
  "creature_type": "Fey",
  "alignment": "Neutral",
  "armor_class": 16,
  "hit_points": 22,
  "hit_dice": "5d8",
  "speed": "30 ft.",
  "abilities": {
    "STR": {
      "score": 10,
      "mod": "+0"
    },
    "DEX": {
      "score": 12,
      "mod": "+1"
    },
    "CON": {
      "score": 11,
      "mod": "+0"
    },
    "INT": {
      "score": 14,
      "mod": "+2"
    },
    "WIS": {
      "score": 15,
      "mod": "+2"
    },
    "CHA": {
      "score": 18,
      "mod": "+4"
    }
  },
  "saves": null,
  "skills": "Perception +4, Stealth +5",
  "resistances": null,
  "immunities": null,
  "vulnerabilities": null,
  "condition_immunities": null,
  "senses": "Darkvision 60 ft.; Passive Perception 14",
  "languages": "Elvish, Sylvan",
  "cr": "1 (XP 200; PB +2)",
  "traits": [
    {
      "name": "Magic Resistance",
      "text": "The dryad has Advantage on saving throws against spells and other magical effects."
    },
    {
      "name": "Speak with Beasts and Plants",
      "text": "The dryad can communicate with Beasts and Plants as if they shared a language."
    }
  ],
  "actions": [
    {
      "name": "Multiattack",
      "text": "The dryad makes one Vine Lash or Thorn Burst attack, and it can use Spellcasting to cast Charm Monster."
    },
    {
      "name": "Vine Lash",
      "text": "Melee Attack Roll: +6, reach 10 ft. Hit: 8 (1d8 + 4) Slashing damage."
    },
    {
      "name": "Thorn Burst",
      "text": "Ranged Attack Roll: +6, range 60 ft. Hit: 7 (1d6 + 4) Piercing damage."
    },
    {
      "name": "Spellcasting",
      "text": "The dryad casts one of the following spells, requiring no Material components and using Charisma as the spellcasting ability (spell save DC 14): At Will: Animal Friendship, Charm Monster (lasts 24 hours; ends early if the"
    }
  ],
  "bonus_actions": [
    {
      "name": "Tree Stride",
      "text": "If within 5 feet of a Large or bigger tree, the dryad teleports to an unoccupied space within 5 feet of a second Large or bigger tree that is within 60 feet of the previous tree."
    }
  ],
  "reactions": [],
  "legendary_actions": [],
  "lair_actions": [],
  "regional_effects": [],
  "raw_text": "AC 16 \tInitiative +1 (11)\nHP 22 (5d8)\nSpeed 30 ft.\nMOD \tSAVE\nSTR \t10 \t+0 \t+0\nDEX \t12 \t+1 \t+1\nCON \t11 \t+0 \t+0\nMOD \tSAVE\nINT \t14 \t+2 \t+2\nWIS \t15 \t+2 \t+2\nCHA \t18 \t+4 \t+4\nSkills Perception +4, Stealth +5\nSenses Darkvision 60 ft.; Passive Perception 14\nLanguages Elvish, Sylvan\nCR 1 (XP 200; PB +2)\nTraits\nMagic Resistance. The dryad has Advantage on saving throws against spells\nand other magical effects.\nSpeak with Beasts and Plants. The dryad can communicate with Beasts and\nPlants as if they shared a language.\nActions\nMultiattack. The dryad makes one Vine Lash or Thorn Burst attack, and it can\nuse Spellcasting to cast\nCharm Monster.\nVine Lash. Melee Attack Roll: +6, reach 10 ft.\nHit: 8 (1d8 + 4) Slashing damage.\nThorn Burst. Ranged Attack Roll: +6, range 60 ft.\nHit: 7 (1d6 + 4)\nPiercing damage.\nSpellcasting. The dryad casts one of the following spells, requiring no Material\ncomponents and using Charisma as the spellcasting ability (spell save DC 14):\nAt Will:\nAnimal Friendship,\nCharm Monster (lasts 24 hours; ends early if the\ndryad casts the spell again),\nDruidcraft\n1/Day Each:\nEntangle,\nPass without Trace\nBonus Actions\nTree Stride. If within 5 feet of a Large or bigger tree, the dryad teleports to an\nunoccupied space within 5 feet of a second Large or bigger tree that is within\n60 feet of the previous tree.\nMedium Fey, Neutral\nInformation\nDocument (SRD)\nWizards of the\nCoast\nMEDIA\nDOWNLOAD THE D&D BEYOND\nAPP\n© 2017-2026 WIZARDS OF THE COAST LLC | ALL RIGHTS RESERVED\nproduct names, campaign settings, their respective logos, and The World's Greatest Roleplaying Game are © and trademark",
  "sourceRef": {
    "file": "docs/sources/Monster Manual/Monsters (D) - Monster Manual - Dungeons & Dragons - Sources - D&D Beyond.pdf",
    "pages": [],
    "section": "Monsters"
  },
  "notes": []
}
