{
  "id": "monster.modron_tridrone",
  "name": "MODRON TRIDRONE",
  "status": "complete",
  "size_type_alignment": "Medium Construct, Lawful Neutral",
  "size": "Medium",
  "creature_type": "Construct",
  "alignment": "Lawful Neutral",
  "armor_class": 15,
  "hit_points": 16,
  "hit_dice": "3d8 + 3",
  "speed": "30 ft.",
  "abilities": {
    "STR": {
      "score": 12,
      "mod": "+1"
    },
    "DEX": {
      "score": 13,
      "mod": "+1"
    },
    "CON": {
      "score": 12,
      "mod": "+1"
    },
    "INT": {
      "score": 9,
      "mod": "-1"
    },
    "WIS": {
      "score": 10,
      "mod": "+0"
    },
    "CHA": {
      "score": 9,
      "mod": "-1"
    }
  },
  "saves": null,
  "skills": null,
  "resistances": null,
  "immunities": null,
  "vulnerabilities": null,
  "condition_immunities": null,
  "senses": "Truesight 120 ft.; Passive Perception 10",
  "languages": "Modron",
  "cr": "1/2 (XP 100; PB +2)",
  "traits": [
    {
      "name": "Disintegration",
      "text": "If the modron dies, it disintegrates into dust, leaving behind anything it was wearing or carrying."
    }
  ],
  "actions": [
    {
      "name": "Multiattack",
      "text": "The modron makes three Clockwork Spear attacks."
    },
    {
      "name": "Clockwork Spear",
      "text": "Melee or Ranged Attack Roll: +3, reach 5 ft. or range 120 ft. Hit: 4 (1d6 + 1) Force damage. Hit or Miss: The spear magically returns to the modron's hand immediately after a ranged attack."
    }
  ],
  "bonus_actions": [],
  "reactions": [],
  "legendary_actions": [],
  "lair_actions": [],
  "regional_effects": [],
  "raw_text": "AC 15 \tInitiative +1 (11)\nHP 16 (3d8 + 3)\nSpeed 30 ft.\nMOD \tSAVE\nSTR \t12 \t+1 \t+1\nDEX \t13 \t+1 \t+1\nCON \t12 \t+1 \t+1\nMOD \tSAVE\nINT \t9 \t−1 \t−1\nWIS \t10 \t+0 \t+0\nCHA \t9 \t−1 \t−1\nImmunities Charmed\nSenses Truesight 120 ft.; Passive Perception 10\nLanguages Modron\nCR 1/2 (XP 100; PB +2)\nTraits\nDisintegration. If the modron dies, it disintegrates into dust, leaving behind\nanything it was wearing or carrying.\nActions\nMultiattack. The modron makes three Clockwork Spear attacks.\nClockwork Spear. Melee or Ranged Attack Roll: +3, reach 5 ft. or range 120 ft.\nHit: 4 (1d6 + 1) Force damage.\nHit or Miss: The spear magically returns to the\nmodron’s hand immediately after a ranged attack.\nMedium Construct, Lawful Neutral\nModron Pentadrone\nPentadrones oversee and protect contingents of lesser modrons. They’re quick to call lengthy meetings with other modrons when making decisions.",
  "sourceRef": {
    "file": "docs/sources/Monster Manual/Monsters (M) - Monster Manual - Dungeons & Dragons - Sources - D&D Beyond.pdf",
    "pages": [],
    "section": "Monsters"
  },
  "notes": []
}
