{
  "id": "monster.wererat",
  "name": "WERERAT",
  "status": "complete",
  "size_type_alignment": "Small rat, or it returns to its true humanoid form. Its game statistics, other",
  "size": "Small",
  "creature_type": "rat",
  "alignment": "or it returns to its true humanoid form. Its game statistics, other",
  "armor_class": 13,
  "hit_points": 60,
  "hit_dice": "11d8 + 11",
  "speed": "30 ft., Climb 30 ft.",
  "abilities": {
    "STR": {
      "score": 10,
      "mod": "+0"
    },
    "DEX": {
      "score": 16,
      "mod": "+3"
    },
    "CON": {
      "score": 12,
      "mod": "+1"
    },
    "INT": {
      "score": 11,
      "mod": "+0"
    },
    "WIS": {
      "score": 10,
      "mod": "+0"
    },
    "CHA": {
      "score": 8,
      "mod": "-1"
    }
  },
  "saves": null,
  "skills": "Perception +4, Stealth +5",
  "resistances": null,
  "immunities": null,
  "vulnerabilities": null,
  "condition_immunities": null,
  "senses": "Darkvision 60 ft.; Passive Perception 14",
  "languages": "Common (can’t speak in rat form)",
  "cr": "2 (XP 450; PB +2)",
  "traits": [],
  "actions": [
    {
      "name": "Multiattack",
      "text": "The wererat makes two attacks, using Scratch or Hand Crossbow in any combination. It can replace one attack with a Bite attack."
    },
    {
      "name": "Bite (Rat or Hybrid Form Only)",
      "text": "Melee Attack Roll: +5, reach 5 ft. Hit: 8 (2d4 + 3) Piercing damage. If the target is a Humanoid, it is subjected to the following effect. Constitution Saving Throw: DC 11. Failure: The target is cursed. If the cursed target drops to 0 Hit Points, it instead becomes a Wererat under the DM's control and has 10 Hit Points. Success: The target is immune to this wererat's curse for 24 hours."
    },
    {
      "name": "Scratch",
      "text": "Melee Attack Roll: +5, reach 5 ft. Hit: 6 (1d6 + 3) Slashing damage."
    },
    {
      "name": "Hand Crossbow (Humanoid or Hybrid Form Only)",
      "text": "Ranged Attack Roll: +5, range 30/120 ft. Hit: 6 (1d6 + 3) Piercing damage."
    }
  ],
  "bonus_actions": [
    {
      "name": "Shape-Shift",
      "text": "The wererat shape-shifts into a Medium rat-humanoid hybrid or a than its size, are the same in each form. Any equipment it is wearing or carrying isn't transformed. Medium or Small Monstrosity (Lycanthrope), Lawful Evil"
    }
  ],
  "reactions": [],
  "legendary_actions": [],
  "lair_actions": [],
  "regional_effects": [],
  "raw_text": "AC 13 \tInitiative +3 (13)\nHP 60 (11d8 + 11)\nSpeed 30 ft., Climb 30 ft.\nMOD \tSAVE\nSTR \t10 \t+0 \t+0\nDEX \t16 \t+3 \t+3\nCON \t12 \t+1 \t+1\nMOD \tSAVE\nINT \t11 \t+0 \t+0\nWIS \t10 \t+0 \t+0\nCHA \t8 \t−1 \t−1\nSkills Perception +4, Stealth +5\nGear Hand Crossbow\nSenses Darkvision 60 ft.; Passive Perception 14\nLanguages Common (can’t speak in rat form)\nCR 2 (XP 450; PB +2)\nActions\nMultiattack. The wererat makes two attacks, using Scratch or Hand Crossbow\nin any combination. It can replace one attack with a Bite attack.\nBite (Rat or Hybrid Form Only). Melee Attack Roll: +5, reach 5 ft.\nHit: 8 (2d4 +\n3) Piercing damage. If the target is a Humanoid, it is subjected to the following\neffect.\nConstitution Saving Throw: DC 11.\nFailure: The target is cursed. If the\ncursed target drops to 0 Hit Points, it instead becomes a Wererat under the\nDM’s control and has 10 Hit Points.\nSuccess: The target is immune to this\nwererat’s curse for 24 hours.\nScratch. Melee Attack Roll: +5, reach 5 ft.\nHit: 6 (1d6 + 3) Slashing damage.\nHand Crossbow (Humanoid or Hybrid Form Only). Ranged Attack Roll: +5,\nrange 30/120 ft.\nHit: 6 (1d6 + 3) Piercing damage.\nBonus Actions\nShape-Shift. The wererat shape-shifts into a Medium rat-humanoid hybrid or a\nSmall rat, or it returns to its true humanoid form. Its game statistics, other\nthan its size, are the same in each form. Any equipment it is wearing or\ncarrying isn’t transformed.\nMedium or Small Monstrosity (Lycanthrope), Lawful Evil",
  "sourceRef": {
    "file": "docs/sources/Monster Manual/Monsters (W) - Monster Manual - Dungeons & Dragons - Sources - D&D Beyond.pdf",
    "pages": [],
    "section": "Monsters"
  },
  "notes": []
}
