{
  "id": "monster.troll_limb",
  "name": "TROLL LIMB",
  "status": "complete",
  "size_type_alignment": "Small Giant, Chaotic Evil",
  "size": "Small",
  "creature_type": "Giant",
  "alignment": "Chaotic Evil",
  "armor_class": 13,
  "hit_points": 14,
  "hit_dice": "4d6",
  "speed": "20 ft.",
  "abilities": {
    "STR": {
      "score": 18,
      "mod": "+4"
    },
    "DEX": {
      "score": 12,
      "mod": "+1"
    },
    "CON": {
      "score": 10,
      "mod": "+0"
    },
    "INT": {
      "score": 1,
      "mod": "-5"
    },
    "WIS": {
      "score": 9,
      "mod": "-1"
    },
    "CHA": {
      "score": 1,
      "mod": "-5"
    }
  },
  "saves": null,
  "skills": null,
  "resistances": null,
  "immunities": null,
  "vulnerabilities": null,
  "condition_immunities": null,
  "senses": "Darkvision 60 ft.; Passive Perception 9",
  "languages": "None",
  "cr": "1/2 (XP 100; PB +2)",
  "traits": [
    {
      "name": "Regeneration",
      "text": "The limb regains 5 Hit Points at the start of each of its turns. If the limb takes Acid or Fire damage, this trait doesn't function on the limb's next turn. The limb dies only if it starts its turn with 0 Hit Points and doesn't regenerate."
    },
    {
      "name": "Troll Spawn",
      "text": "The limb uncannily has the same senses as a whole troll. If the limb isn't destroyed within 24 hours, roll 1d12. On a 12, the limb turns into a"
    },
    {
      "name": "Troll",
      "text": "Otherwise, the limb withers away."
    }
  ],
  "actions": [
    {
      "name": "Rend",
      "text": "Melee Attack Roll: +6, reach 5 ft. Hit: 9 (2d4 + 4) Slashing damage."
    }
  ],
  "bonus_actions": [],
  "reactions": [],
  "legendary_actions": [],
  "lair_actions": [],
  "regional_effects": [],
  "raw_text": "AC 13 \tInitiative +1 (11)\nHP 14 (4d6)\nSpeed 20 ft.\nMOD \tSAVE\nSTR \t18 \t+4 \t+4\nDEX \t12 \t+1 \t+1\nCON \t10 \t+0 \t+0\nMOD \tSAVE\nINT \t1 \t−5 \t−5\nWIS \t9 \t−1 \t−1\nCHA \t1 \t−5 \t−5\nSenses Darkvision 60 ft.; Passive Perception 9\nLanguages None\nCR 1/2 (XP 100; PB +2)\nTraits\nRegeneration. The limb regains 5 Hit Points at the start of each of its turns.\nIf the limb takes Acid or Fire damage, this trait doesn’t function on the\nlimb’s next turn. The limb dies only if it starts its turn with 0 Hit Points and\ndoesn’t regenerate.\nTroll Spawn. The limb uncannily has the same senses as a whole troll. If the\nlimb isn’t destroyed within 24 hours, roll 1d12. On a 12, the limb turns into a\nTroll. Otherwise, the limb withers away.\nActions\nRend. Melee Attack Roll: +6, reach 5 ft.\nHit: 9 (2d4 + 4) Slashing damage.\nSmall Giant, Chaotic Evil\n© 2017-2026 WIZARDS OF THE COAST LLC | ALL RIGHTS RESERVED\nproduct names, campaign settings, their respective logos, and The World's Greatest Roleplaying Game are © and trademark",
  "sourceRef": {
    "file": "docs/sources/Monster Manual/Monsters (T) - Monster Manual - Dungeons & Dragons - Sources - D&D Beyond.pdf",
    "pages": [],
    "section": "Monsters"
  },
  "notes": []
}
