{
  "id": "monster.black_dragon_wyrmling",
  "name": "BLACK DRAGON WYRMLING",
  "status": "complete",
  "size_type_alignment": "Medium Dragon (Chromatic), Chaotic Evil",
  "size": "Medium",
  "creature_type": "Dragon (Chromatic)",
  "alignment": "Chaotic Evil",
  "armor_class": 17,
  "hit_points": 33,
  "hit_dice": "6d8 + 6",
  "speed": "30 ft., Fly 60 ft., Swim 30 ft.",
  "abilities": {
    "STR": {
      "score": 15,
      "mod": "+2"
    },
    "DEX": {
      "score": 14,
      "mod": "+2"
    },
    "CON": {
      "score": 13,
      "mod": "+1"
    },
    "INT": {
      "score": 10,
      "mod": "+0"
    },
    "WIS": {
      "score": 11,
      "mod": "+0"
    },
    "CHA": {
      "score": 13,
      "mod": "+1"
    }
  },
  "saves": null,
  "skills": "Perception +4, Stealth +4",
  "resistances": null,
  "immunities": null,
  "vulnerabilities": null,
  "condition_immunities": null,
  "senses": "Blindsight 10 ft., Darkvision 60 ft.; Passive Perception 14",
  "languages": "Draconic",
  "cr": "2 (XP 450; PB +2)",
  "traits": [
    {
      "name": "Amphibious",
      "text": "The dragon can breathe air and water."
    }
  ],
  "actions": [
    {
      "name": "Multiattack",
      "text": "The dragon makes two Rend attacks."
    },
    {
      "name": "Rend",
      "text": "Melee Attack Roll: +4, reach 5 ft. Hit: 5 (1d6 + 2) Slashing damage plus 2 (1d4) Acid damage."
    },
    {
      "name": "Acid Breath (Recharge 5-6)",
      "text": "Dexterity Saving Throw: DC 11, each creature in a 15-foot-long, 5-foot-wide Line. Failure: 22 (5d8) Acid damage. Success: Half damage. BLACK DRAGON WYRMLING Young Black Dragon"
    },
    {
      "name": "Most young black dragons claim a hidden lair-typically a dismal place accessible through deadly ruins or a treacherous bog",
      "text": "They delight in exploiting fearful servants and might terrorize small communities or impress groups of kobolds or troglodytes into their service. Some ally themselves with powerful undead such as death knights and vampires or aberrations such as aboleths and kuo-toa. Black Dragon Lairs"
    },
    {
      "name": "Black dragons lurk in dismal ruins, polluted bogs, or other sites gripped by decay",
      "text": "The region containing an adult or ancient black dragon's lair is warped by its presence, creating the following effects: Acrid Haze. Odorous and stifling fog covers the area within 1 mile of the lair, rendering that area Lightly Obscured. Travel for creatures other than the dragon and its allies takes twice the usual time in that area."
    },
    {
      "name": "Foul Water",
      "text": "Water sources within 1 mile of the lair are supernaturally fouled. A creature that drinks such water must succeed on a DC 15 Constitution saving throw or have the Poisoned condition for 1 hour."
    },
    {
      "name": "If the dragon dies or moves its lair elsewhere, these effects end immediately",
      "text": "Adult Black Dragon"
    }
  ],
  "bonus_actions": [],
  "reactions": [],
  "legendary_actions": [],
  "lair_actions": [],
  "regional_effects": [],
  "raw_text": "AC 17 \tInitiative +4 (14)\nHP 33 (6d8 + 6)\nSpeed 30 ft., Fly 60 ft., Swim 30 ft.\nMOD \tSAVE\nSTR \t15 \t+2 \t+2\nDEX \t14 \t+2 \t+4\nCON \t13 \t+1 \t+1\nMOD \tSAVE\nINT \t10 \t+0 \t+0\nWIS \t11 \t+0 \t+2\nCHA \t13 \t+1 \t+1\nSkills Perception +4, Stealth +4\nImmunities Acid\nSenses Blindsight 10 ft., Darkvision 60 ft.; Passive Perception 14\nLanguages Draconic\nCR 2 (XP 450; PB +2)\nTraits\nAmphibious. The dragon can breathe air and water.\nActions\nMultiattack. The dragon makes two Rend attacks.\nRend. Melee Attack Roll: +4, reach 5 ft.\nHit: 5 (1d6 + 2) Slashing damage plus 2\n(1d4) Acid damage.\nAcid Breath (Recharge 5–6). Dexterity Saving Throw: DC 11, each creature\nin a 15-foot-long, 5-foot-wide Line.\nFailure: 22 (5d8) Acid damage.\nSuccess:\nHalf damage.\nMedium Dragon (Chromatic), Chaotic Evil\nBLACK DRAGON WYRMLING\nYoung Black Dragon\nMost young black dragons claim a hidden lair—typically a dismal place accessible through deadly ruins or a treacherous bog. They delight in exploiting\nfearful servants and might terrorize small communities or impress groups of kobolds or troglodytes into their service. Some ally themselves with powerful\nundead such as death knights and vampires or aberrations such as aboleths and kuo-toa.\nBlack Dragon Lairs\nBlack dragons lurk in dismal ruins, polluted bogs, or other sites gripped by decay.\nThe region containing an adult or ancient black dragon’s lair is warped by its presence, creating the following effects:\nAcrid Haze. Odorous and stifling fog covers the area within 1 mile of the lair, rendering that area Lightly Obscured. Travel for creatures other than the\ndragon and its allies takes twice the usual time in that area.\nFoul Water. Water sources within 1 mile of the lair are supernaturally fouled. A creature that drinks such water must succeed on a DC 15 Constitution\nsaving throw or have the Poisoned condition for 1 hour.\nIf the dragon dies or moves its lair elsewhere, these effects end immediately.\nAdult Black Dragon",
  "sourceRef": {
    "file": "docs/sources/Monster Manual/Monsters (B) - Monster Manual - Dungeons & Dragons - Sources - D&D Beyond.pdf",
    "pages": [],
    "section": "Monsters"
  },
  "notes": []
}
