{
  "id": "monster.gulthias_blight",
  "name": "GULTHIAS BLIGHT",
  "status": "complete",
  "size_type_alignment": "Gargantuan Plant, Neutral Evil",
  "size": "Gargantuan",
  "creature_type": "Plant",
  "alignment": "Neutral Evil",
  "armor_class": 20,
  "hit_points": 264,
  "hit_dice": "16d20 + 96",
  "speed": "50 ft.",
  "abilities": {
    "STR": {
      "score": 25,
      "mod": "+7"
    },
    "DEX": {
      "score": 10,
      "mod": "+0"
    },
    "CON": {
      "score": 22,
      "mod": "+6"
    },
    "INT": {
      "score": 10,
      "mod": "+0"
    },
    "WIS": {
      "score": 18,
      "mod": "+4"
    },
    "CHA": {
      "score": 12,
      "mod": "+1"
    }
  },
  "saves": null,
  "skills": "Perception +9",
  "resistances": null,
  "immunities": null,
  "vulnerabilities": null,
  "condition_immunities": null,
  "senses": "Blindsight 120 ft.; Passive Perception 19",
  "languages": "Common, Druidic",
  "cr": "16 (XP 15,000; PB +5)",
  "traits": [
    {
      "name": "Blight Seeds",
      "text": "When it finishes a Long Rest, the blight expels 1d6 seeds into unoccupied spaces on the ground within 30 feet of itself. After 24 hours, the seeds become creatures under the blight's control. Roll 1d8 for each seed to determine the creature it becomes: on 1-4,Twig Blight; on 5-6, Needle Blight; on 7-8, Vine Blight."
    }
  ],
  "actions": [
    {
      "name": "Multiattack",
      "text": "The blight makes two attacks, using Slam or Thorn Volley in any combination. It also uses Life-Draining Root."
    },
    {
      "name": "Slam",
      "text": "Melee Attack Roll: +12, reach 10 ft. Hit: 25 (4d8 + 7) Bludgeoning damage."
    },
    {
      "name": "Thorn Volley",
      "text": "Ranged Attack Roll: +12, range 60/180 ft. Hit: 20 (3d8 + 7) Piercing damage."
    },
    {
      "name": "Life-Draining Root",
      "text": "Constitution Saving Throw: DC 20, one Huge or smaller creature the blight can see within 30 feet. Failure: 14 (2d6 + 7) Necrotic damage, and the target has the Grappled condition (escape DC 17) from one of six roots. Until the grapple ends, the target has the Restrained condition and takes 14 (4d6) Necrotic damage at the start of each of its turns. The target's Hit Point maximum decreases by an amount equal to the Necrotic damage taken, and the blight regains Hit Points equal to that amount."
    },
    {
      "name": "It lives, though it looks dead",
      "text": "In an age long past, someone staked a vampire to the earth on this very spot. The wooden stake was yet green and took root. And so grew the Gulthias"
    },
    {
      "name": "Tree, reverberating with primal power",
      "text": "-BELAK THE OUTCAST, DRUID OF THE TWILIGHT GROVE"
    }
  ],
  "bonus_actions": [],
  "reactions": [],
  "legendary_actions": [],
  "lair_actions": [],
  "regional_effects": [],
  "raw_text": "AC 20 \tInitiative +5 (15)\nHP 264 (16d20 + 96)\nSpeed 50 ft.\nMOD \tSAVE\nSTR \t25 \t+7 \t+7\nDEX \t10 \t+0 \t+0\nCON \t22 \t+6 \t+6\nMOD \tSAVE\nINT \t10 \t+0 \t+0\nWIS \t18 \t+4 \t+4\nCHA \t12 \t+1 \t+1\nSkills Perception +9\nResistances Fire, Necrotic\nImmunities Deafened\nSenses Blindsight 120 ft.; Passive Perception 19\nLanguages Common, Druidic\nCR 16 (XP 15,000; PB +5)\nGargantuan Plant, Neutral Evil\nBlink Dog\nElusive Feywild Canine\nHabitat: Forest, Planar (Feywild); Treasure: None\nBlink dogs glimmer with a magic that allows them to teleport, “blinking” from one spot to another. These dogs use this power to chase prey, baffle foes, and\nexpress joy. They’re frequently found among Feywild folk, such as centaurs and pixies—often as members of rollicking hunts between worlds.\nTraits\nBlight Seeds. When it finishes a Long Rest, the blight expels 1d6 seeds into\nunoccupied spaces on the ground within 30 feet of itself. After 24 hours, the\nseeds become creatures under the blight’s control. Roll 1d8 for each seed to\ndetermine the creature it becomes: on 1–4,Twig Blight; on 5–6, Needle Blight;\non 7–8, Vine Blight.\nActions\nMultiattack. The blight makes two attacks, using Slam or Thorn Volley in any\ncombination. It also uses Life-Draining Root.\nSlam. Melee Attack Roll: +12, reach 10 ft.\nHit: 25 (4d8 + 7)\nBludgeoning damage.\nThorn Volley. Ranged Attack Roll: +12, range 60/180 ft.\nHit: 20 (3d8 + 7)\nPiercing damage.\nLife-Draining Root. Constitution Saving Throw: DC 20, one Huge or smaller\ncreature the blight can see within 30 feet.\nFailure: 14 (2d6 + 7) Necrotic\ndamage, and the target has the Grappled condition (escape DC 17) from one of\nsix roots. Until the grapple ends, the target has the Restrained condition and\ntakes 14 (4d6) Necrotic damage at the start of each of its turns. The target’s\nHit Point maximum decreases by an amount equal to the Necrotic damage\ntaken, and the blight regains Hit Points equal to that amount.\nIt lives, though it looks dead. In an age long past, someone\nstaked a vampire to the earth on this very spot. The wooden\nstake was yet green and took root. And so grew the Gulthias\nTree, reverberating with primal power.\n—BELAK THE OUTCAST,\nDRUID OF THE TWILIGHT GROVE",
  "sourceRef": {
    "file": "docs/sources/Monster Manual/Monsters (B) - Monster Manual - Dungeons & Dragons - Sources - D&D Beyond.pdf",
    "pages": [],
    "section": "Monsters"
  },
  "notes": []
}
