{
  "id": "monster.marilith",
  "name": "MARILITH",
  "status": "complete",
  "size_type_alignment": "Large Fiend (Demon), Chaotic Evil",
  "size": "Large",
  "creature_type": "Fiend (Demon)",
  "alignment": "Chaotic Evil",
  "armor_class": 16,
  "hit_points": 220,
  "hit_dice": "21d10 + 105",
  "speed": "40 ft., Climb 40 ft.",
  "abilities": {
    "STR": {
      "score": 18,
      "mod": "+4"
    },
    "DEX": {
      "score": 20,
      "mod": "+5"
    },
    "CON": {
      "score": 20,
      "mod": "+5"
    },
    "INT": {
      "score": 18,
      "mod": "+4"
    },
    "WIS": {
      "score": 16,
      "mod": "+3"
    },
    "CHA": {
      "score": 20,
      "mod": "+5"
    }
  },
  "saves": null,
  "skills": "Perception +8",
  "resistances": null,
  "immunities": null,
  "vulnerabilities": null,
  "condition_immunities": null,
  "senses": "Truesight 120 ft.; Passive Perception 18",
  "languages": "Abyssal; telepathy 120 ft.",
  "cr": "16 (XP 15,000; PB +5)",
  "traits": [
    {
      "name": "Demonic Restoration",
      "text": "If the marilith dies outside the Abyss, its body dissolves into ichor, and it gains a new body instantly, reviving with all its Hit Points somewhere in the Abyss."
    },
    {
      "name": "Magic Resistance",
      "text": "The marilith has Advantage on saving throws against spells and other magical effects."
    },
    {
      "name": "Reactive",
      "text": "The marilith can take one Reaction on every turn of combat."
    }
  ],
  "actions": [
    {
      "name": "Multiattack",
      "text": "The marilith makes six Pact Blade attacks and uses Constrict."
    },
    {
      "name": "Pact Blade",
      "text": "Melee Attack Roll: +10, reach 5 ft. Hit: 10 (1d10 + 5) Slashing damage plus 7 (2d6) Necrotic damage."
    },
    {
      "name": "Constrict",
      "text": "Strength Saving Throw: DC 17, one Medium or smaller creature the marilith can see within 5 feet. Failure: 15 (2d10 + 4) Bludgeoning damage. The target has the Grappled condition (escape DC 14), and it has the Restrained condition until the grapple ends."
    }
  ],
  "bonus_actions": [
    {
      "name": "Teleport (Recharge 5-6)",
      "text": "The marilith teleports up to 120 feet to an unoccupied space it can see."
    }
  ],
  "reactions": [],
  "legendary_actions": [],
  "lair_actions": [],
  "regional_effects": [],
  "raw_text": "AC 16 \tInitiative +10 (20)\nHP 220 (21d10 + 105)\nSpeed 40 ft., Climb 40 ft.\nMOD \tSAVE\nSTR \t18 \t+4 \t+9\nDEX \t20 \t+5 \t+5\nCON \t20 \t+5 \t+10\nMOD \tSAVE\nINT \t18 \t+4 \t+4\nWIS \t16 \t+3 \t+8\nCHA \t20 \t+5 \t+10\nSkills Perception +8\nResistances Cold, Fire, Lightning\nImmunities Poison; Poisoned\nSenses Truesight 120 ft.; Passive Perception 18\nLanguages Abyssal; telepathy 120 ft.\nCR 16 (XP 15,000; PB +5)\nTraits\nDemonic Restoration. If the marilith dies outside the Abyss, its body dissolves\ninto ichor, and it gains a new body instantly, reviving with all its Hit Points\nsomewhere in the Abyss.\nMagic Resistance. The marilith has Advantage on saving throws against spells\nand other magical effects.\nReactive. The marilith can take one Reaction on every turn of combat.\nActions\nMultiattack. The marilith makes six Pact Blade attacks and uses Constrict.\nPact Blade. Melee Attack Roll: +10, reach 5 ft.\nHit: 10 (1d10 + 5) Slashing\ndamage plus 7 (2d6) Necrotic damage.\nConstrict. Strength Saving Throw: DC 17, one Medium or smaller creature the\nmarilith can see within 5 feet.\nFailure: 15 (2d10 + 4) Bludgeoning damage. The\ntarget has the Grappled condition (escape DC 14), and it has the Restrained\ncondition until the grapple ends.\nBonus Actions\nTeleport (Recharge 5–6). The marilith teleports up to 120 feet to an\nunoccupied space it can see.\nLarge Fiend (Demon), Chaotic Evil\nMedusa\nSnake-Haired Recluse with a Petrifying Gaze\nHabitat: Desert; Treasure: Any\nWith their hair of living snakes and their infamous petrifying gazes, medusas are hubristic creatures that inhabit sites of fallen glory. They often dwell\nbeyond the fringes of civilization or travel in disguise, leaving trails of petrified victims. Some medusas dominate groups of monsters or criminals,\ncontrolling them with threats of petrified doom, while others recruit servants that are immune to being petrified, such as gargoyles and gorgons.\nReactions\nParry. Trigger: The marilith is hit by a melee attack roll while holding a weapon.\nResponse: The marilith adds 5 to its AC against that attack, possibly causing it\nto miss.\nMedusas are born or created through preternatural circumstances. Roll on or choose a result\nfrom the Medusa Fates table to inspire what led to a medusa’s creation.\nMedusa Fates\n1d6 \tThe Medusa Was...\n1 Born a medusa and lives unaware of whatever curse or circumstances afflicted its\nancestor.\n2 \tCreated by a god and tasked with guarding a treasure or secret.\n3 \tA cultist who made a fiendish bargain and enjoyed rewards that have since faded.\n4 \tAn explorer transformed and compelled to defend a cursed ruin.\n5 \tA vain noble whose magical attempt to gain eternal beauty backfired.\n6 \tThe victim of a bite from a magical serpent or reptilian god in disguise.\nMephits\nMalicious Elemental Hooligans\nHabitat: Planar (Elemental Planes); Treasure: None",
  "sourceRef": {
    "file": "docs/sources/Monster Manual/Monsters (M) - Monster Manual - Dungeons & Dragons - Sources - D&D Beyond.pdf",
    "pages": [],
    "section": "Monsters"
  },
  "notes": []
}
