{
  "id": "monster.gray_slaad",
  "name": "GRAY SLAAD",
  "status": "complete",
  "size_type_alignment": "Medium Aberration, Chaotic Neutral",
  "size": "Medium",
  "creature_type": "Aberration",
  "alignment": "Chaotic Neutral",
  "armor_class": 18,
  "hit_points": 150,
  "hit_dice": "20d8 + 60",
  "speed": "40 ft.",
  "abilities": {
    "STR": {
      "score": 19,
      "mod": "+4"
    },
    "DEX": {
      "score": 17,
      "mod": "+3"
    },
    "CON": {
      "score": 16,
      "mod": "+3"
    },
    "INT": {
      "score": 13,
      "mod": "+1"
    },
    "WIS": {
      "score": 8,
      "mod": "-1"
    },
    "CHA": {
      "score": 18,
      "mod": "+4"
    }
  },
  "saves": null,
  "skills": "Arcana +5, Perception +7",
  "resistances": null,
  "immunities": null,
  "vulnerabilities": null,
  "condition_immunities": null,
  "senses": "Blindsight 60 ft., Darkvision 60 ft.; Passive Perception 17",
  "languages": "Common, Slaad; telepathy 60 ft.",
  "cr": "9 (XP 5,000; PB +4)",
  "traits": [
    {
      "name": "Magic Resistance",
      "text": "The slaad has Advantage on saving throws against spells and other magical effects."
    },
    {
      "name": "Regeneration",
      "text": "The slaad regains 10 Hit Points at the start of each of its turns if it has at least 1 Hit Point."
    }
  ],
  "actions": [
    {
      "name": "Multiattack",
      "text": "The slaad makes two Chaos Claw attacks."
    },
    {
      "name": "Chaos Claw",
      "text": "Melee Attack Roll: +8, reach 10 ft. Hit: 9 (1d10 + 4) Slashing damage plus 11 (2d10) Necrotic damage. Until the start of the slaad's next turn, the target has a condition determined by rolling 1d4: on a 1, Charmed; on a 2, Frightened; on a 3, Poisoned; or on a 4, Incapacitated."
    },
    {
      "name": "Spellcasting",
      "text": "The slaad casts one of the following spells, requiring no Material components and using Charisma as the spellcasting ability (spell save DC 16): At Will: Detect Magic, Detect Thoughts, Invisibility (self only), Mage Hand, Major Image 1/Day Each: Cloudkill, Fly,"
    }
  ],
  "bonus_actions": [
    {
      "name": "Shape-Shift",
      "text": "The slaad shape-shifts into a Small or Medium Humanoid, or it returns to its true form. Other than its size, its game statistics are the same in each form. Any equipment it is wearing or carrying isn't transformed."
    }
  ],
  "reactions": [],
  "legendary_actions": [],
  "lair_actions": [],
  "regional_effects": [],
  "raw_text": "AC 18 \tInitiative +7 (17)\nHP 150 (20d8 + 60)\nSpeed 40 ft.\nMOD \tSAVE\nSTR \t19 \t+4 \t+4\nDEX \t17 \t+3 \t+3\nCON \t16 \t+3 \t+3\nMOD \tSAVE\nINT \t13 \t+1 \t+1\nWIS \t8 \t−1 \t−1\nCHA \t18 \t+4 \t+4\nSkills Arcana +5, Perception +7\nResistances Acid, Cold, Fire, Lightning, Thunder\nSenses Blindsight 60 ft., Darkvision 60 ft.; Passive Perception 17\nLanguages Common, Slaad; telepathy 60 ft.\nCR 9 (XP 5,000; PB +4)\nTraits\nMagic Resistance. The slaad has Advantage on saving throws against spells\nand other magical effects.\nRegeneration. The slaad regains 10 Hit Points at the start of each of its turns if\nit has at least 1 Hit Point.\nActions\nMultiattack. The slaad makes two Chaos Claw attacks.\nChaos Claw. Melee Attack Roll: +8, reach 10 ft.\nHit: 9 (1d10 + 4) Slashing\ndamage plus 11 (2d10) Necrotic damage. Until the start of the slaad’s next turn,\nthe target has a condition determined by rolling 1d4: on a 1, Charmed; on a 2,\nFrightened; on a 3, Poisoned; or on a 4, Incapacitated.\nSpellcasting. The slaad casts one of the following spells, requiring no Material\ncomponents and using Charisma as the spellcasting ability (spell save DC 16):\nAt Will:\nDetect Magic,\nDetect Thoughts,\nInvisibility (self only),\nMage Hand,\nMajor Image\n1/Day Each:\nCloudkill,\nFly,\nPlane Shift (self only),\nTongues\nBonus Actions\nShape-Shift. The slaad shape-shifts into a Small or Medium Humanoid, or it\nreturns to its true form. Other than its size, its game statistics are the same in\neach form. Any equipment it is wearing or carrying isn’t transformed.\nMedium Aberration, Chaotic Neutral",
  "sourceRef": {
    "file": "docs/sources/Monster Manual/Monsters (S) - Monster Manual - Dungeons & Dragons - Sources - D&D Beyond.pdf",
    "pages": [],
    "section": "Monsters"
  },
  "notes": []
}
