{
  "id": "monster.yuan_ti_abomination",
  "name": "YUAN-TI ABOMINATION",
  "status": "complete",
  "size_type_alignment": "Large Monstrosity, Neutral Evil",
  "size": "Large",
  "creature_type": "Monstrosity",
  "alignment": "Neutral Evil",
  "armor_class": 15,
  "hit_points": 127,
  "hit_dice": "15d10 + 45",
  "speed": "40 ft., Climb 30 ft.",
  "abilities": {
    "STR": {
      "score": 19,
      "mod": "+4"
    },
    "DEX": {
      "score": 16,
      "mod": "+3"
    },
    "CON": {
      "score": 17,
      "mod": "+3"
    },
    "INT": {
      "score": 17,
      "mod": "+3"
    },
    "WIS": {
      "score": 18,
      "mod": "+4"
    },
    "CHA": {
      "score": 15,
      "mod": "+2"
    }
  },
  "saves": null,
  "skills": "Perception +7, Stealth +6",
  "resistances": null,
  "immunities": "Poison",
  "vulnerabilities": null,
  "condition_immunities": "Poisoned",
  "senses": "Darkvision 60 ft.; Passive Perception 17",
  "languages": "Abyssal, Common, Draconic",
  "cr": "7 (XP 2,900; PB +3)",
  "traits": [
    {
      "name": "Magic Resistance",
      "text": "The yuan-ti has Advantage on saving throws against spells and other magical effects."
    }
  ],
  "actions": [
    {
      "name": "Multiattack",
      "text": "The yuan-ti makes two Bite attacks, and it can use Spellcasting to cast Suggestion if available."
    },
    {
      "name": "Bite",
      "text": "Melee Attack Roll: +7, reach 5 ft. Hit: 11 (2d6 + 4) Piercing damage plus 10 (3d6) Poison damage."
    },
    {
      "name": "Constrict",
      "text": "Strength Saving Throw: DC 15, one Large or smaller creature within 5 feet. Failure: 28 (7d6 + 4) Bludgeoning damage. The target has the Grappled condition (escape DC 14), and it has the Restrained condition until the grapple ends. Success: Half damage only."
    },
    {
      "name": "Poison Spray (Recharge 5-6)",
      "text": "Constitution Saving Throw: DC 14, each creature in a 30-foot Cone. Failure: 21 (6d6) Poison damage, and the target has the Poisoned condition until the end of the yuan-ti's next turn. While Poisoned, the target has the Blinded condition. Success: Half damage only."
    },
    {
      "name": "Spellcasting (Yuan-ti Form Only)",
      "text": "The yuan-ti casts one of the following spells, requiring no Material components and using Wisdom as the spellcasting ability (spell save DC 15): At Will: Animal Friendship (snakes only). 3/Day: Suggestion."
    }
  ],
  "bonus_actions": [
    {
      "name": "Shape-Shift",
      "text": "The yuan-ti shape-shifts into a Large snake or returns to its true form. If it dies, it stays in its current form. The yuan-ti's game statistics are the same in each form, except where noted. Any equipment it is wearing or carrying isn't transformed."
    }
  ],
  "reactions": [],
  "legendary_actions": [],
  "lair_actions": [],
  "regional_effects": [],
  "raw_text": "AC 15 \tInitiative +6 (16)\nHP 127 (15d10 + 45)\nSpeed 40 ft., Climb 30 ft.\nMOD \tSAVE\nSTR \t19 \t+4 \t+4\nDEX \t16 \t+3 \t+3\nCON \t17 \t+3 \t+3\nMOD \tSAVE\nINT \t17 \t+3 \t+3\nWIS \t18 \t+4 \t+4\nCHA \t15 \t+2 \t+2\nSkills Perception +7, Stealth +6\nImmunities Poison; Poisoned\nSenses Darkvision 60 ft.; Passive Perception 17\nLanguages Abyssal, Common, Draconic\nCR 7 (XP 2,900; PB +3)\nTraits\nMagic Resistance. The yuan-ti has Advantage on saving throws against spells and other magical effects.\nActions\nMultiattack. The yuan-ti makes two Bite attacks, and it can use Spellcasting to cast Suggestion if available.\nBite. Melee Attack Roll: +7, reach 5 ft.\nHit: 11 (2d6 + 4) Piercing damage plus 10 (3d6) Poison damage.\nConstrict. Strength Saving Throw: DC 15, one Large or smaller creature within 5 feet.\nFailure: 28 (7d6 + 4) Bludgeoning damage. The target has the Grappled condition (escape DC 14), and it has the Restrained condition until the grapple ends.\nSuccess: Half damage only.\nPoison Spray (Recharge 5-6). Constitution Saving Throw: DC 14, each creature in a 30-foot Cone.\nFailure: 21 (6d6) Poison damage, and the target has the Poisoned condition until the end of the yuan-ti's next turn. While Poisoned, the target has the Blinded condition.\nSuccess: Half damage only.\nSpellcasting (Yuan-ti Form Only). The yuan-ti casts one of the following spells, requiring no Material components and using Wisdom as the spellcasting ability (spell save DC 15):\nAt Will:\nAnimal Friendship (snakes only)\n3/Day:\nSuggestion\nBonus Actions\nShape-Shift. The yuan-ti shape-shifts into a Large snake or returns to its true form. If it dies, it stays in its current form. The yuan-ti's game statistics are the same in each form, except where noted. Any equipment it is wearing or carrying isn't transformed.\nLarge Monstrosity, Neutral Evil",
  "sourceRef": {
    "file": "docs/sources/Monster Manual/Monsters (Y) - Monster Manual - Dungeons & Dragons - Sources - D&D Beyond.pdf",
    "pages": [],
    "section": "Monsters"
  },
  "notes": []
}
