{
  "id": "monster.ancient_bronze_dragon",
  "name": "ANCIENT BRONZE DRAGON",
  "status": "complete",
  "size_type_alignment": "Gargantuan Dragon (Metallic), Lawful Good",
  "size": "Gargantuan",
  "creature_type": "Dragon (Metallic)",
  "alignment": "Lawful Good",
  "armor_class": 22,
  "hit_points": 444,
  "hit_dice": "24d20 + 192",
  "speed": "40 ft., Fly 80 ft., Swim 40 ft.",
  "abilities": {
    "STR": {
      "score": 29,
      "mod": "+9"
    },
    "DEX": {
      "score": 10,
      "mod": "+0"
    },
    "CON": {
      "score": 27,
      "mod": "+8"
    },
    "INT": {
      "score": 18,
      "mod": "+4"
    },
    "WIS": {
      "score": 17,
      "mod": "+3"
    },
    "CHA": {
      "score": 25,
      "mod": "+7"
    }
  },
  "saves": null,
  "skills": "Insight +10, Perception +17, Stealth +7",
  "resistances": null,
  "immunities": null,
  "vulnerabilities": null,
  "condition_immunities": null,
  "senses": "Blindsight 60 ft., Darkvision 120 ft.; Passive Perception 27",
  "languages": "Common, Draconic",
  "cr": "22 (XP 41,000, or 50,000 in lair; PB +7)",
  "traits": [
    {
      "name": "Amphibious",
      "text": "The dragon can breathe air and water."
    },
    {
      "name": "Legendary Resistance (4/Day, or 5/Day in Lair)",
      "text": "If the dragon fails a saving throw, it can choose to succeed instead."
    }
  ],
  "actions": [
    {
      "name": "Multiattack",
      "text": "The dragon makes three Rend attacks. It can replace one attack"
    },
    {
      "name": "Rend",
      "text": "Melee Attack Roll: +16, reach 15 ft. Hit: 18 (2d8 + 9) Slashing damage plus 9 (2d8) Lightning damage."
    },
    {
      "name": "Lightning Breath (Recharge 5-6)",
      "text": "Dexterity Saving Throw: DC 23, each creature in a 120-foot-long, 10-foot-wide Line. Failure: 82 (15d10) Lightning damage. Success: Half damage."
    },
    {
      "name": "Repulsion Breath",
      "text": "Strength Saving Throw: DC 23, each creature in a 30-foot Cone. Failure: The target is pushed up to 60 feet straight away from the dragon and has the Prone condition."
    },
    {
      "name": "Spellcasting",
      "text": "The dragon casts one of the following spells, requiring no Material components and using Charisma as the spellcasting ability (spell save DC 22, +14 to hit with spell attacks): At Will: Detect Magic, Guiding Bolt (level 2 version), Shapechange (Beast or Humanoid form only, no Temporary Hit Points gained from the spell, and no"
    }
  ],
  "bonus_actions": [],
  "reactions": [],
  "legendary_actions": [
    {
      "name": "Guiding Light",
      "text": "The dragon uses Spellcasting to cast Guiding Bolt (level 2 version)."
    },
    {
      "name": "Pounce",
      "text": "The dragon moves up to half its Speed, and it makes one Rend attack."
    },
    {
      "name": "Thunderclap",
      "text": "Constitution Saving Throw: DC 22, each creature in a 20-foot- radius Sphere centered on a point the dragon can see within 120 feet. Failure: 13 (3d8) Thunder damage, and the target has the Deafened condition until the end of its next turn."
    }
  ],
  "lair_actions": [],
  "regional_effects": [],
  "raw_text": "AC 22 \tInitiative +14 (24)\nHP 444 (24d20 + 192)\nSpeed 40 ft., Fly 80 ft., Swim 40 ft.\nMOD \tSAVE\nSTR \t29 \t+9 \t+9\nDEX \t10 \t+0 \t+7\nCON \t27 \t+8 \t+8\nMOD \tSAVE\nINT \t18 \t+4 \t+4\nWIS \t17 \t+3 \t+10\nCHA \t25 \t+7 \t+7\nSkills Insight +10, Perception +17, Stealth +7\nImmunities Lightning\nSenses Blindsight 60 ft., Darkvision 120 ft.; Passive Perception 27\nLanguages Common, Draconic\nCR 22 (XP 41,000, or 50,000 in lair; PB +7)\nTraits\nAmphibious. The dragon can breathe air and water.\nLegendary Resistance (4/Day, or 5/Day in Lair). If the dragon fails a saving\nthrow, it can choose to succeed instead.\nActions\nMultiattack. The dragon makes three Rend attacks. It can replace one attack\nwith a use of (A) Repulsion Breath or (B) Spellcasting to cast\nGuiding Bolt\n(level 2 version).\nGargantuan Dragon (Metallic), Lawful Good\nBugbears\nLurking Goblinoid Brutes\nHabitat: Forest, Grassland, Planar (Feywild), Underdark; Treasure: Armaments, Individual\nBugbears embody fear of the wilds and the menace of natural places. They’re notoriously stealthy, and foes that venture into their territories often vanish\nwithout a trace.\nBugbear Stalker\nBugbear stalkers frequently take their victims hostage, relishing opportunities to imprison and terrorize other creatures.\nBugbear Warrior\nBugbear warriors serve those who offer them treasure, food, or the chance to hunt challenging prey.\nRend. Melee Attack Roll: +16, reach 15 ft.\nHit: 18 (2d8 + 9) Slashing damage\nplus 9 (2d8) Lightning damage.\nLightning Breath (Recharge 5–6).\nDexterity Saving Throw: DC 23, each creature\nin a 120-foot-long, 10-foot-wide Line.\nFailure: 82 (15d10) Lightning damage.\nSuccess: Half damage.\nRepulsion Breath. Strength Saving Throw: DC 23, each creature in a 30-foot\nCone.\nFailure: The target is pushed up to 60 feet straight away from the dragon\nand has the Prone condition.\nSpellcasting. The dragon casts one of the following spells, requiring no\nMaterial components and using Charisma as the spellcasting ability (spell\nsave DC 22, +14 to hit with spell attacks):\nAt Will:\nDetect Magic,\nGuiding Bolt (level 2 version),\nShapechange (Beast or\nHumanoid form only, no Temporary Hit Points gained from the spell, and no\nConcentration or Temporary Hit Points required to maintain the spell),\nSpeak\nwith Animals,\nThaumaturgy\n1/Day Each:\nDetect Thoughts,\nControl Water,\nScrying,\nWater Breathing\nLegendary Actions\nLegendary Action Uses: 3 (4 in Lair). Immediately after another creature’s turn,\nthe dragon can expend a use to take one of the following actions. The dragon\nregains all expended uses at the start of each of its turns.\nGuiding Light. The dragon uses Spellcasting to cast\nGuiding Bolt (level\n2 version).\nPounce. The dragon moves up to half its Speed, and it makes one Rend attack.\nThunderclap. Constitution Saving Throw: DC 22, each creature in a 20-foot-\nradius Sphere centered on a point the dragon can see within 120 feet.\nFailure:\n13 (3d8) Thunder damage, and the target has the Deafened condition until the\nend of its next turn.",
  "sourceRef": {
    "file": "docs/sources/Monster Manual/Monsters (B) - Monster Manual - Dungeons & Dragons - Sources - D&D Beyond.pdf",
    "pages": [],
    "section": "Monsters"
  },
  "notes": [
    "Legendary Action Uses: 3 (4 in Lair). Immediately after another creature's turn, the dragon can expend a use to take one of the following actions. The dragon regains all expended uses at the start of each of its turns."
  ]
}
