{
  "id": "monster.violet_fungus_necrohulk",
  "name": "VIOLET FUNGUS NECROHULK",
  "status": "complete",
  "size_type_alignment": "Large Plant, Neutral Evil",
  "size": "Large",
  "creature_type": "Plant",
  "alignment": "Neutral Evil",
  "armor_class": 17,
  "hit_points": 123,
  "hit_dice": "13d10 + 52",
  "speed": "40 ft.",
  "abilities": {
    "STR": {
      "score": 19,
      "mod": "+4"
    },
    "DEX": {
      "score": 12,
      "mod": "+1"
    },
    "CON": {
      "score": 18,
      "mod": "+4"
    },
    "INT": {
      "score": 7,
      "mod": "-2"
    },
    "WIS": {
      "score": 14,
      "mod": "+2"
    },
    "CHA": {
      "score": 10,
      "mod": "+0"
    }
  },
  "saves": null,
  "skills": null,
  "resistances": null,
  "immunities": null,
  "vulnerabilities": null,
  "condition_immunities": null,
  "senses": "Blindsight 60 ft.; Passive Perception 12",
  "languages": "None",
  "cr": "7 (XP 2,900; PB +3)",
  "traits": [],
  "actions": [
    {
      "name": "Multiattack",
      "text": "The necrohulk makes two Rotting Slam attacks."
    },
    {
      "name": "Rotting Slam",
      "text": "Melee Attack Roll: +7, reach 10 ft. Hit: 9 (1d10 + 4) Bludgeoning damage plus 7 (2d6) Necrotic damage."
    },
    {
      "name": "Spore Bomb (Recharge 5-6)",
      "text": "Constitution Saving Throw: DC 15, each creature in a 20-foot-radius Sphere centered on a point the necrohulk can see within 60 feet. Failure: 28 (8d6) Necrotic damage, and the target has the Poisoned condition until the start of the necrohulk's next turn. While Poisoned, the target can't regain Hit Points. Success: Half damage only."
    }
  ],
  "bonus_actions": [
    {
      "name": "Absorb Body",
      "text": "Strength Saving Throw: DC 15, one Medium or Small creature the necrohulk can see within 5 feet. Failure: The target is pulled into the necrohulk's space and becomes grafted to its body. The necrohulk can have only one target grafted at a time. While grafted, the target has the Restrained condition and Disadvantage on"
    },
    {
      "name": "Constitution saving throws",
      "text": "When the necrohulk moves, the grafted target moves with it. If the target dies while grafted, its body is destroyed, and the necrohulk regains 10 Hit Points. The grafted target or a creature within 5 feet of the necrohulk can take an action to make a DC 15 Strength (Athletics) check. On a successful check, the target is no longer grafted and moves to an unoccupied space within 5 feet of the necrohulk."
    }
  ],
  "reactions": [],
  "legendary_actions": [],
  "lair_actions": [],
  "regional_effects": [],
  "raw_text": "AC 17 \tInitiative +4 (14)\nHP 123 (13d10 + 52)\nSpeed 40 ft.\nMOD \tSAVE\nSTR \t19 \t+4 \t+4\nDEX \t12 \t+1 \t+1\nCON \t18 \t+4 \t+4\nMOD \tSAVE\nINT \t7 \t−2 \t−2\nWIS \t14 \t+2 \t+2\nCHA \t10 \t+0 \t+0\nImmunities Necrotic, Poison; Blinded, Charmed, Deafened,\nFrightened, Poisoned\nSenses Blindsight 60 ft.; Passive Perception 12\nLanguages None\nCR 7 (XP 2,900; PB +3)\nActions\nMultiattack. The necrohulk makes two Rotting Slam attacks.\nRotting Slam. Melee Attack Roll: +7, reach 10 ft.\nHit: 9 (1d10 + 4) Bludgeoning\ndamage plus 7 (2d6) Necrotic damage.\nSpore Bomb (Recharge 5–6). Constitution Saving Throw: DC 15, each creature\nin a 20-foot-radius Sphere centered on a point the necrohulk can see within 60\nfeet.\nFailure: 28 (8d6) Necrotic damage, and the target has the Poisoned\ncondition until the start of the necrohulk’s next turn. While Poisoned, the target\ncan’t regain Hit Points.\nSuccess: Half damage only.\nBonus Actions\nAbsorb Body. Strength Saving Throw: DC 15, one Medium or Small creature the\nnecrohulk can see within 5 feet.\nFailure: The target is pulled into the\nnecrohulk’s space and becomes grafted to its body. The necrohulk can have\nonly one target grafted at a time.\nWhile grafted, the target has the Restrained condition and Disadvantage on\nConstitution saving throws. When the necrohulk moves, the grafted target\nmoves with it. If the target dies while grafted, its body is destroyed, and the\nnecrohulk regains 10 Hit Points.\nThe grafted target or a creature within 5 feet of the necrohulk can take an\naction to make a DC 15 Strength (Athletics) check. On a successful check, the\ntarget is no longer grafted and moves to an unoccupied space within 5 feet of\nthe necrohulk.\nLarge Plant, Neutral Evil",
  "sourceRef": {
    "file": "docs/sources/Monster Manual/Monsters (F) - Monster Manual - Dungeons & Dragons - Sources - D&D Beyond.pdf",
    "pages": [],
    "section": "Monsters"
  },
  "notes": []
}
