{
  "id": "monster.troll",
  "name": "TROLL",
  "status": "complete",
  "size_type_alignment": "Large Giant, Chaotic Evil",
  "size": "Large",
  "creature_type": "Giant",
  "alignment": "Chaotic Evil",
  "armor_class": 15,
  "hit_points": 94,
  "hit_dice": "9d10 + 45",
  "speed": "30 ft.",
  "abilities": {
    "STR": {
      "score": 18,
      "mod": "+4"
    },
    "DEX": {
      "score": 13,
      "mod": "+1"
    },
    "CON": {
      "score": 20,
      "mod": "+5"
    },
    "INT": {
      "score": 7,
      "mod": "-2"
    },
    "WIS": {
      "score": 9,
      "mod": "-1"
    },
    "CHA": {
      "score": 7,
      "mod": "-2"
    }
  },
  "saves": null,
  "skills": "Perception +5",
  "resistances": null,
  "immunities": null,
  "vulnerabilities": null,
  "condition_immunities": null,
  "senses": "Darkvision 60 ft.; Passive Perception 15",
  "languages": "Giant",
  "cr": "5 (XP 1,800; PB +3)",
  "traits": [
    {
      "name": "Loathsome Limbs (4/Day)",
      "text": "If the troll ends any turn Bloodied and took 15+ Slashing damage during that turn, one of the troll's limbs is severed, falls into the troll's space, and becomes a Troll Limb. The limb acts immediately after the troll's turn. The troll has 1 Exhaustion level for each missing limb, and it grows replacement limbs the next time it regains Hit Points."
    },
    {
      "name": "Regeneration",
      "text": "The troll regains 15 Hit Points at the start of each of its turns. If the troll takes Acid or Fire damage, this trait doesn't function on the troll's next turn. The troll dies only if it starts its turn with 0 Hit Points and doesn't regenerate."
    }
  ],
  "actions": [
    {
      "name": "Multiattack",
      "text": "The troll makes three Rend attacks."
    },
    {
      "name": "Rend",
      "text": "Melee Attack Roll: +7, reach 10 ft. Hit: 11 (2d6 + 4) Slashing damage."
    }
  ],
  "bonus_actions": [
    {
      "name": "Charge",
      "text": "The troll moves up to half its Speed straight toward an enemy it can see."
    }
  ],
  "reactions": [],
  "legendary_actions": [],
  "lair_actions": [],
  "regional_effects": [],
  "raw_text": "AC 15 \tInitiative +1 (11)\nHP 94 (9d10 + 45)\nSpeed 30 ft.\nMOD \tSAVE\nSTR \t18 \t+4 \t+4\nDEX \t13 \t+1 \t+1\nCON \t20 \t+5 \t+5\nMOD \tSAVE\nINT \t7 \t−2 \t−2\nWIS \t9 \t−1 \t−1\nCHA \t7 \t−2 \t−2\nSkills Perception +5\nSenses Darkvision 60 ft.; Passive Perception 15\nLanguages Giant\nCR 5 (XP 1,800; PB +3)\nTraits\nLoathsome Limbs (4/Day). If the troll ends any turn Bloodied and took 15+\nSlashing damage during that turn, one of the troll’s limbs is severed, falls into\nthe troll’s space, and becomes a Troll Limb. The limb acts immediately after\nthe troll’s turn. The troll has 1 Exhaustion level for each missing limb, and it\ngrows replacement limbs the next time it regains Hit Points.\nRegeneration. The troll regains 15 Hit Points at the start of each of its\nturns. If the troll takes Acid or Fire damage, this trait doesn’t function on the\ntroll’s next turn. The troll dies only if it starts its turn with 0 Hit Points and\ndoesn’t regenerate.\nActions\nMultiattack. The troll makes three Rend attacks.\nRend. Melee Attack Roll: +7, reach 10 ft.\nHit: 11 (2d6 + 4) Slashing damage.\nBonus Actions\nCharge. The troll moves up to half its Speed straight toward an enemy it\ncan see.\nLarge Giant, Chaotic Evil",
  "sourceRef": {
    "file": "docs/sources/Monster Manual/Monsters (T) - Monster Manual - Dungeons & Dragons - Sources - D&D Beyond.pdf",
    "pages": [],
    "section": "Monsters"
  },
  "notes": []
}
