{
  "id": "monster.gnoll_warrior",
  "name": "GNOLL WARRIOR",
  "status": "complete",
  "size_type_alignment": "Medium Fiend, Chaotic Evil",
  "size": "Medium",
  "creature_type": "Fiend",
  "alignment": "Chaotic Evil",
  "armor_class": 15,
  "hit_points": 27,
  "hit_dice": "6d8",
  "speed": "30 ft.",
  "abilities": {
    "STR": {
      "score": 14,
      "mod": "+2"
    },
    "DEX": {
      "score": 12,
      "mod": "+1"
    },
    "CON": {
      "score": 11,
      "mod": "+0"
    },
    "INT": {
      "score": 6,
      "mod": "-2"
    },
    "WIS": {
      "score": 10,
      "mod": "+0"
    },
    "CHA": {
      "score": 7,
      "mod": "-2"
    }
  },
  "saves": null,
  "skills": null,
  "resistances": null,
  "immunities": null,
  "vulnerabilities": null,
  "condition_immunities": null,
  "senses": "Darkvision 60 ft.; Passive Perception 10",
  "languages": "Gnoll",
  "cr": "1/2 (XP 100; PB +2)",
  "traits": [],
  "actions": [
    {
      "name": "Rend",
      "text": "Melee Attack Roll: +4, reach 5 ft. Hit: 5 (1d6 + 2) Piercing damage."
    },
    {
      "name": "Bone Bow",
      "text": "Ranged Attack Roll: +3, range 150/600 ft. Hit: 6 (1d10 + 1) Piercing damage."
    }
  ],
  "bonus_actions": [
    {
      "name": "Rampage (1/Day)",
      "text": "Immediately after dealing damage to a creature that is already Bloodied, the gnoll moves up to half its Speed, and it makes one Rend attack."
    }
  ],
  "reactions": [],
  "legendary_actions": [],
  "lair_actions": [],
  "regional_effects": [],
  "raw_text": "AC 15 \tInitiative +1 (11)\nHP 27 (6d8)\nSpeed 30 ft.\nMOD \tSAVE\nSTR \t14 \t+2 \t+2\nDEX \t12 \t+1 \t+1\nCON \t11 \t+0 \t+0\nMOD \tSAVE\nINT \t6 \t−2 \t−2\nWIS \t10 \t+0 \t+0\nCHA \t7 \t−2 \t−2\nSenses Darkvision 60 ft.; Passive Perception 10\nLanguages Gnoll\nCR 1/2 (XP 100; PB +2)\nActions\nRend. Melee Attack Roll: +4, reach 5 ft.\nHit: 5 (1d6 + 2) Piercing damage.\nBone Bow. Ranged Attack Roll: +3, range 150/600 ft.\nHit: 6 (1d10 + 1)\nPiercing damage.\nBonus Actions\nRampage (1/Day). Immediately after dealing damage to a creature that is\nalready Bloodied, the gnoll moves up to half its Speed, and it makes one\nRend attack.\nMedium Fiend, Chaotic Evil",
  "sourceRef": {
    "file": "docs/sources/Monster Manual/Monsters (G) - Monster Manual - Dungeons & Dragons - Sources - D&D Beyond.pdf",
    "pages": [],
    "section": "Monsters"
  },
  "notes": []
}
