{
  "id": "monster.minotaur_skeleton",
  "name": "MINOTAUR SKELETON",
  "status": "complete",
  "size_type_alignment": "Large Undead, Lawful Evil",
  "size": "Large",
  "creature_type": "Undead",
  "alignment": "Lawful Evil",
  "armor_class": 12,
  "hit_points": 45,
  "hit_dice": "6d10 + 12",
  "speed": "40 ft.",
  "abilities": {
    "STR": {
      "score": 18,
      "mod": "+4"
    },
    "DEX": {
      "score": 11,
      "mod": "+0"
    },
    "CON": {
      "score": 15,
      "mod": "+2"
    },
    "INT": {
      "score": 6,
      "mod": "-2"
    },
    "WIS": {
      "score": 8,
      "mod": "-1"
    },
    "CHA": {
      "score": 5,
      "mod": "-3"
    }
  },
  "saves": null,
  "skills": null,
  "resistances": null,
  "immunities": null,
  "vulnerabilities": null,
  "condition_immunities": null,
  "senses": "Darkvision 60 ft.; Passive Perception 9",
  "languages": "Understands Abyssal but can’t speak",
  "cr": "2 (XP 450; PB +2)",
  "traits": [],
  "actions": [
    {
      "name": "Gore",
      "text": "Melee Attack Roll: +6, reach 5 ft. Hit: 11 (2d6 + 4) Piercing damage. If the target is a Large or smaller creature and the skeleton moved 20+ feet straight toward it immediately before the hit, the target takes an extra 9 (2d8) Piercing damage and has the Prone condition."
    },
    {
      "name": "Slam",
      "text": "Melee Attack Roll: +6, reach 5 ft. Hit: 15 (2d10 + 4) Bludgeoning damage."
    }
  ],
  "bonus_actions": [],
  "reactions": [],
  "legendary_actions": [],
  "lair_actions": [],
  "regional_effects": [],
  "raw_text": "AC 12 \tInitiative +0 (10)\nHP 45 (6d10 + 12)\nSpeed 40 ft.\nMOD \tSAVE\nSTR \t18 \t+4 \t+4\nDEX \t11 \t+0 \t+0\nCON \t15 \t+2 \t+2\nMOD \tSAVE\nINT \t6 \t−2 \t−2\nWIS \t8 \t−1 \t−1\nCHA \t5 \t−3 \t−3\nVulnerabilities Bludgeoning\nImmunities Poison; Exhaustion, Poisoned\nSenses Darkvision 60 ft.; Passive Perception 9\nLanguages Understands Abyssal but can’t speak\nCR 2 (XP 450; PB +2)\nActions\nGore. Melee Attack Roll: +6, reach 5 ft.\nHit: 11 (2d6 + 4) Piercing damage. If the\ntarget is a Large or smaller creature and the skeleton moved 20+ feet straight\ntoward it immediately before the hit, the target takes an extra 9 (2d8) Piercing\ndamage and has the Prone condition.\nSlam. Melee Attack Roll: +6, reach 5 ft.\nHit: 15 (2d10 + 4) Bludgeoning damage.\nLarge Undead, Lawful Evil",
  "sourceRef": {
    "file": "docs/sources/Monster Manual/Monsters (S) - Monster Manual - Dungeons & Dragons - Sources - D&D Beyond.pdf",
    "pages": [],
    "section": "Monsters"
  },
  "notes": []
}
