{
  "id": "monster.cockatrice_regent",
  "name": "COCKATRICE REGENT",
  "status": "complete",
  "size_type_alignment": "Large Monstrosity, Unaligned",
  "size": "Large",
  "creature_type": "Monstrosity",
  "alignment": "Unaligned",
  "armor_class": 15,
  "hit_points": 136,
  "hit_dice": "16d10 + 48",
  "speed": "30 ft., Fly 60 ft.",
  "abilities": {
    "STR": {
      "score": 19,
      "mod": "+4"
    },
    "DEX": {
      "score": 14,
      "mod": "+2"
    },
    "CON": {
      "score": 16,
      "mod": "+3"
    },
    "INT": {
      "score": 3,
      "mod": "-4"
    },
    "WIS": {
      "score": 16,
      "mod": "+3"
    },
    "CHA": {
      "score": 5,
      "mod": "-3"
    }
  },
  "saves": null,
  "skills": null,
  "resistances": null,
  "immunities": null,
  "vulnerabilities": null,
  "condition_immunities": null,
  "senses": "Darkvision 120 ft.; Passive Perception 13",
  "languages": "None",
  "cr": "8 (XP 3,900; PB +3)",
  "traits": [
    {
      "name": "Flyby",
      "text": "The cockatrice doesn't provoke an Opportunity Attack when it flies out of an enemy's reach. Colossus"
    }
  ],
  "actions": [
    {
      "name": "Multiattack",
      "text": "The cockatrice makes one Petrifying Bite attack and two Talons attacks."
    },
    {
      "name": "Petrifying Bite",
      "text": "Melee Attack Roll: +7, reach 5 ft. Hit: 13 (2d8 + 4) Piercing damage. If the target is a creature, it is subjected to the following effect. Constitution Saving Throw: DC 14. First Failure: The target has the Restrained condition and repeats the save at the end of its next turn if it is still Restrained, ending the effect on itself on a success. Second Failure: The target has the Petrified condition instead of the Restrained condition."
    },
    {
      "name": "Talons",
      "text": "Melee Attack Roll: +7, reach 5 ft. Hit: 18 (4d6 + 4) Slashing damage."
    }
  ],
  "bonus_actions": [],
  "reactions": [
    {
      "name": "Magical Backlash",
      "text": "Trigger: A creature within 120 feet of the cockatrice deals damage to it. Response-Dexterity Saving Throw: DC 14, the triggering creature. Failure: 13 (3d6 + 3) Force damage."
    }
  ],
  "legendary_actions": [],
  "lair_actions": [],
  "regional_effects": [],
  "raw_text": "AC 15 \tInitiative +2 (12)\nHP 136 (16d10 + 48)\nSpeed 30 ft., Fly 60 ft.\nMOD \tSAVE\nSTR \t19 \t+4 \t+4\nDEX \t14 \t+2 \t+2\nCON \t16 \t+3 \t+3\nMOD \tSAVE\nINT \t3 \t−4 \t−4\nWIS \t16 \t+3 \t+6\nCHA \t5 \t−3 \t−3\nImmunities Petrified\nSenses Darkvision 120 ft.; Passive Perception 13\nLanguages None\nCR 8 (XP 3,900; PB +3)\nTraits\nFlyby. The cockatrice doesn’t provoke an Opportunity Attack when it flies out\nof an enemy’s reach.\nLarge Monstrosity, Unaligned\nColossus\nTitanic Vessel of Divine Might\nHabitat: Any; Treasure: Relics\nColossi are massive Constructs created by the devout to reflect the nature of a deity, which could be benevolent or wicked. Colossi thrum with incredible\nmagic and work divine will on the land.\nDroves of faithful artisans craft a colossus in a shape to honor their deity,\nthen call on that god to infuse the statue with life. This arduous process\nmight take decades and involve hundreds of workers. If the god favors the\ncreation, the mighty crystal at the construct’s heart pulses with divine power,\nand the colossus rises to protect the faithful or enact the god’s will.\nMost colossi were created in ages past and now lie dormant in secluded\nwilderness, awakening only when disturbed or called on to serve once more.\nActions\nMultiattack. The cockatrice makes one Petrifying Bite attack and two\nTalons attacks.\nPetrifying Bite. Melee Attack Roll: +7, reach 5 ft.\nHit: 13 (2d8 + 4) Piercing\ndamage. If the target is a creature, it is subjected to the following effect.\nConstitution Saving Throw: DC 14.\nFirst Failure: The target has the Restrained\ncondition and repeats the save at the end of its next turn if it is still Restrained,\nending the effect on itself on a success.\nSecond Failure: The target has the\nPetrified condition instead of the Restrained condition.\nTalons. Melee Attack Roll: +7, reach 5 ft.\nHit: 18 (4d6 + 4) Slashing damage.\nReactions\nMagical Backlash. Trigger: A creature within 120 feet of the cockatrice deals\ndamage to it.\nResponse—Dexterity Saving Throw: DC 14, the triggering\ncreature.\nFailure: 13 (3d6 + 3) Force damage.",
  "sourceRef": {
    "file": "docs/sources/Monster Manual/Monsters (C) - Monster Manual - Dungeons & Dragons - Sources - D&D Beyond.pdf",
    "pages": [],
    "section": "Monsters"
  },
  "notes": []
}
