{
  "id": "monster.ghost",
  "name": "GHOST",
  "status": "complete",
  "size_type_alignment": "Medium Undead, Neutral",
  "size": "Medium",
  "creature_type": "Undead",
  "alignment": "Neutral",
  "armor_class": 11,
  "hit_points": 45,
  "hit_dice": "10d8",
  "speed": "5 ft., Fly 40 ft. (hover)",
  "abilities": {
    "STR": {
      "score": 7,
      "mod": "-2"
    },
    "DEX": {
      "score": 13,
      "mod": "+1"
    },
    "CON": {
      "score": 10,
      "mod": "+0"
    },
    "INT": {
      "score": 10,
      "mod": "+0"
    },
    "WIS": {
      "score": 12,
      "mod": "+1"
    },
    "CHA": {
      "score": 17,
      "mod": "+3"
    }
  },
  "saves": null,
  "skills": null,
  "resistances": "Acid, Bludgeoning, Cold, Fire, Lightning, Piercing, Slashing, Thunder",
  "immunities": "Necrotic, Poison",
  "vulnerabilities": null,
  "condition_immunities": "Charmed, Exhaustion, Frightened, Grappled, Paralyzed, Petrified, Poisoned, Prone, Restrained",
  "senses": "Darkvision 60 ft.; Passive Perception 11",
  "languages": "Common plus one other language",
  "cr": "4 (XP 1,100; PB +2)",
  "traits": [
    {
      "name": "Ethereal Sight",
      "text": "The ghost can see 60 feet into the Ethereal Plane when it is on the Material Plane."
    },
    {
      "name": "Incorporeal Movement",
      "text": "The ghost can move through other creatures and objects as if they were Difficult Terrain. It takes 5 (1d10) Force damage if it ends its turn inside an object."
    }
  ],
  "actions": [
    {
      "name": "Multiattack",
      "text": "The ghost makes two Withering Touch attacks."
    },
    {
      "name": "Withering Touch",
      "text": "Melee Attack Roll: +5, reach 5 ft. Hit: 19 (3d10 + 3) Necrotic damage."
    },
    {
      "name": "Etherealness",
      "text": "The ghost casts the Etherealness spell, requiring no spell components and using Charisma as the spellcasting ability. The ghost is visible on the Material Plane while on the Border Ethereal and vice versa, but it can't affect or be affected by anything on the other plane."
    },
    {
      "name": "Horrific Visage",
      "text": "Wisdom Saving Throw: DC 13, each creature in a 60-foot Cone that can see the ghost and isn't an Undead. Failure: 10 (2d6 + 3) Psychic damage, and the target has the Frightened condition until the start of the ghost's next turn. Success: The target is immune to this ghost's Horrific Visage for 24 hours."
    },
    {
      "name": "Possession (Recharge 6)",
      "text": "Charisma Saving Throw: DC 13, one Humanoid the ghost can see within 5 feet. Failure: The target is possessed by the ghost; the ghost disappears, and the target has the Incapacitated condition and loses control of its body. The ghost now controls the body, but the target retains awareness. The ghost can't be targeted by any attack, spell, or other effect, except ones that specifically target Undead. The ghost's game statistics are the same, except it uses the possessed target's Speed, as well as the target's Strength, Dexterity, and Constitution modifiers. The possession lasts until the body drops to 0 Hit Points or the ghost leaves as a Bonus Action. When the possession ends, the ghost appears in an unoccupied space within 5 feet of the target, and the target is immune to this ghost's Possession for 24 hours. Success: The target is immune to this ghost's Possession for 24 hours."
    }
  ],
  "bonus_actions": [],
  "reactions": [],
  "legendary_actions": [],
  "lair_actions": [],
  "regional_effects": [],
  "raw_text": "AC 11 \tInitiative +1 (11)\nHP 45 (10d8)\nSpeed 5 ft., Fly 40 ft. (hover)\nMOD \tSAVE\nSTR \t7 \t−2 \t−2\nDEX \t13 \t+1 \t+1\nCON \t10 \t+0 \t+0\nMOD \tSAVE\nINT \t10 \t+0 \t+0\nWIS \t12 \t+1 \t+1\nCHA \t17 \t+3 \t+3\nResistances Acid, Bludgeoning, Cold, Fire, Lightning, Piercing,\nSlashing, Thunder\nImmunities Necrotic, Poison; Charmed, Exhaustion, Frightened, Grappled,\nParalyzed, Petrified, Poisoned, Prone, Restrained\nSenses Darkvision 60 ft.; Passive Perception 11\nLanguages Common plus one other language\nCR 4 (XP 1,100; PB +2)\nTraits\nEthereal Sight. The ghost can see 60 feet into the Ethereal Plane when it is on\nthe Material Plane.\nIncorporeal Movement. The ghost can move through other creatures and\nobjects as if they were Difficult Terrain. It takes 5 (1d10) Force damage if it\nends its turn inside an object.\nActions\nMultiattack. The ghost makes two Withering Touch attacks.\nWithering Touch. Melee Attack Roll: +5, reach 5 ft.\nHit: 19 (3d10 + 3)\nNecrotic damage.\nEtherealness. The ghost casts the\nEtherealness spell, requiring no spell\ncomponents and using Charisma as the spellcasting ability. The ghost is\nvisible on the Material Plane while on the Border Ethereal and vice versa, but it\ncan’t affect or be affected by anything on the other plane.\nHorrific Visage. Wisdom Saving Throw: DC 13, each creature in a 60-foot Cone\nthat can see the ghost and isn’t an Undead.\nFailure: 10 (2d6 + 3) Psychic\ndamage, and the target has the Frightened condition until the start of the\nghost’s next turn.\nSuccess: The target is immune to this ghost’s Horrific\nVisage for 24 hours.\nPossession (Recharge 6). Charisma Saving Throw: DC 13, one Humanoid the\nghost can see within 5 feet.\nFailure: The target is possessed by the ghost; the\nghost disappears, and the target has the Incapacitated condition and loses\ncontrol of its body. The ghost now controls the body, but the target retains\nawareness. The ghost can’t be targeted by any attack, spell, or other effect,\nexcept ones that specifically target Undead. The ghost’s game statistics are\nthe same, except it uses the possessed target’s Speed, as well as the target’s\nStrength, Dexterity, and Constitution modifiers.\nThe possession lasts until the body drops to 0 Hit Points or the ghost leaves\nas a Bonus Action. When the possession ends, the ghost appears in an\nunoccupied space within 5 feet of the target, and the target is immune to this\nghost’s Possession for 24 hours.\nSuccess: The target is immune to this ghost’s Possession for 24 hours.\nMedium Undead, Neutral\nPacks of ghouls haunt the rotten corners of the world, ravenously hunting for corpses and those soon to be corpses. These gaunt, animate cadavers with\nunnaturally long tongues dwell in catacombs and ruins where they devour the contents of graves and paralyze foes with vicious claws.\nGhoul\nGhouls rise from the bodies of cannibals and villains with depraved hungers. They form packs out of shared voracity.\nOn a plain of teeth, in a temple of filth, the starving king wastes\nno morsel. Every coffin a banquet. Every slab a platter. Now is\nthe time of feasting!\n—INVOCATION OF DORESAIN, KING OF GHOULS",
  "sourceRef": {
    "file": "docs/sources/Monster Manual/Monsters (G) - Monster Manual - Dungeons & Dragons - Sources - D&D Beyond.pdf",
    "pages": [],
    "section": "Monsters"
  },
  "notes": []
}
