{
  "id": "monster.adult_white_dragon",
  "name": "ADULT WHITE DRAGON",
  "status": "complete",
  "size_type_alignment": "Huge Dragon (Chromatic), Chaotic Evil",
  "size": "Huge",
  "creature_type": "Dragon (Chromatic)",
  "alignment": "Chaotic Evil",
  "armor_class": 18,
  "hit_points": 200,
  "hit_dice": "16d12 + 96",
  "speed": "40 ft., Burrow 30 ft., Fly 80 ft., Swim 40 ft.",
  "abilities": {
    "STR": {
      "score": 22,
      "mod": "+6"
    },
    "DEX": {
      "score": 10,
      "mod": "+0"
    },
    "CON": {
      "score": 22,
      "mod": "+6"
    },
    "INT": {
      "score": 8,
      "mod": "-1"
    },
    "WIS": {
      "score": 12,
      "mod": "+1"
    },
    "CHA": {
      "score": 12,
      "mod": "+1"
    }
  },
  "saves": null,
  "skills": "Perception +11, Stealth +5",
  "resistances": null,
  "immunities": null,
  "vulnerabilities": null,
  "condition_immunities": null,
  "senses": "Blindsight 60 ft., Darkvision 120 ft.; Passive Perception 21",
  "languages": "Common, Draconic",
  "cr": "13 (XP 10,000, or 11,500 in lair; PB +5)",
  "traits": [
    {
      "name": "Ice Walk",
      "text": "The dragon can move across and climb icy surfaces without needing to make an ability check. Additionally, Difficult Terrain composed of ice or snow doesn't cost it extra movement."
    },
    {
      "name": "Legendary Resistance (3/Day, or 4/Day in Lair)",
      "text": "If the dragon fails a saving throw, it can choose to succeed instead."
    }
  ],
  "actions": [
    {
      "name": "Multiattack",
      "text": "The dragon makes three Rend attacks."
    },
    {
      "name": "Rend",
      "text": "Melee Attack Roll: +11, reach 10 ft. Hit: 13 (2d6 + 6) Slashing damage plus 4 (1d8) Cold damage."
    },
    {
      "name": "Cold Breath (Recharge 5-6)",
      "text": "Constitution Saving Throw: DC 19, each creature in a 60-foot Cone. Failure: 54 (12d8) Cold damage. Success: Half damage."
    }
  ],
  "bonus_actions": [],
  "reactions": [],
  "legendary_actions": [
    {
      "name": "Freezing Burst",
      "text": "Constitution Saving Throw: DC 14, each creature in a 30-foot- radius Sphere centered on a point the dragon can see within 120 feet. Failure: 7 (2d6) Cold damage, and the target's Speed is 0 until the end of the target's next turn. Failure or Success: The dragon can't take this action again until the start of its next turn."
    },
    {
      "name": "Frightful Presence",
      "text": "The dragon casts Fear, requiring no Material components and using Charisma as the spellcasting ability (spell save DC 14). The dragon can't take this action again until the start of its next turn."
    },
    {
      "name": "Pounce",
      "text": "The dragon moves up to half its Speed, and it makes one Rend attack."
    }
  ],
  "lair_actions": [],
  "regional_effects": [],
  "raw_text": "AC 18 \tInitiative +10 (20)\nHP 200 (16d12 + 96)\nSpeed 40 ft., Burrow 30 ft., Fly 80 ft., Swim 40 ft.\nMOD \tSAVE\nSTR \t22 \t+6 \t+6\nDEX \t10 \t+0 \t+5\nCON \t22 \t+6 \t+6\nMOD \tSAVE\nINT \t8 \t−1 \t−1\nWIS \t12 \t+1 \t+6\nCHA \t12 \t+1 \t+1\nSkills Perception +11, Stealth +5\nImmunities Cold\nSenses Blindsight 60 ft., Darkvision 120 ft.; Passive Perception 21\nLanguages Common, Draconic\nCR 13 (XP 10,000, or 11,500 in lair; PB +5)\nTraits\nIce Walk. The dragon can move across and climb icy surfaces without needing\nto make an ability check. Additionally, Difficult Terrain composed of ice or\nsnow doesn’t cost it extra movement.\nLegendary Resistance (3/Day, or 4/Day in Lair). If the dragon fails a saving\nthrow, it can choose to succeed instead.\nActions\nMultiattack. The dragon makes three Rend attacks.\nRend. Melee Attack Roll: +11, reach 10 ft.\nHit: 13 (2d6 + 6) Slashing damage\nplus 4 (1d8) Cold damage.\nCold Breath (Recharge 5–6). Constitution Saving Throw: DC 19, each creature\nin a 60-foot Cone.\nFailure: 54 (12d8) Cold damage.\nSuccess: Half damage.\nLegendary Actions\nLegendary Action Uses: 3 (4 in Lair). Immediately after another creature’s turn,\nthe dragon can expend a use to take one of the following actions. The dragon\nregains all expended uses at the start of each of its turns.\nFreezing Burst. Constitution Saving Throw: DC 14, each creature in a 30-foot-\nradius Sphere centered on a point the dragon can see within 120 feet.\nFailure: 7\n(2d6) Cold damage, and the target’s Speed is 0 until the end of the target’s next\nturn.\nFailure or Success: The dragon can’t take this action again until the start\nof its next turn.\nFrightful Presence. The dragon casts\nFear, requiring no Material components\nand using Charisma as the spellcasting ability (spell save DC 14). The dragon\ncan’t take this action again until the start of its next turn.\nPounce. The dragon moves up to half its Speed, and it makes one Rend attack.\nHuge Dragon (Chromatic), Chaotic Evil\nLike arctic storms, ancient white dragons threaten icy realms. They emerge from their frozen lairs to indulge their hungers for food or treasure, menacing\nother creatures with lethal cold. While they might ignore animals or small groups of polar wanderers, these dragons are quick to challenge other dragons\nand creatures wielding powerful magic, hoping to add their foes’ skulls and magic items to their own hoards.\nAN ANCIENT WHITE DRAGON FREEZES A SHIP FULL OF\nTRESPASSERS BEFORE THEY SET FOOT IN ITS TERRITORY",
  "sourceRef": {
    "file": "docs/sources/Monster Manual/Monsters (W) - Monster Manual - Dungeons & Dragons - Sources - D&D Beyond.pdf",
    "pages": [],
    "section": "Monsters"
  },
  "notes": [
    "Legendary Action Uses: 3 (4 in Lair). Immediately after another creature's turn, the dragon can expend a use to take one of the following actions. The dragon regains all expended uses at the start of each of its turns."
  ]
}
