{
  "id": "monster.priest",
  "name": "PRIEST",
  "status": "complete",
  "size_type_alignment": "Medium or Small Humanoid (Cleric), Neutral",
  "size": "Medium",
  "creature_type": "Humanoid (Cleric)",
  "alignment": "Neutral",
  "armor_class": 13,
  "hit_points": 38,
  "hit_dice": "7d8 + 7",
  "speed": "30 ft.",
  "abilities": {
    "STR": {
      "score": 16,
      "mod": "+3"
    },
    "DEX": {
      "score": 10,
      "mod": "+0"
    },
    "CON": {
      "score": 12,
      "mod": "+1"
    },
    "INT": {
      "score": 13,
      "mod": "+1"
    },
    "WIS": {
      "score": 16,
      "mod": "+3"
    },
    "CHA": {
      "score": 13,
      "mod": "+1"
    }
  },
  "saves": null,
  "skills": "Medicine +7, Perception +5, Religion +5",
  "resistances": null,
  "immunities": null,
  "vulnerabilities": null,
  "condition_immunities": null,
  "senses": "Passive Perception 15",
  "languages": "Common plus one other language",
  "cr": "2 (XP 450; PB +2)",
  "traits": [],
  "actions": [
    {
      "name": "Multiattack",
      "text": "The priest makes two attacks, using Mace or Radiant Flame in any combination."
    },
    {
      "name": "Mace",
      "text": "Melee Attack Roll: +5, reach 5 ft. Hit: 6 (1d6 + 3) Bludgeoning damage plus 5 (2d4) Radiant damage."
    },
    {
      "name": "Radiant Flame",
      "text": "Ranged Attack Roll: +5, range 60 ft. Hit: 11 (2d10) Radiant damage."
    },
    {
      "name": "Spellcasting",
      "text": "The priest casts one of the following spells, using Wisdom as the spellcasting ability (spell save DC 13): At Will: Light, Thaumaturgy 1/Day: Spirit Guardians"
    }
  ],
  "bonus_actions": [
    {
      "name": "Divine Aid (3/Day)",
      "text": "The priest casts Bless, Dispel Magic, Healing Word, or Lesser Restoration, using the same spellcasting ability as Spellcasting."
    },
    {
      "name": "Shining One, light my hours",
      "text": "Enkindle my soul, and inspire my deeds. Chase the shadows from my path, and let me walk in your brilliance. -Morning prayer to Pelor"
    }
  ],
  "reactions": [],
  "legendary_actions": [],
  "lair_actions": [],
  "regional_effects": [],
  "raw_text": "AC 13 \tInitiative +0 (10)\nHP 38 (7d8 + 7)\nSpeed 30 ft.\nMOD \tSAVE\nSTR \t16 \t+3 \t+3\nDEX \t10 \t+0 \t+0\nCON \t12 \t+1 \t+1\nMOD \tSAVE\nINT \t13 \t+1 \t+1\nWIS \t16 \t+3 \t+3\nCHA \t13 \t+1 \t+1\nSkills Medicine +7, Perception +5, Religion +5\nGear Chain Shirt, Holy Symbol, Mace\nMedium or Small Humanoid (Cleric), Neutral\nArchpriest\nBy forging connections with divine beings and mastering mystical truths, archpriests become conduits for godly intentions and other supernatural forces.\nTheir magic allows them to work wonders, whether to share the benevolence of their faiths or to vent divine wrath. Some archpriests attract vast followings\nas they claim to speak for divine forces, while others undertake personal spiritual journeys and seek to transcend mortal concerns.\nPseudodragon\nFickle, Pint-Sized Dragon\nHabitat: Coastal, Desert, Forest, Hill, Mountain, Urban; Treasure: Arcana\nPseudodragons dwell in scenic wildernesses, preferably where life is easy and prey is small and slow. There they behave like contented wyrms, creating tiny\nlairs amid ancient trees and rugged cliffs. They fill these lairs with shiny rocks, colorful shells, and unattended treasures that catch their attention, and they\nguard these hoards fiercely.\nSenses Passive Perception 15\nLanguages Common plus one other language\nCR 2 (XP 450; PB +2)\nActions\nMultiattack. The priest makes two attacks, using Mace or Radiant Flame in\nany combination.\nMace. Melee Attack Roll: +5, reach 5 ft.\nHit: 6 (1d6 + 3) Bludgeoning damage\nplus 5 (2d4) Radiant damage.\nRadiant Flame. Ranged Attack Roll: +5, range 60 ft.\nHit: 11 (2d10)\nRadiant damage.\nSpellcasting. The priest casts one of the following spells, using Wisdom as\nthe spellcasting ability (spell save DC 13):\nAt Will:\nLight,\nThaumaturgy\n1/Day:\nSpirit Guardians\nBonus Actions\nDivine Aid (3/Day). The priest casts\nBless,\nDispel Magic,\nHealing Word, or\nLesser Restoration, using the same spellcasting ability as Spellcasting.\nShining One, light my hours. Enkindle my soul, and inspire my\ndeeds. Chase the shadows from my path, and let me walk in\nyour brilliance.\nâ€”Morning prayer to Pelor",
  "sourceRef": {
    "file": "docs/sources/Monster Manual/Monsters (P) - Monster Manual - Dungeons & Dragons - Sources - D&D Beyond.pdf",
    "pages": [],
    "section": "Monsters"
  },
  "notes": []
}
