{
  "id": "monster.poltergeist",
  "name": "POLTERGEIST",
  "status": "complete",
  "size_type_alignment": "Medium or Small Undead, Chaotic Neutral",
  "size": "Medium",
  "creature_type": "Undead",
  "alignment": "Chaotic Neutral",
  "armor_class": 12,
  "hit_points": 22,
  "hit_dice": "5d8",
  "speed": "5 ft., Fly 50 ft. (hover)",
  "abilities": {
    "STR": {
      "score": 1,
      "mod": "-5"
    },
    "DEX": {
      "score": 14,
      "mod": "+2"
    },
    "CON": {
      "score": 11,
      "mod": "+0"
    },
    "INT": {
      "score": 10,
      "mod": "+0"
    },
    "WIS": {
      "score": 10,
      "mod": "+0"
    },
    "CHA": {
      "score": 14,
      "mod": "+2"
    }
  },
  "saves": null,
  "skills": null,
  "resistances": null,
  "immunities": null,
  "vulnerabilities": null,
  "condition_immunities": null,
  "senses": "Darkvision 60 ft.; Passive Perception 10",
  "languages": "Common plus one other language",
  "cr": "2 (XP 450; PB +2)",
  "traits": [
    {
      "name": "Incorporeal Movement",
      "text": "The poltergeist can move through other creatures and objects as if they were Difficult Terrain. It takes 5 (1d10) Force damage if it ends its turn inside an object."
    }
  ],
  "actions": [
    {
      "name": "Multiattack",
      "text": "The poltergeist makes one Object Slam attack and uses Telekinetic Thrust."
    },
    {
      "name": "Object Slam",
      "text": "Melee or Ranged Attack Roll: +4, reach 5 ft. or range 30 ft. Hit: 7 (2d4 + 2) Bludgeoning damage."
    },
    {
      "name": "Telekinetic Thrust",
      "text": "Strength Saving Throw: DC 12, one creature the poltergeist can see within 30 feet. Failure: 9 (2d6 + 2) Force damage, and the target is pushed up to 30 feet straight away from the poltergeist."
    }
  ],
  "bonus_actions": [
    {
      "name": "Vanish",
      "text": "The poltergeist gives itself the Invisible condition or ends that condition on itself."
    }
  ],
  "reactions": [],
  "legendary_actions": [],
  "lair_actions": [],
  "regional_effects": [],
  "raw_text": "AC 12 \tInitiative +2 (12)\nHP 22 (5d8)\nSpeed 5 ft., Fly 50 ft. (hover)\nMedium or Small Undead, Chaotic Neutral\nPriests\nArbiters of the Mortal and the Divine\nHabitat: Any; Treasure: Individual, Relics\nPriests harness the power of faith to work miracles. These religious adherents are as diverse as the faiths they follow. Some obey gods and their servants,\nwhile others live by age-old creeds. Belief guides priests’ actions and their magic, which they use to shape the world in line with their ideologies.\nRoll on or choose a result from the Priest Roles table to inspire different sorts of priests.\nPriest Roles\n1d10 \tThe Priest Is...\nMOD \tSAVE\nSTR \t1 \t−5 \t−5\nDEX \t14 \t+2 \t+2\nCON \t11 \t+0 \t+0\nMOD \tSAVE\nINT \t10 \t+0 \t+0\nWIS \t10 \t+0 \t+0\nCHA \t14 \t+2 \t+2\nResistances Acid, Bludgeoning, Cold, Fire, Lightning, Piercing,\nSlashing, Thunder\nImmunities Necrotic, Poison; Charmed, Exhaustion, Grappled, Paralyzed,\nPetrified, Poisoned, Prone, Restrained, Unconscious\nSenses Darkvision 60 ft.; Passive Perception 10\nLanguages Common plus one other language\nCR 2 (XP 450; PB +2)\nTraits\nIncorporeal Movement. The poltergeist can move through other creatures and\nobjects as if they were Difficult Terrain. It takes 5 (1d10) Force damage if it\nends its turn inside an object.\nActions\nMultiattack. The poltergeist makes one Object Slam attack and uses\nTelekinetic Thrust.\nObject Slam. Melee or Ranged Attack Roll: +4, reach 5 ft. or range 30 ft.\nHit: 7\n(2d4 + 2) Bludgeoning damage.\nTelekinetic Thrust. Strength Saving Throw: DC 12, one creature the poltergeist\ncan see within 30 feet.\nFailure: 9 (2d6 + 2) Force damage, and the target is\npushed up to 30 feet straight away from the poltergeist.\nBonus Actions\nVanish. The poltergeist gives itself the Invisible condition or ends that\ncondition on itself.\n1d10 \tThe Priest Is...\n1 \tAn ascetic who keeps wicked spirits at bay.\n2 \tAn elder who speaks for the dead.\n3 \tAn exorcist who hunts wicked spirits.\n4 \tA follower of a god no one has heard of.\n5 \tA mediator and teacher of traditional ways.\n6 \tA philosopher devoted to a concept, multiversal view, or plane of existence.\n7 \tThe reincarnation of an ancient faith leader.\n8 \tA ritualist who uses tinctures and performances to access the divine.\n9 \tA shaman whose medicines ease many ills.\n10 \tA zealot who wages war for a divine cause.\nPriest Acolyte\nPriest acolytes have great faith but modest magical skill. Some might be trainees in religious organizations or soldiers in zealous armies, while others are\nfaith leaders in small communities or wanderers on pilgrimages.\nPriest\nPriests draw on their beliefs to heal the needful and smite their foes. They can channel their faith as spells and empower their weapons with divine might.",
  "sourceRef": {
    "file": "docs/sources/Monster Manual/Monsters (P) - Monster Manual - Dungeons & Dragons - Sources - D&D Beyond.pdf",
    "pages": [],
    "section": "Monsters"
  },
  "notes": []
}
