{
  "id": "monster.lizardfolk_geomancer",
  "name": "LIZARDFOLK GEOMANCER",
  "status": "complete",
  "size_type_alignment": "Medium Elemental, Neutral",
  "size": "Medium",
  "creature_type": "Elemental",
  "alignment": "Neutral",
  "armor_class": 13,
  "hit_points": 33,
  "hit_dice": "6d8 + 6",
  "speed": "30 ft., Burrow 20 ft., Swim 30 ft.",
  "abilities": {
    "STR": {
      "score": 15,
      "mod": "+2"
    },
    "DEX": {
      "score": 10,
      "mod": "+0"
    },
    "CON": {
      "score": 13,
      "mod": "+1"
    },
    "INT": {
      "score": 10,
      "mod": "+0"
    },
    "WIS": {
      "score": 15,
      "mod": "+2"
    },
    "CHA": {
      "score": 8,
      "mod": "-1"
    }
  },
  "saves": null,
  "skills": "Nature +2, Perception +4, Stealth +4",
  "resistances": null,
  "immunities": null,
  "vulnerabilities": null,
  "condition_immunities": null,
  "senses": "Passive Perception 14",
  "languages": "Draconic, Primordial (Terran)",
  "cr": "2 (XP 450; PB +2)",
  "traits": [],
  "actions": [
    {
      "name": "Multiattack",
      "text": "The lizardfolk makes two Earth Burst attacks."
    },
    {
      "name": "Earth Burst",
      "text": "Melee or Ranged Attack Roll: +4, reach 5 ft. or range 60 ft. Hit: 9 (2d6 + 2) Bludgeoning damage."
    },
    {
      "name": "Hail of Stone (Recharge 5-6)",
      "text": "Constitution Saving Throw: DC 12, each creature in a 20-foot-radius, 40-foot-high Cylinder centered on a point the lizardfolk can see within 60 feet. Failure: 15 (6d4) Bludgeoning damage, and the target has the Prone condition. Success: Half damage only."
    },
    {
      "name": "Spellcasting",
      "text": "The lizardfolk casts one of the following spells, requiring no Material components and using Wisdom as the spellcasting ability (spell save DC 12): At Will: Elementalism 1/Day Each: Meld into Stone, Speak with Plants, Spike Growth"
    }
  ],
  "bonus_actions": [],
  "reactions": [],
  "legendary_actions": [],
  "lair_actions": [],
  "regional_effects": [],
  "raw_text": "AC 13 \tInitiative +0 (10)\nHP 33 (6d8 + 6)\nSpeed 30 ft., Burrow 20 ft., Swim 30 ft.\nMOD \tSAVE\nSTR \t15 \t+2 \t+2\nDEX \t10 \t+0 \t+0\nCON \t13 \t+1 \t+1\nMOD \tSAVE\nINT \t10 \t+0 \t+0\nWIS \t15 \t+2 \t+2\nCHA \t8 \t−1 \t−1\nSkills Nature +2, Perception +4, Stealth +4\nSenses Passive Perception 14\nLanguages Draconic, Primordial (Terran)\nCR 2 (XP 450; PB +2)\nActions\nMultiattack. The lizardfolk makes two Earth Burst attacks.\nEarth Burst. Melee or Ranged Attack Roll: +4, reach 5 ft. or range 60 ft.\nHit: 9\n(2d6 + 2) Bludgeoning damage.\nHail of Stone (Recharge 5–6). Constitution Saving Throw: DC 12, each creature\nin a 20-foot-radius, 40-foot-high Cylinder centered on a point the lizardfolk can\nsee within 60 feet.\nFailure: 15 (6d4) Bludgeoning damage, and the target has\nthe Prone condition.\nSuccess: Half damage only.\nSpellcasting. The lizardfolk casts one of the following spells, requiring no\nMaterial components and using Wisdom as the spellcasting ability (spell save\nDC 12):\nAt Will:\nElementalism\n1/Day Each:\nMeld into Stone,\nSpeak with Plants,\nSpike Growth\nMedium Elemental, Neutral",
  "sourceRef": {
    "file": "docs/sources/Monster Manual/Monsters (L) - Monster Manual - Dungeons & Dragons - Sources - D&D Beyond.pdf",
    "pages": [],
    "section": "Monsters"
  },
  "notes": []
}
