{
  "id": "monster.dretch",
  "name": "DRETCH",
  "status": "complete",
  "size_type_alignment": "Small Fiend (Demon), Chaotic Evil",
  "size": "Small",
  "creature_type": "Fiend (Demon)",
  "alignment": "Chaotic Evil",
  "armor_class": 11,
  "hit_points": 18,
  "hit_dice": "4d6 + 4",
  "speed": "20 ft.",
  "abilities": {
    "STR": {
      "score": 12,
      "mod": "+1"
    },
    "DEX": {
      "score": 11,
      "mod": "+0"
    },
    "CON": {
      "score": 12,
      "mod": "+1"
    },
    "INT": {
      "score": 5,
      "mod": "-3"
    },
    "WIS": {
      "score": 8,
      "mod": "-1"
    },
    "CHA": {
      "score": 3,
      "mod": "-4"
    }
  },
  "saves": null,
  "skills": null,
  "resistances": null,
  "immunities": null,
  "vulnerabilities": null,
  "condition_immunities": null,
  "senses": "Darkvision 60 ft.; Passive Perception 9",
  "languages": "Abyssal; telepathy 60 ft. (works only with creatures that",
  "cr": "1/4 (XP 50; PB +2)",
  "traits": [],
  "actions": [
    {
      "name": "Rend",
      "text": "Melee Attack Roll: +3, reach 5 ft. Hit: 4 (1d6 + 1) Slashing damage."
    },
    {
      "name": "Fetid Cloud (1/Day)",
      "text": "Constitution Saving Throw: DC 11, each creature in a 10- foot Emanation originating from the dretch. Failure: The target has the Poisoned condition until the end of its next turn. While Poisoned, the creature can take either an action or a Bonus Action on its turn, not both, and it can't take Reactions."
    }
  ],
  "bonus_actions": [],
  "reactions": [],
  "legendary_actions": [],
  "lair_actions": [],
  "regional_effects": [],
  "raw_text": "AC 11 \tInitiative +0 (10)\nHP 18 (4d6 + 4)\nSpeed 20 ft.\nMOD \tSAVE\nSTR \t12 \t+1 \t+1\nDEX \t11 \t+0 \t+0\nCON \t12 \t+1 \t+1\nMOD \tSAVE\nINT \t5 \t−3 \t−3\nWIS \t8 \t−1 \t−1\nCHA \t3 \t−4 \t−4\nResistances Cold, Fire, Lightning\nImmunities Poison; Poisoned\nSenses Darkvision 60 ft.; Passive Perception 9\nLanguages Abyssal; telepathy 60 ft. (works only with creatures that\nunderstand Abyssal)\nCR 1/4 (XP 50; PB +2)\nActions\nRend. Melee Attack Roll: +3, reach 5 ft.\nHit: 4 (1d6 + 1) Slashing damage.\nFetid Cloud (1/Day). Constitution Saving Throw: DC 11, each creature in a 10-\nfoot Emanation originating from the dretch.\nFailure: The target has the\nPoisoned condition until the end of its next turn. While Poisoned, the creature\ncan take either an action or a Bonus Action on its turn, not both, and it can’t\ntake Reactions.\nSmall Fiend (Demon), Chaotic Evil",
  "sourceRef": {
    "file": "docs/sources/Monster Manual/Monsters (D) - Monster Manual - Dungeons & Dragons - Sources - D&D Beyond.pdf",
    "pages": [],
    "section": "Monsters"
  },
  "notes": []
}
