{
  "id": "monster.priest_acolyte",
  "name": "PRIEST ACOLYTE",
  "status": "complete",
  "size_type_alignment": "Medium or Small Humanoid (Cleric), Neutral",
  "size": "Medium",
  "creature_type": "Humanoid (Cleric)",
  "alignment": "Neutral",
  "armor_class": 13,
  "hit_points": 11,
  "hit_dice": "2d8 + 2",
  "speed": "30 ft.",
  "abilities": {
    "STR": {
      "score": 14,
      "mod": "+2"
    },
    "DEX": {
      "score": 10,
      "mod": "+0"
    },
    "CON": {
      "score": 12,
      "mod": "+1"
    },
    "INT": {
      "score": 10,
      "mod": "+0"
    },
    "WIS": {
      "score": 14,
      "mod": "+2"
    },
    "CHA": {
      "score": 11,
      "mod": "+0"
    }
  },
  "saves": null,
  "skills": "Medicine +4, Religion +2",
  "resistances": null,
  "immunities": null,
  "vulnerabilities": null,
  "condition_immunities": null,
  "senses": "Passive Perception 12",
  "languages": "Common",
  "cr": "1/4 (XP 50; PB +2)",
  "traits": [],
  "actions": [
    {
      "name": "Mace",
      "text": "Melee Attack Roll: +4, reach 5 ft. Hit: 5 (1d6 + 2) Bludgeoning damage plus 2 (1d4) Radiant damage."
    },
    {
      "name": "Radiant Flame",
      "text": "Ranged Attack Roll: +4, range 60 ft. Hit: 7 (2d6) Radiant damage."
    },
    {
      "name": "Spellcasting",
      "text": "The priest casts one of the following spells, using Wisdom as the spellcasting ability: At Will: Light, Thaumaturgy"
    }
  ],
  "bonus_actions": [
    {
      "name": "Divine Aid (1/Day)",
      "text": "The priest casts Bless, Healing Word, or Sanctuary, using the same spellcasting ability as Spellcasting."
    }
  ],
  "reactions": [],
  "legendary_actions": [],
  "lair_actions": [],
  "regional_effects": [],
  "raw_text": "AC 13 \tInitiative +0 (10)\nHP 11 (2d8 + 2)\nSpeed 30 ft.\nMOD \tSAVE\nSTR \t14 \t+2 \t+2\nDEX \t10 \t+0 \t+0\nCON \t12 \t+1 \t+1\nMOD \tSAVE\nINT \t10 \t+0 \t+0\nWIS \t14 \t+2 \t+2\nCHA \t11 \t+0 \t+0\nSkills Medicine +4, Religion +2\nGear Chain Shirt, Holy Symbol, Mace\nSenses Passive Perception 12\nLanguages Common\nCR 1/4 (XP 50; PB +2)\nActions\nMace. Melee Attack Roll: +4, reach 5 ft.\nHit: 5 (1d6 + 2) Bludgeoning damage\nplus 2 (1d4) Radiant damage.\nRadiant Flame. Ranged Attack Roll: +4, range 60 ft.\nHit: 7 (2d6)\nRadiant damage.\nSpellcasting. The priest casts one of the following spells, using Wisdom as\nthe spellcasting ability:\nAt Will:\nLight,\nThaumaturgy\nBonus Actions\nDivine Aid (1/Day). The priest casts\nBless,\nHealing Word, or\nSanctuary, using\nthe same spellcasting ability as Spellcasting.\nMedium or Small Humanoid (Cleric), Neutral",
  "sourceRef": {
    "file": "docs/sources/Monster Manual/Monsters (P) - Monster Manual - Dungeons & Dragons - Sources - D&D Beyond.pdf",
    "pages": [],
    "section": "Monsters"
  },
  "notes": []
}
