{
  "id": "monster.invisible_stalker",
  "name": "INVISIBLE STALKER",
  "status": "complete",
  "size_type_alignment": "Large Elemental, Neutral",
  "size": "Large",
  "creature_type": "Elemental",
  "alignment": "Neutral",
  "armor_class": 14,
  "hit_points": 97,
  "hit_dice": "13d10 + 26",
  "speed": "50 ft., Fly 50 ft. (hover)",
  "abilities": {
    "STR": {
      "score": 16,
      "mod": "+3"
    },
    "DEX": {
      "score": 19,
      "mod": "+4"
    },
    "CON": {
      "score": 14,
      "mod": "+2"
    },
    "INT": {
      "score": 10,
      "mod": "+0"
    },
    "WIS": {
      "score": 15,
      "mod": "+2"
    },
    "CHA": {
      "score": 11,
      "mod": "+0"
    }
  },
  "saves": null,
  "skills": "Perception +8, Stealth +10",
  "resistances": null,
  "immunities": null,
  "vulnerabilities": null,
  "condition_immunities": null,
  "senses": "Darkvision 60 ft.; Passive Perception 18",
  "languages": "Common, Primordial (Auran)",
  "cr": "6 (XP 2,300; PB +3)",
  "traits": [
    {
      "name": "Air Form",
      "text": "The stalker can enter an enemy's space and stop there. It can move through a space as narrow as 1 inch without expending extra movement to do so."
    },
    {
      "name": "Invisibility",
      "text": "The stalker has the Invisible condition."
    }
  ],
  "actions": [
    {
      "name": "Multiattack",
      "text": "The stalker makes three Wind Swipe attacks. It can replace one attack with a use of Vortex."
    },
    {
      "name": "Wind Swipe",
      "text": "Melee Attack Roll: +7, reach 5 ft. Hit: 11 (2d6 + 4) Force damage."
    },
    {
      "name": "Vortex",
      "text": "Constitution Saving Throw: DC 14, one Large or smaller creature in the stalker's space. Failure: 7 (1d8 + 3) Thunder damage, and the target has the Grappled condition (escape DC 13). Until the grapple ends, the target can't cast spells with a Verbal component and takes 7 (2d6) Thunder damage at the start of each of the stalker's turns. As detectives, we seek truth by eliminating the impossible, ever mindful that the impossible might also be seeking to eliminate us. -"
    }
  ],
  "bonus_actions": [],
  "reactions": [],
  "legendary_actions": [],
  "lair_actions": [],
  "regional_effects": [],
  "raw_text": "AC 14 \tInitiative +7 (22)\nHP 97 (13d10 + 26)\nSpeed 50 ft., Fly 50 ft. (hover)\nMOD \tSAVE\nSTR \t16 \t+3 \t+3\nDEX \t19 \t+4 \t+4\nCON \t14 \t+2 \t+2\nMOD \tSAVE\nINT \t10 \t+0 \t+0\nWIS \t15 \t+2 \t+2\nCHA \t11 \t+0 \t+0\nSkills Perception +8, Stealth +10\nResistances Bludgeoning, Piercing, Slashing\nImmunities Poison; Exhaustion, Grappled, Paralyzed, Petrified, Poisoned,\nProne, Restrained, Unconscious\nSenses Darkvision 60 ft.; Passive Perception 18\nLanguages Common, Primordial (Auran)\nCR 6 (XP 2,300; PB +3)\nTraits\nAir Form. The stalker can enter an enemy’s space and stop there. It can move\nthrough a space as narrow as 1 inch without expending extra movement to\ndo so.\nInvisibility. The stalker has the Invisible condition.\nActions\nMultiattack. The stalker makes three Wind Swipe attacks. It can replace one\nattack with a use of Vortex.\nWind Swipe. Melee Attack Roll: +7, reach 5 ft.\nHit: 11 (2d6 + 4) Force damage.\nVortex. Constitution Saving Throw: DC 14, one Large or smaller creature in the\nstalker’s space.\nFailure: 7 (1d8 + 3) Thunder damage, and the target has the\nGrappled condition (escape DC 13). Until the grapple ends, the target can’t cast\nspells with a Verbal component and takes 7 (2d6) Thunder damage at the start\nof each of the stalker’s turns.\nLarge Elemental, Neutral\nAs detectives, we seek truth by eliminating the impossible, ever\nmindful that the impossible might also be seeking to eliminate\nus.\n—\nTHE CASEBOOK OF ALANIK RAY",
  "sourceRef": {
    "file": "docs/sources/Monster Manual/Monsters (I) - Monster Manual - Dungeons & Dragons - Sources - D&D Beyond.pdf",
    "pages": [],
    "section": "Monsters"
  },
  "notes": []
}
