{
  "id": "monster.githzerai_monk",
  "name": "GITHZERAI MONK",
  "status": "complete",
  "size_type_alignment": "Medium Aberration (Gith), Lawful Neutral",
  "size": "Medium",
  "creature_type": "Aberration (Gith)",
  "alignment": "Lawful Neutral",
  "armor_class": 14,
  "hit_points": 38,
  "hit_dice": "7d8 + 7",
  "speed": "40 ft.",
  "abilities": {
    "STR": {
      "score": 12,
      "mod": "+1"
    },
    "DEX": {
      "score": 15,
      "mod": "+2"
    },
    "CON": {
      "score": 12,
      "mod": "+1"
    },
    "INT": {
      "score": 13,
      "mod": "+1"
    },
    "WIS": {
      "score": 14,
      "mod": "+2"
    },
    "CHA": {
      "score": 10,
      "mod": "+0"
    }
  },
  "saves": null,
  "skills": "Insight +4, Perception +4",
  "resistances": null,
  "immunities": null,
  "vulnerabilities": null,
  "condition_immunities": null,
  "senses": "Passive Perception 14",
  "languages": "Common, Gith",
  "cr": "2 (XP 450; PB +2)",
  "traits": [],
  "actions": [
    {
      "name": "Multiattack",
      "text": "The githzerai makes two Psi Strike attacks."
    },
    {
      "name": "Psi Strike",
      "text": "Melee Attack Roll: +4, reach 5 ft. Hit: 6 (1d8 + 2) Bludgeoning damage plus 9 (2d8) Psychic damage."
    },
    {
      "name": "Spellcasting",
      "text": "The githzerai casts one of the following spells, requiring no spell components and using Wisdom as the spellcasting ability: At Will: Mage Hand (the hand is Invisible) 1/Day: See Invisibility"
    }
  ],
  "bonus_actions": [
    {
      "name": "Psi-Powered Leap (2/Day)",
      "text": "The githzerai casts Jump, requiring no spell components and using the same spellcasting ability as Spellcasting."
    }
  ],
  "reactions": [
    {
      "name": "Psionic Defense (2/Day)",
      "text": "The githzerai casts Feather Fall or Shield in response to the spell's trigger, requiring no spell components and using the same spellcasting ability as Spellcasting."
    }
  ],
  "legendary_actions": [],
  "lair_actions": [],
  "regional_effects": [],
  "raw_text": "AC 14 \tInitiative +4 (14)\nHP 38 (7d8 + 7)\nSpeed 40 ft.\nMOD \tSAVE\nSTR \t12 \t+1 \t+3\nDEX \t15 \t+2 \t+4\nCON \t12 \t+1 \t+1\nMOD \tSAVE\nINT \t13 \t+1 \t+3\nWIS \t14 \t+2 \t+4\nCHA \t10 \t+0 \t+0\nSkills Insight +4, Perception +4\nSenses Passive Perception 14\nLanguages Common, Gith\nCR 2 (XP 450; PB +2)\nActions\nMultiattack. The githzerai makes two Psi Strike attacks.\nPsi Strike. Melee Attack Roll: +4, reach 5 ft.\nHit: 6 (1d8 + 2) Bludgeoning\ndamage plus 9 (2d8) Psychic damage.\nSpellcasting. The githzerai casts one of the following spells, requiring no spell\ncomponents and using Wisdom as the spellcasting ability:\nAt Will:\nMage Hand (the hand is Invisible)\n1/Day:\nSee Invisibility\nBonus Actions\nPsi-Powered Leap (2/Day). The githzerai casts\nJump, requiring no spell\ncomponents and using the same spellcasting ability as Spellcasting.\nReactions\nPsionic Defense (2/Day). The githzerai casts\nFeather Fall or\nShield in response\nto the spellâ€™s trigger, requiring no spell components and using the same\nspellcasting ability as Spellcasting.\nMedium Aberration (Gith), Lawful Neutral",
  "sourceRef": {
    "file": "docs/sources/Monster Manual/Monsters (G) - Monster Manual - Dungeons & Dragons - Sources - D&D Beyond.pdf",
    "pages": [],
    "section": "Monsters"
  },
  "notes": []
}
