{
  "id": "monster.djinni",
  "name": "DJINNI",
  "status": "complete",
  "size_type_alignment": "Large Elemental (Genie), Neutral",
  "size": "Large",
  "creature_type": "Elemental (Genie)",
  "alignment": "Neutral",
  "armor_class": 17,
  "hit_points": 218,
  "hit_dice": "19d10 + 114",
  "speed": "30 ft., Fly 90 ft. (hover)",
  "abilities": {
    "STR": {
      "score": 21,
      "mod": "+5"
    },
    "DEX": {
      "score": 15,
      "mod": "+2"
    },
    "CON": {
      "score": 22,
      "mod": "+6"
    },
    "INT": {
      "score": 15,
      "mod": "+2"
    },
    "WIS": {
      "score": 16,
      "mod": "+3"
    },
    "CHA": {
      "score": 20,
      "mod": "+5"
    }
  },
  "saves": null,
  "skills": null,
  "resistances": null,
  "immunities": "Lightning, Thunder",
  "vulnerabilities": null,
  "condition_immunities": null,
  "senses": "Darkvision 120 ft.; Passive Perception 13",
  "languages": "Primordial (Auran)",
  "cr": "11 (XP 7,200; PB +4)",
  "traits": [
    {
      "name": "Elemental Restoration",
      "text": "If the djinni dies outside the Elemental Plane of Air, its body dissolves into mist, and it gains a new body in 1d4 days, reviving with all its Hit Points somewhere on the Plane of Air."
    },
    {
      "name": "Magic Resistance",
      "text": "The djinni has Advantage on saving throws against spells and other magical effects."
    },
    {
      "name": "Wishes",
      "text": "The djinni has a 30 percent chance of knowing the Wish spell. If the djinni knows it, the djinni can cast it only on behalf of a non-genie creature who communicates a wish in a way the djinni can understand. If the djinni casts the spell for the creature, the djinni suffers none of the spell's stress. Once the djinni has cast it three times, the djinni can't do so again for 365 days."
    }
  ],
  "actions": [
    {
      "name": "Multiattack",
      "text": "The djinni makes three attacks, using Storm Blade or Storm Bolt in any combination."
    },
    {
      "name": "Storm Blade",
      "text": "Melee Attack Roll: +9, reach 5 feet. Hit: 12 (2d6 + 5) Slashing damage plus 7 (2d6) Lightning damage."
    },
    {
      "name": "Storm Bolt",
      "text": "Ranged Attack Roll: +9, range 120 feet. Hit: 13 (3d8) Thunder damage. If the target is a Large or smaller creature, it has the Prone condition."
    },
    {
      "name": "Create Whirlwind",
      "text": "The djinni conjures a whirlwind at a point it can see within 120 feet. The whirlwind fills a 20-foot-radius, 60-foot-high Cylinder centered on that point. The whirlwind lasts until the djinni's Concentration on it ends. The djinni can move the whirlwind up to 20 feet at the start of each of its turns. Whenever the whirlwind enters a creature's space or a creature enters the whirlwind, that creature is subjected to the following effect. Strength Saving Throw: DC 17 (a creature makes this save only once per turn, and the djinni is unaffected). Failure: While in the whirlwind, the target has the Restrained condition and moves with the whirlwind. At the start of each of its turns, the Restrained target takes 21 (6d6) Thunder damage. At the end of each of its turns, the target repeats the save, ending the effect on itself on a success."
    },
    {
      "name": "Spellcasting",
      "text": "The djinni casts one of the following spells, requiring no Material components and using Charisma as the spellcasting ability (spell save DC 17): At Will: Detect Evil and Good, Detect Magic. 2/Day Each: Create Food and Water (can create wine instead of water), Tongues, Wind Walk. 1/Day Each: Creation, Gaseous Form, Invisibility, Major Image, Plane Shift."
    }
  ],
  "bonus_actions": [],
  "reactions": [],
  "legendary_actions": [],
  "lair_actions": [],
  "regional_effects": [],
  "raw_text": "AC 17 \tInitiative +2 (12)\nHP 218 (19d10 + 114)\nSpeed 30 ft., Fly 90 ft. (hover)\nMOD \tSAVE\nSTR \t21 \t+5 \t+5\nDEX \t15 \t+2 \t+6\nCON \t22 \t+6 \t+6\nMOD \tSAVE\nINT \t15 \t+2 \t+2\nWIS \t16 \t+3 \t+7\nCHA \t20 \t+5 \t+5\nImmunities Lightning, Thunder\nSenses Darkvision 120 ft.; Passive Perception 13\nLanguages Primordial (Auran)\nCR 11 (XP 7,200; PB +4)\nTraits\nElemental Restoration. If the djinni dies outside the Elemental Plane of Air, its\nbody dissolves into mist, and it gains a new body in 1d4 days, reviving with all\nits Hit Points somewhere on the Plane of Air.\nMagic Resistance. The djinni has Advantage on saving throws against spells\nand other magical effects.\nLarge Elemental (Genie), Neutral\nDoppelganger\nShape-Shifting Infiltrator\nHabitat: Underdark, Urban; Treasure: Individual\nDoppelgangers are supernatural beings with the ability to shape-shift into any humanlike form. Their mind-reading abilities aid them in creating near-\nperfect disguises and plucking secrets from unguarded minds. Occasionally, doppelgangers use their shape-shifting ability in more overt ways,\ntransforming into unsettling forms to frighten foes.\nA doppelganger’s agenda might relate to its mysterious magical origins or to\nmore mercenary goals. Roll on or choose a result from the Doppelganger\nDeceptions table to inspire a doppelganger’s plot.\nDoppelganger Deceptions\n1d6 \tThe Doppelganger Schemes To...\n1 Cause chaos within the temple of a deity that cursed it to live\nwithout a true form.\n2 \tConceal evidence of a vast conspiracy.\n3 Control a community through fear by posing as a legendary\nbogeyman.\n4 \tReplace a noble to enjoy a decadent lifestyle.\n5 Spy on wizards to learn how to complete its own botched\nmagical creation.\n6 Take an influential position, acting as a sleeper agent for a\ndoppelganger invasion.\nWishes. The djinni has a 30 percent chance of knowing the\nWish spell. If the\ndjinni knows it, the djinni can cast it only on behalf of a non-genie creature who\ncommunicates a wish in a way the djinni can understand. If the djinni casts the\nspell for the creature, the djinni suffers none of the spell’s stress. Once the\ndjinni has cast it three times, the djinni can’t do so again for 365 days.\nActions\nMultiattack. The djinni makes three attacks, using Storm Blade or Storm Bolt\nin any combination.\nStorm Blade. Melee Attack Roll: +9, reach 5 feet.\nHit: 12 (2d6 + 5) Slashing\ndamage plus 7 (2d6) Lightning damage.\nStorm Bolt. Ranged Attack Roll: +9, range 120 feet.\nHit: 13 (3d8) Thunder\ndamage. If the target is a Large or smaller creature, it has the Prone condition.\nCreate Whirlwind. The djinni conjures a whirlwind at a point it can see within\n120 feet. The whirlwind fills a 20-foot-radius, 60-foot-high Cylinder centered on\nthat point. The whirlwind lasts until the djinni’s Concentration on it ends. The\ndjinni can move the whirlwind up to 20 feet at the start of each of its turns.\nWhenever the whirlwind enters a creature’s space or a creature enters the\nwhirlwind, that creature is subjected to the following effect.\nStrength Saving\nThrow: DC 17 (a creature makes this save only once per turn, and the djinni is\nunaffected).\nFailure: While in the whirlwind, the target has the Restrained\ncondition and moves with the whirlwind. At the start of each of its turns, the\nRestrained target takes 21 (6d6) Thunder damage. At the end of each of its\nturns, the target repeats the save, ending the effect on itself on a success.\nSpellcasting. The djinni casts one of the following spells, requiring no Material\ncomponents and using Charisma as the spellcasting ability (spell save DC 17):\nAt Will:\nDetect Evil and Good,\nDetect Magic\n2/Day Each:\nCreate Food and Water (can create wine instead of water),\nTongues,\nWind Walk\n1/Day Each:\nCreation,\nGaseous Form,\nInvisibility,\nMajor Image,\nPlane Shift",
  "sourceRef": {
    "file": "docs/sources/Monster Manual/Monsters (D) - Monster Manual - Dungeons & Dragons - Sources - D&D Beyond.pdf",
    "pages": [],
    "section": "Monsters"
  },
  "notes": []
}
