{
  "id": "monster.lich",
  "name": "LICH",
  "status": "complete",
  "size_type_alignment": "Medium Undead (Wizard), Neutral Evil",
  "size": "Medium",
  "creature_type": "Undead (Wizard)",
  "alignment": "Neutral Evil",
  "armor_class": 20,
  "hit_points": 315,
  "hit_dice": "42d8 + 126",
  "speed": "30 ft.",
  "abilities": {
    "STR": {
      "score": 11,
      "mod": "+0"
    },
    "DEX": {
      "score": 16,
      "mod": "+3"
    },
    "CON": {
      "score": 16,
      "mod": "+3"
    },
    "INT": {
      "score": 21,
      "mod": "+5"
    },
    "WIS": {
      "score": 14,
      "mod": "+2"
    },
    "CHA": {
      "score": 16,
      "mod": "+3"
    }
  },
  "saves": null,
  "skills": "Arcana +19, History +12, Insight +9, Perception +9",
  "resistances": "Cold, Lightning",
  "immunities": "Necrotic, Poison",
  "vulnerabilities": null,
  "condition_immunities": "Charmed, Exhaustion, Frightened, Paralyzed, Poisoned",
  "senses": "Truesight 120 ft.; Passive Perception 19",
  "languages": "All",
  "cr": "21 (XP 33,000, or 41,000 in lair; PB +7)",
  "traits": [
    {
      "name": "Legendary Resistance (4/Day, or 5/Day in Lair)",
      "text": "If the lich fails a saving throw, it can choose to succeed instead."
    },
    {
      "name": "Spirit Jar",
      "text": "If destroyed, the lich reforms in 1d10 days if it has a spirit jar, reviving with all its Hit Points. The new body appears in an unoccupied space within the lich's lair."
    }
  ],
  "actions": [
    {
      "name": "Multiattack",
      "text": "The lich makes three attacks, using Eldritch Burst or Paralyzing Touch in any combination."
    },
    {
      "name": "Eldritch Burst",
      "text": "Melee or Ranged Attack Roll: +12, reach 5 ft. or range 120 ft. Hit: 31 (4d12 + 5) Force damage."
    },
    {
      "name": "Paralyzing Touch",
      "text": "Melee Attack Roll: +12, reach 5 ft. Hit: 15 (3d6 + 5) Cold damage, and the target has the Paralyzed condition until the start of the lich's next turn."
    },
    {
      "name": "Spellcasting",
      "text": "The lich casts one of the following spells, using Intelligence as the spellcasting ability (spell save DC 20): At Will: Detect Magic, Detect Thoughts, Dispel Magic, Fireball (level 5 version), Invisibility, Lightning Bolt (level 5 version), Mage Hand, Prestidigitation 2/Day Each: Animate Dead, Dimension Door, Plane Shift 1/Day Each: Chain Lightning, Finger of Death, Power Word Kill, Scrying"
    }
  ],
  "bonus_actions": [],
  "reactions": [
    {
      "name": "Protective Magic",
      "text": "The lich casts Counterspell or Shield in response to the spell's trigger, using the same spellcasting ability as Spellcasting."
    }
  ],
  "legendary_actions": [],
  "lair_actions": [],
  "regional_effects": [],
  "raw_text": "AC 20 \tInitiative +17 (27)\nHP 315 (42d8 + 126)\nSpeed 30 ft.\nMOD \tSAVE\nSTR \t11 \t+0 \t+0\nDEX \t16 \t+3 \t+10\nCON \t16 \t+3 \t+10\nMOD \tSAVE\nINT \t21 \t+5 \t+12\nWIS \t14 \t+2 \t+9\nCHA \t16 \t+3 \t+3\nSkills Arcana +19, History +12, Insight +9, Perception +9\nResistances Cold, Lightning\nImmunities Necrotic, Poison; Charmed, Exhaustion, Frightened,\nParalyzed, Poisoned\nGear Component Pouch\nSenses Truesight 120 ft.; Passive Perception 19\nLanguages All\nCR 21 (XP 33,000, or 41,000 in lair; PB +7)\nTraits\nLegendary Resistance (4/Day, or 5/Day in Lair). If the lich fails a saving throw,\nit can choose to succeed instead.\nSpirit Jar. If destroyed, the lich reforms in 1d10 days if it has a spirit jar,\nreviving with all its Hit Points. The new body appears in an unoccupied space\nwithin the lich’s lair.\nActions\nMultiattack. The lich makes three attacks, using Eldritch Burst or Paralyzing\nTouch in any combination.\nEldritch Burst. Melee or Ranged Attack Roll: +12, reach 5 ft. or range 120 ft.\nHit: 31 (4d12 + 5) Force damage.\nParalyzing Touch. Melee Attack Roll: +12, reach 5 ft.\nHit: 15 (3d6 + 5) Cold\ndamage, and the target has the Paralyzed condition until the start of the lich’s\nnext turn.\nSpellcasting. The lich casts one of the following spells, using Intelligence as\nthe spellcasting ability (spell save DC 20):\nAt Will:\nDetect Magic,\nDetect Thoughts,\nDispel Magic,\nFireball (level 5 version),\nInvisibility,\nLightning Bolt (level 5 version),\nMage Hand,\nPrestidigitation\n2/Day Each:\nAnimate Dead,\nDimension Door,\nPlane Shift\n1/Day Each:\nChain Lightning,\nFinger of Death,\nPower Word Kill,\nScrying\nReactions\nProtective Magic. The lich casts\nCounterspell or\nShield in response to the\nspell’s trigger, using the same spellcasting ability as Spellcasting.\nLegendary Actions\nLegendary Action Uses: 3 (4 in Lair). Immediately after another creature’s turn,\nthe lich can expend a use to take one of the following actions. The lich\nregains all expended uses at the start of each of its turns.\nMedium Undead (Wizard), Neutral Evil\nLizardfolk\nReptilian Defenders of the Land\nHabitat: Forest, Swamp; Treasure: Individual\nLizardfolk dwell in wildernesses suffused with primal magic. While many lizardfolk are Humanoids with varied skills, some forge powerful bonds with the\nElemental Plane of Earth, granting them magical connections to the cycle of growth and rebirth.\nLizardfolk Geomancer\nLizardfolk geomancers draw magic from the natural world, using it to protect their people and territories.\nLizardfolk Sovereign\nLizardfolk sovereigns undergo magical rites that imbue them with fantastic strength and magic from the Elemental Plane of Earth. In some, though, it also\nunlocks a primal viciousness.\nDeathly Teleport. The lich teleports up to 60 feet to an unoccupied space it can\nsee, and each creature within 10 feet of the space it left takes 11 (2d10)\nNecrotic damage.\nDisrupt Life. Constitution Saving Throw: DC 20, each creature that isn’t an\nUndead in a 20-foot Emanation originating from the lich.\nFailure: 31 (9d6)\nNecrotic damage.\nSuccess: Half damage.\nFailure or Success: The lich can’t\ntake this action again until the start of its next turn.\nFrightening Gaze. The lich casts\nFear, using the same spellcasting ability as\nSpellcasting. The lich can’t take this action again until the start of its next turn.",
  "sourceRef": {
    "file": "docs/sources/Monster Manual/Monsters (L) - Monster Manual - Dungeons & Dragons - Sources - D&D Beyond.pdf",
    "pages": [],
    "section": "Monsters"
  },
  "notes": [
    "Legendary Action Uses: 3 (4 in Lair). Immediately after another creature's turn, the lich can expend a use to take one of the following actions. The lich regains all expended uses at the start of each of its turns."
  ]
}
