{
  "id": "monster.erinyes",
  "name": "ERINYES",
  "status": "complete",
  "size_type_alignment": "Medium Fiend (Devil), Lawful Evil",
  "size": "Medium",
  "creature_type": "Fiend (Devil)",
  "alignment": "Lawful Evil",
  "armor_class": 18,
  "hit_points": 178,
  "hit_dice": "21d8 + 84",
  "speed": "30 ft., Fly 60 ft.",
  "abilities": {
    "STR": {
      "score": 18,
      "mod": "+4"
    },
    "DEX": {
      "score": 16,
      "mod": "+3"
    },
    "CON": {
      "score": 18,
      "mod": "+4"
    },
    "INT": {
      "score": 14,
      "mod": "+2"
    },
    "WIS": {
      "score": 14,
      "mod": "+2"
    },
    "CHA": {
      "score": 18,
      "mod": "+4"
    }
  },
  "saves": null,
  "skills": "Perception +6, Persuasion +8",
  "resistances": "Cold",
  "immunities": "Fire, Poison",
  "vulnerabilities": null,
  "condition_immunities": "Poisoned",
  "senses": "Truesight 120 ft.; Passive Perception 16",
  "languages": "Infernal; telepathy 120 ft.",
  "cr": "12 (XP 8,400; PB +4)",
  "traits": [
    {
      "name": "Diabolical Restoration",
      "text": "If the erinyes dies outside the Nine Hells, its body disappears in sulfurous smoke, and it gains a new body instantly, reviving with all its Hit Points somewhere in the Nine Hells."
    },
    {
      "name": "Magic Resistance",
      "text": "The erinyes has Advantage on saving throws against spells and other magical effects."
    },
    {
      "name": "Magic Rope",
      "text": "The erinyes has a magic rope. While bearing it, the erinyes can use the Entangling Rope action. The rope has AC 20, HP 90, and Immunity to Poison and Psychic damage. The rope turns to dust if reduced to 0 Hit Points, if it is 5+ feet away from the erinyes for 1 hour or more, or if the erinyes dies. If the rope is damaged or destroyed, the erinyes can fully restore it when finishing a Short or Long Rest."
    }
  ],
  "actions": [
    {
      "name": "Multiattack",
      "text": "The erinyes makes three Withering Sword attacks and can use Entangling Rope."
    },
    {
      "name": "Withering Sword",
      "text": "Melee Attack Roll: +8, reach 5 ft. Hit: 13 (2d8 + 4) Slashing damage plus 11 (2d10) Necrotic damage."
    },
    {
      "name": "Entangling Rope (Requires Magic Rope)",
      "text": "Strength Saving Throw: DC 16, one creature the erinyes can see within 120 feet. Failure: 14 (4d6) Force damage, and the target has the Restrained condition until the rope is destroyed, the erinyes uses a Bonus Action to release the target, or the erinyes uses Entangling Rope again."
    }
  ],
  "bonus_actions": [],
  "reactions": [
    {
      "name": "Parry",
      "text": "Trigger: The erinyes is hit by a melee attack roll while holding a weapon. Response: The erinyes adds 4 to its AC against that attack, possibly causing it to miss."
    }
  ],
  "legendary_actions": [],
  "lair_actions": [],
  "regional_effects": [],
  "raw_text": "AC 18 \tInitiative +7 (17)\nHP 178 (21d8 + 84)\nSpeed 30 ft., Fly 60 ft.\nMOD \tSAVE\nSTR \t18 \t+4 \t+4\nDEX \t16 \t+3 \t+7\nCON \t18 \t+4 \t+8\nMOD \tSAVE\nINT \t14 \t+2 \t+2\nWIS \t14 \t+2 \t+2\nCHA \t18 \t+4 \t+8\nSkills Perception +6, Persuasion +8\nResistances Cold\nImmunities Fire, Poison; Poisoned\nSenses Truesight 120 ft.; Passive Perception 16\nLanguages Infernal; telepathy 120 ft.\nCR 12 (XP 8,400; PB +4)\nTraits\nDiabolical Restoration. If the erinyes dies outside the Nine Hells, its body\ndisappears in sulfurous smoke, and it gains a new body instantly, reviving with\nall its Hit Points somewhere in the Nine Hells.\nMagic Resistance. The erinyes has Advantage on saving throws against spells\nand other magical effects.\nMagic Rope. The erinyes has a magic rope. While bearing it, the erinyes can\nuse the Entangling Rope action. The rope has AC 20, HP 90, and Immunity to\nPoison and Psychic damage. The rope turns to dust if reduced to 0 Hit Points,\nif it is 5+ feet away from the erinyes for 1 hour or more, or if the erinyes dies. If\nthe rope is damaged or destroyed, the erinyes can fully restore it when\nfinishing a Short or Long Rest.\nActions\nMultiattack. The erinyes makes three Withering Sword attacks and can use\nEntangling Rope.\nWithering Sword. Melee Attack Roll: +8, reach 5 ft.\nHit: 13 (2d8 + 4) Slashing\ndamage plus 11 (2d10) Necrotic damage.\nEntangling Rope (Requires Magic Rope). Strength Saving Throw: DC 16, one\ncreature the erinyes can see within 120 feet.\nFailure: 14 (4d6) Force damage,\nand the target has the Restrained condition until the rope is destroyed, the\nerinyes uses a Bonus Action to release the target, or the erinyes uses\nEntangling Rope again.\nReactions\nParry. Trigger: The erinyes is hit by a melee attack roll while holding a weapon.\nResponse: The erinyes adds 4 to its AC against that attack, possibly causing it\nto miss.\nMedium Fiend (Devil), Lawful Evil\nSpiderlike hunters, ettercaps lurk in forested depths and seek prey to drag into their web-choked lairs. These vicious predators have arachnid features and\nhunched, bipedal frames, and theyâ€™re notorious for their venomous bites and ability to shoot out webs to entrap their victims. Ettercaps often hunt in small\ngroups alongside giant spiders and mundane spider swarms.\nEttercaps frequently overhunt their environment. Left unchecked, ettercaps might fill whole woodlands with their webs and the cocooned remains of past\nmeals, which puts ettercaps in conflict with Fey. Spiteful ettercaps go out of their way to torment and feed on Fey; they prefer to menace those smaller than\nthemselves, like pixies and sprites. They rarely devour other sapient creatures swiftly, preferring to cocoon their captives and terrorize them for days.\nEttercaps avoid fire, which can quickly burn through their webs and the dead trees where they make their homes.\nEttin\nQuarrelsome Two-Headed Giant\nHabitat: Hill, Mountain, Underdark; Treasure: Individual",
  "sourceRef": {
    "file": "docs/sources/Monster Manual/Monsters (E) - Monster Manual - Dungeons & Dragons - Sources - D&D Beyond.pdf",
    "pages": [],
    "section": "Monsters"
  },
  "notes": []
}
