{
  "id": "monster.hobgoblin_warrior",
  "name": "HOBGOBLIN WARRIOR",
  "status": "complete",
  "size_type_alignment": "Medium Fey (Goblinoid), Lawful Evil",
  "size": "Medium",
  "creature_type": "Fey (Goblinoid)",
  "alignment": "Lawful Evil",
  "armor_class": 18,
  "hit_points": 11,
  "hit_dice": "2d8 + 2",
  "speed": "30 ft.",
  "abilities": {
    "STR": {
      "score": 13,
      "mod": "+1"
    },
    "DEX": {
      "score": 12,
      "mod": "+1"
    },
    "CON": {
      "score": 12,
      "mod": "+1"
    },
    "INT": {
      "score": 10,
      "mod": "+0"
    },
    "WIS": {
      "score": 10,
      "mod": "+0"
    },
    "CHA": {
      "score": 9,
      "mod": "-1"
    }
  },
  "saves": null,
  "skills": null,
  "resistances": null,
  "immunities": null,
  "vulnerabilities": null,
  "condition_immunities": null,
  "senses": "Darkvision 60 ft.; Passive Perception 10",
  "languages": "Common, Goblin",
  "cr": "1/2 (XP 100; PB +2)",
  "traits": [
    {
      "name": "Pack Tactics",
      "text": "The hobgoblin has Advantage on an attack roll against a creature if at least one of the hobgoblin's allies is within 5 feet of the creature and the ally doesn't have the Incapacitated condition."
    }
  ],
  "actions": [
    {
      "name": "Longsword",
      "text": "Melee Attack Roll: +3, reach 5 ft. Hit: 12 (2d10 + 1) Slashing damage."
    },
    {
      "name": "Longbow",
      "text": "Ranged Attack Roll: +3, range 150/600 ft. Hit: 5 (1d8 + 1) Piercing damage plus 7 (3d4) Poison damage."
    }
  ],
  "bonus_actions": [],
  "reactions": [],
  "legendary_actions": [],
  "lair_actions": [],
  "regional_effects": [],
  "raw_text": "AC 18 \tInitiative +3 (13)\nHP 11 (2d8 + 2)\nSpeed 30 ft.\nMOD \tSAVE\nSTR \t13 \t+1 \t+1\nDEX \t12 \t+1 \t+1\nCON \t12 \t+1 \t+1\nMOD \tSAVE\nINT \t10 \t+0 \t+0\nWIS \t10 \t+0 \t+0\nCHA \t9 \t−1 \t−1\nGear Half-Plate Armor, Longbow, Longsword, Shield\nSenses Darkvision 60 ft.; Passive Perception 10\nLanguages Common, Goblin\nCR 1/2 (XP 100; PB +2)\nTraits\nPack Tactics. The hobgoblin has Advantage on an attack roll against a\ncreature if at least one of the hobgoblin’s allies is within 5 feet of the creature\nand the ally doesn’t have the Incapacitated condition.\nActions\nLongsword. Melee Attack Roll: +3, reach 5 ft.\nHit: 12 (2d10 + 1)\nSlashing damage.\nLongbow. Ranged Attack Roll: +3, range 150/600 ft.\nHit: 5 (1d8 + 1) Piercing\ndamage plus 7 (3d4) Poison damage.\nMedium Fey (Goblinoid), Lawful Evil",
  "sourceRef": {
    "file": "docs/sources/Monster Manual/Monsters (H) - Monster Manual - Dungeons & Dragons - Sources - D&D Beyond.pdf",
    "pages": [],
    "section": "Monsters"
  },
  "notes": []
}
