{
  "id": "monster.wight",
  "name": "WIGHT",
  "status": "complete",
  "size_type_alignment": "Medium Undead, Neutral Evil",
  "size": "Medium",
  "creature_type": "Undead",
  "alignment": "Neutral Evil",
  "armor_class": 14,
  "hit_points": 82,
  "hit_dice": "11d8 + 33",
  "speed": "30 ft.",
  "abilities": {
    "STR": {
      "score": 15,
      "mod": "+2"
    },
    "DEX": {
      "score": 14,
      "mod": "+2"
    },
    "CON": {
      "score": 16,
      "mod": "+3"
    },
    "INT": {
      "score": 10,
      "mod": "+0"
    },
    "WIS": {
      "score": 13,
      "mod": "+1"
    },
    "CHA": {
      "score": 15,
      "mod": "+2"
    }
  },
  "saves": null,
  "skills": "Perception +3, Stealth +4",
  "resistances": "Necrotic",
  "immunities": "Poison",
  "vulnerabilities": null,
  "condition_immunities": "Exhaustion, Poisoned",
  "senses": "Darkvision 60 ft.; Passive Perception 13",
  "languages": "Common plus one other language",
  "cr": "3 (XP 700; PB +2)",
  "traits": [
    {
      "name": "Sunlight Sensitivity",
      "text": "While in sunlight, the wight has Disadvantage on ability checks and attack rolls."
    }
  ],
  "actions": [
    {
      "name": "Multiattack",
      "text": "The wight makes two attacks, using Necrotic Sword or Necrotic Bow in any combination. It can replace one attack with a use of Life Drain."
    },
    {
      "name": "Necrotic Sword",
      "text": "Melee Attack Roll: +4, reach 5 ft. Hit: 6 (1d8 + 2) Slashing damage plus 4 (1d8) Necrotic damage."
    },
    {
      "name": "Necrotic Bow",
      "text": "Ranged Attack Roll: +4, range 150/600 ft. Hit: 6 (1d8 + 2) Piercing damage plus 4 (1d8) Necrotic damage."
    },
    {
      "name": "Life Drain",
      "text": "Constitution Saving Throw: DC 13, one creature within 5 feet. Failure: 6 (1d8 + 2) Necrotic damage, and the target's Hit Point maximum decreases by an amount equal to the damage taken. A Humanoid slain by this attack rises 24 hours later as a Zombie under the wight's control, unless the Humanoid is restored to life or its body is destroyed. The wight can have no more than twelve zombies under its control at a time."
    }
  ],
  "bonus_actions": [],
  "reactions": [],
  "legendary_actions": [],
  "lair_actions": [],
  "regional_effects": [],
  "raw_text": "AC 14 \tInitiative +4 (14)\nHP 82 (11d8 + 33)\nSpeed 30 ft.\nMOD \tSAVE\nSTR \t15 \t+2 \t+2\nDEX \t14 \t+2 \t+2\nCON \t16 \t+3 \t+3\nMOD \tSAVE\nINT \t10 \t+0 \t+0\nWIS \t13 \t+1 \t+1\nCHA \t15 \t+2 \t+2\nSkills Perception +3, Stealth +4\nResistances Necrotic\nImmunities Poison; Exhaustion, Poisoned\nSenses Darkvision 60 ft.; Passive Perception 13\nLanguages Common plus one other language\nCR 3 (XP 700; PB +2)\nTraits\nSunlight Sensitivity. While in sunlight, the wight has Disadvantage on ability checks and attack rolls.\nActions\nMultiattack. The wight makes two attacks, using Necrotic Sword or Necrotic Bow in any combination. It can replace one attack with a use of Life Drain.\nNecrotic Sword. Melee Attack Roll: +4, reach 5 ft.\nHit: 6 (1d8 + 2) Slashing damage plus 4 (1d8) Necrotic damage.\nNecrotic Bow. Ranged Attack Roll: +4, range 150/600 ft.\nHit: 6 (1d8 + 2) Piercing damage plus 4 (1d8) Necrotic damage.\nLife Drain. Constitution Saving Throw: DC 13, one creature within 5 feet.\nFailure: 6 (1d8 + 2) Necrotic damage, and the target's Hit Point maximum decreases by an amount equal to the damage taken.\nA Humanoid slain by this attack rises 24 hours later as a Zombie under the wight's control, unless the Humanoid is restored to life or its body is destroyed. The wight can have no more than twelve zombies under its control at a time.\nMedium Undead, Neutral Evil",
  "sourceRef": {
    "file": "docs/sources/Monster Manual/Monsters (W) - Monster Manual - Dungeons & Dragons - Sources - D&D Beyond.pdf",
    "pages": [],
    "section": "Monsters"
  },
  "notes": []
}
