{
  "id": "monster.zombie",
  "name": "ZOMBIE",
  "status": "complete",
  "size_type_alignment": "Medium Undead, Neutral Evil",
  "size": "Medium",
  "creature_type": "Undead",
  "alignment": "Neutral Evil",
  "armor_class": 8,
  "hit_points": 15,
  "hit_dice": "2d8 + 6",
  "speed": "20 ft.",
  "abilities": {
    "STR": {
      "score": 13,
      "mod": "+1"
    },
    "DEX": {
      "score": 6,
      "mod": "-2"
    },
    "CON": {
      "score": 16,
      "mod": "+3"
    },
    "INT": {
      "score": 3,
      "mod": "-4"
    },
    "WIS": {
      "score": 6,
      "mod": "-2"
    },
    "CHA": {
      "score": 5,
      "mod": "-3"
    }
  },
  "saves": null,
  "skills": null,
  "resistances": null,
  "immunities": "Poison",
  "vulnerabilities": null,
  "condition_immunities": "Exhaustion, Poisoned",
  "senses": "Darkvision 60 ft.; Passive Perception 8",
  "languages": "Understands Common plus one other language but canâ€™t speak",
  "cr": "1/4 (XP 50; PB +2)",
  "traits": [
    {
      "name": "Undead Fortitude",
      "text": "If damage reduces the zombie to 0 Hit Points, it makes a Constitution saving throw (DC 5 plus the damage taken) unless the damage is Radiant or from a Critical Hit. On a successful save, the zombie drops to 1 Hit Point instead."
    }
  ],
  "actions": [
    {
      "name": "Slam",
      "text": "Melee Attack Roll: +3, reach 5 ft. Hit: 5 (1d8 + 1) Bludgeoning damage."
    }
  ],
  "bonus_actions": [],
  "reactions": [],
  "legendary_actions": [],
  "lair_actions": [],
  "regional_effects": [],
  "raw_text": "AC 8 \tInitiative -2 (8)\nHP 15 (2d8 + 6)\nSpeed 20 ft.\nMOD \tSAVE\nSTR \t13 \t+1 \t+1\nDEX \t6 \t-2 \t-2\nCON \t16 \t+3 \t+3\nMOD \tSAVE\nINT \t3 \t-4 \t-4\nWIS \t6 \t-2 \t+0\nCHA \t5 \t-3 \t-3\nImmunities Poison; Exhaustion, Poisoned\nSenses Darkvision 60 ft.; Passive Perception 8\nLanguages Understands Common plus one other language but can't speak\nCR 1/4 (XP 50; PB +2)\nTraits\nUndead Fortitude. If damage reduces the zombie to 0 Hit Points, it makes a Constitution saving throw (DC 5 plus the damage taken) unless the damage is Radiant or from a Critical Hit. On a successful save, the zombie drops to 1 Hit Point instead.\nActions\nSlam. Melee Attack Roll: +3, reach 5 ft.\nHit: 5 (1d8 + 1) Bludgeoning damage.\nMedium Undead, Neutral Evil",
  "sourceRef": {
    "file": "docs/sources/Monster Manual/Monsters (Z) - Monster Manual - Dungeons & Dragons - Sources - D&D Beyond.pdf",
    "pages": [],
    "section": "Monsters"
  },
  "notes": []
}
