{
  "id": "monster.mind_flayer",
  "name": "MIND FLAYER",
  "status": "complete",
  "size_type_alignment": "Medium Aberration, Lawful Evil",
  "size": "Medium",
  "creature_type": "Aberration",
  "alignment": "Lawful Evil",
  "armor_class": 15,
  "hit_points": 99,
  "hit_dice": "18d8 + 18",
  "speed": "30 ft., Fly 15 ft. (hover)",
  "abilities": {
    "STR": {
      "score": 11,
      "mod": "+0"
    },
    "DEX": {
      "score": 12,
      "mod": "+1"
    },
    "CON": {
      "score": 12,
      "mod": "+1"
    },
    "INT": {
      "score": 19,
      "mod": "+4"
    },
    "WIS": {
      "score": 17,
      "mod": "+3"
    },
    "CHA": {
      "score": 17,
      "mod": "+3"
    }
  },
  "saves": null,
  "skills": "Arcana +7, Insight +6, Perception +6, Stealth +4",
  "resistances": "Psychic",
  "immunities": null,
  "vulnerabilities": null,
  "condition_immunities": "Grappled, Restrained",
  "senses": "Darkvision 120 ft.; Passive Perception 16",
  "languages": "Deep Speech, Undercommon; telepathy 120 ft.",
  "cr": "7 (XP 2,900; PB +3)",
  "traits": [
    {
      "name": "Magic Resistance",
      "text": "The mind flayer has Advantage on saving throws against spells and other magical effects."
    }
  ],
  "actions": [
    {
      "name": "Tentacles",
      "text": "Melee Attack Roll: +7, reach 5 ft. Hit: 22 (4d8 + 4) Psychic damage. If the target is a Medium or smaller creature, it has the Grappled condition (escape DC 14) from all the mind flayer's tentacles, and the target has the Stunned condition until the grapple ends."
    },
    {
      "name": "Extract Brain",
      "text": "Constitution Saving Throw: DC 15, one creature that is Grappled by the mind flayer's Tentacles. Failure: 55 (10d10) Piercing damage. Success: Half damage. Failure or Success: If this damage reduces the target to 0 Hit Points, the mind flayer kills it and devours its brain."
    },
    {
      "name": "Mind Blast (Recharge 5-6)",
      "text": "Intelligence Saving Throw: DC 15, each creature in a 60-foot Cone. Failure: 31 (6d8 + 4) Psychic damage, and the target has the Stunned condition until the end of the mind flayer's next turn. Success: Half damage only."
    },
    {
      "name": "Spellcasting",
      "text": "The mind flayer casts one of the following spells, requiring no spell components and using Intelligence as the spellcasting ability (spell save DC 15): At Will: Detect Thoughts 1/Day Each: Dominate Monster, Plane Shift (self only)"
    }
  ],
  "bonus_actions": [],
  "reactions": [],
  "legendary_actions": [],
  "lair_actions": [],
  "regional_effects": [],
  "raw_text": "AC 15 \tInitiative +4 (14)\nHP 99 (18d8 + 18)\nSpeed 30 ft., Fly 15 ft. (hover)\nMOD \tSAVE\nSTR \t11 \t+0 \t+0\nDEX \t12 \t+1 \t+4\nCON \t12 \t+1 \t+1\nMOD \tSAVE\nINT \t19 \t+4 \t+7\nWIS \t17 \t+3 \t+6\nCHA \t17 \t+3 \t+6\nSkills Arcana +7, Insight +6, Perception +6, Stealth +4\nResistances Psychic\nGear Breastplate\nSenses Darkvision 120 ft.; Passive Perception 16\nLanguages Deep Speech, Undercommon; telepathy 120 ft.\nCR 7 (XP 2,900; PB +3)\nTraits\nMagic Resistance. The mind flayer has Advantage on saving throws against\nspells and other magical effects.\nActions\nTentacles. Melee Attack Roll: +7, reach 5 ft.\nHit: 22 (4d8 + 4) Psychic damage.\nIf the target is a Medium or smaller creature, it has the Grappled condition\n(escape DC 14) from all the mind flayer’s tentacles, and the target has the\nStunned condition until the grapple ends.\nExtract Brain. Constitution Saving Throw: DC 15, one creature that is Grappled\nby the mind flayer’s Tentacles.\nFailure: 55 (10d10) Piercing damage.\nSuccess:\nHalf damage.\nFailure or Success: If this damage reduces the target to 0 Hit\nPoints, the mind flayer kills it and devours its brain.\nMind Blast (Recharge 5–6). Intelligence Saving Throw: DC 15, each creature in\na 60-foot Cone.\nFailure: 31 (6d8 + 4) Psychic damage, and the target has the\nStunned condition until the end of the mind flayer’s next turn.\nSuccess: Half\ndamage only.\nSpellcasting. The mind flayer casts one of the following spells, requiring no\nspell components and using Intelligence as the spellcasting ability (spell save\nDC 15):\nAt Will:\nDetect Thoughts\n1/Day Each:\nDominate Monster,\nPlane Shift (self only)\nMedium Aberration, Lawful Evil",
  "sourceRef": {
    "file": "docs/sources/Monster Manual/Monsters (M) - Monster Manual - Dungeons & Dragons - Sources - D&D Beyond.pdf",
    "pages": [],
    "section": "Monsters"
  },
  "notes": []
}
