{
  "id": "monster.giant_axe_beak",
  "name": "GIANT AXE BEAK",
  "status": "complete",
  "size_type_alignment": "Huge Monstrosity, Unaligned",
  "size": "Huge",
  "creature_type": "Monstrosity",
  "alignment": "Unaligned",
  "armor_class": 15,
  "hit_points": 84,
  "hit_dice": "8d12 + 32",
  "speed": "50 ft.",
  "abilities": {
    "STR": {
      "score": 21,
      "mod": "+5"
    },
    "DEX": {
      "score": 14,
      "mod": "+2"
    },
    "CON": {
      "score": 19,
      "mod": "+4"
    },
    "INT": {
      "score": 3,
      "mod": "-4"
    },
    "WIS": {
      "score": 12,
      "mod": "+1"
    },
    "CHA": {
      "score": 5,
      "mod": "-3"
    }
  },
  "saves": null,
  "skills": "Perception +4",
  "resistances": null,
  "immunities": null,
  "vulnerabilities": null,
  "condition_immunities": null,
  "senses": "Passive Perception 14",
  "languages": "None",
  "cr": "5 (XP 1,800; PB +3)",
  "traits": [],
  "actions": [
    {
      "name": "Multiattack",
      "text": "The axe beak makes one Sharpened Beak attack and one"
    },
    {
      "name": "Talons attack",
      "text": ""
    },
    {
      "name": "Sharpened Beak",
      "text": "Melee Attack Roll: +8, reach 10 ft. Hit: 18 (2d12 + 5) Slashing damage, and a creature within 5 feet of the target (axe beak's choice) takes 6 (1d12) Slashing damage."
    },
    {
      "name": "Talons",
      "text": "Melee Attack Roll: +8, reach 5 ft. Hit: 14 (2d8 + 5) Piercing damage. If the target is a Large or smaller creature, it has the Prone condition."
    }
  ],
  "bonus_actions": [],
  "reactions": [],
  "legendary_actions": [],
  "lair_actions": [],
  "regional_effects": [],
  "raw_text": "AC 15 \tInitiative +5 (15)\nHP 84 (8d12 + 32)\nSpeed 50 ft.\nHuge Monstrosity, Unaligned\nAzers\nFiery Smiths of Living Metal\nHabitat: Mountain, Planar (Elemental Plane of Fire); Treasure: Armaments, Individual\nAzers are living bronze folk who work the primal elements of creation to craft weapons and magical wonders among the multiverse’s mightiest infernos.\nAzer Pyromancer\nAzer pyromancers conjure flames from the Elemental Plane of Fire to defend themselves and stoke magical forges.\nAzer Sentinel\nAzer sentinels defend their communities’ smiths and channel their flames through their weapons.\nMOD \tSAVE\nSTR \t21 \t+5 \t+5\nDEX \t14 \t+2 \t+2\nCON \t19 \t+4 \t+4\nMOD \tSAVE\nINT \t3 \t−4 \t−4\nWIS \t12 \t+1 \t+1\nCHA \t5 \t−3 \t−3\nSkills Perception +4\nSenses Passive Perception 14\nLanguages None\nCR 5 (XP 1,800; PB +3)\nActions\nMultiattack. The axe beak makes one Sharpened Beak attack and one\nTalons attack.\nSharpened Beak. Melee Attack Roll: +8, reach 10 ft.\nHit: 18 (2d12 + 5) Slashing\ndamage, and a creature within 5 feet of the target (axe beak’s choice) takes 6\n(1d12) Slashing damage.\nTalons. Melee Attack Roll: +8, reach 5 ft.\nHit: 14 (2d8 + 5) Piercing damage. If\nthe target is a Large or smaller creature, it has the Prone condition.",
  "sourceRef": {
    "file": "docs/sources/Monster Manual/Monsters (A) - Monster Manual - Dungeons & Dragons - Sources - D&D Beyond.pdf",
    "pages": [],
    "section": "Monsters"
  },
  "notes": []
}
