{
  "id": "monster.pseudodragon",
  "name": "PSEUDODRAGON",
  "status": "complete",
  "size_type_alignment": "Tiny Dragon, Neutral Good",
  "size": "Tiny",
  "creature_type": "Dragon",
  "alignment": "Neutral Good",
  "armor_class": 14,
  "hit_points": 10,
  "hit_dice": "3d4 + 3",
  "speed": "15 ft., Fly 60 ft.",
  "abilities": {
    "STR": {
      "score": 6,
      "mod": "-2"
    },
    "DEX": {
      "score": 15,
      "mod": "+2"
    },
    "CON": {
      "score": 13,
      "mod": "+1"
    },
    "INT": {
      "score": 10,
      "mod": "+0"
    },
    "WIS": {
      "score": 12,
      "mod": "+1"
    },
    "CHA": {
      "score": 10,
      "mod": "+0"
    }
  },
  "saves": null,
  "skills": "Perception +5, Stealth +4",
  "resistances": null,
  "immunities": null,
  "vulnerabilities": null,
  "condition_immunities": null,
  "senses": "Blindsight 10 ft., Darkvision 60 ft.; Passive Perception 15",
  "languages": "Understands Common and Draconic but can’t speak",
  "cr": "1/4 (XP 50; PB +2)",
  "traits": [
    {
      "name": "Magic Resistance",
      "text": "The pseudodragon has Advantage on saving throws against spells and other magical effects."
    }
  ],
  "actions": [
    {
      "name": "Multiattack",
      "text": "The pseudodragon makes two Bite attacks."
    },
    {
      "name": "Bite",
      "text": "Melee Attack Roll: +4, reach 5 ft. Hit: 4 (1d4 + 2) Piercing damage."
    },
    {
      "name": "Sting",
      "text": "Constitution Saving Throw: DC 12, one creature the pseudodragon can see within 5 feet. Failure: 5 (2d4) Poison damage, and the target has the Poisoned condition for 1 hour. While Poisoned, the target also has the Unconscious condition, which ends early if the target takes damage or a creature within 5 feet of it takes an action to wake it. Purple worms alone are bad enough, but the blasted monsters have a knack for unearthing things that are even worse! -Morrikan d'Kundarak"
    }
  ],
  "bonus_actions": [],
  "reactions": [],
  "legendary_actions": [],
  "lair_actions": [],
  "regional_effects": [],
  "raw_text": "AC 14 \tInitiative +2 (12)\tTiny Dragon, Neutral Good\nPurple Worm\nWhat Gnaws the Roots of the World\nHabitat: Desert, Underdark; Treasure: None\nTitanic purple worms burrow through the earth and sand. Ever\nravenous, they devour smaller creatures and ravage entire\ncommunities in their aimless burrowing.\nHP 10 (3d4 + 3)\nSpeed 15 ft., Fly 60 ft.\nMOD \tSAVE\nSTR \t6 \t−2 \t−2\nDEX \t15 \t+2 \t+2\nCON \t13 \t+1 \t+1\nMOD \tSAVE\nINT \t10 \t+0 \t+0\nWIS \t12 \t+1 \t+1\nCHA \t10 \t+0 \t+0\nSkills Perception +5, Stealth +4\nSenses Blindsight 10 ft., Darkvision 60 ft.; Passive Perception 15\nLanguages Understands Common and Draconic but can’t speak\nCR 1/4 (XP 50; PB +2)\nTraits\nMagic Resistance. The pseudodragon has Advantage on saving throws against\nspells and other magical effects.\nActions\nMultiattack. The pseudodragon makes two Bite attacks.\nBite. Melee Attack Roll: +4, reach 5 ft.\nHit: 4 (1d4 + 2) Piercing damage.\nSting. Constitution Saving Throw: DC 12, one creature the pseudodragon can\nsee within 5 feet.\nFailure: 5 (2d4) Poison damage, and the target has the\nPoisoned condition for 1 hour. While Poisoned, the target also has the\nUnconscious condition, which ends early if the target takes damage or a\ncreature within 5 feet of it takes an action to wake it.\nPurple worms alone are bad enough, but the blasted monsters\nhave a knack for unearthing things that are even worse!\n—Morrikan d’Kundarak",
  "sourceRef": {
    "file": "docs/sources/Monster Manual/Monsters (P) - Monster Manual - Dungeons & Dragons - Sources - D&D Beyond.pdf",
    "pages": [],
    "section": "Monsters"
  },
  "notes": []
}
