{
  "id": "monster.drider",
  "name": "DRIDER",
  "status": "complete",
  "size_type_alignment": "Large Monstrosity, Chaotic Evil",
  "size": "Large",
  "creature_type": "Monstrosity",
  "alignment": "Chaotic Evil",
  "armor_class": 19,
  "hit_points": 123,
  "hit_dice": "13d10 + 52",
  "speed": "30 ft., Climb 30 ft.",
  "abilities": {
    "STR": {
      "score": 16,
      "mod": "+3"
    },
    "DEX": {
      "score": 19,
      "mod": "+4"
    },
    "CON": {
      "score": 18,
      "mod": "+4"
    },
    "INT": {
      "score": 13,
      "mod": "+1"
    },
    "WIS": {
      "score": 16,
      "mod": "+3"
    },
    "CHA": {
      "score": 12,
      "mod": "+1"
    }
  },
  "saves": null,
  "skills": "Perception +6, Stealth +10",
  "resistances": null,
  "immunities": null,
  "vulnerabilities": null,
  "condition_immunities": null,
  "senses": "Darkvision 120 ft.; Passive Perception 16",
  "languages": "Elvish, Undercommon",
  "cr": "6 (XP 2,300; PB +3)",
  "traits": [
    {
      "name": "Spider Climb",
      "text": "The drider can climb difficult surfaces, including along ceilings, without needing to make an ability check."
    },
    {
      "name": "Sunlight Sensitivity",
      "text": "While in sunlight, the drider has Disadvantage on ability checks and attack rolls."
    },
    {
      "name": "Web Walker",
      "text": "The drider ignores movement restrictions caused by webs, and the drider knows the location of any other creature in contact with the same web."
    }
  ],
  "actions": [
    {
      "name": "Multiattack",
      "text": "The drider makes three attacks, using Foreleg or Poison Burst in any combination."
    },
    {
      "name": "Foreleg",
      "text": "Melee Attack Roll: +7, reach 10 ft. Hit: 13 (2d8 + 4) Piercing damage."
    },
    {
      "name": "Poison Burst",
      "text": "Ranged Attack Roll: +6, range 120 ft. Hit: 13 (3d6 + 3) Poison damage."
    }
  ],
  "bonus_actions": [
    {
      "name": "Magic of the Spider Queen (Recharge 5-6)",
      "text": "The drider casts Darkness, Faerie Fire, or Web, requiring no Material components and using Wisdom as the spellcasting ability (spell save DC 14)."
    }
  ],
  "reactions": [],
  "legendary_actions": [],
  "lair_actions": [],
  "regional_effects": [],
  "raw_text": "AC 19 \tInitiative +4 (14)\nHP 123 (13d10 + 52)\nSpeed 30 ft., Climb 30 ft.\nMOD \tSAVE\nSTR \t16 \t+3 \t+3\nDEX \t19 \t+4 \t+4\nCON \t18 \t+4 \t+4\nMOD \tSAVE\nINT \t13 \t+1 \t+1\nWIS \t16 \t+3 \t+3\nCHA \t12 \t+1 \t+1\nSkills Perception +6, Stealth +10\nLarge Monstrosity, Chaotic Evil\nDruid\nSteward and Sage of Nature\nHabitat: Any; Treasure: Individual, Relics\nDruids use primal magic, traditional teachings, and bonds with animals and eldritch beings to guard the natural world and heal its ills. These magic-users\nmight be recluses devoted to a particular land, or they might be part of a mystic organization. Roll on or choose a result from the Druidic Traditions table to\ninspire a druid’s magical practices.\nDruid Traditions\n1d6 \tThe Druid Is...\n1 \tAn avenger who strikes against destructive civilizations and those who abuse nature.\n2 \tA guide who aids travelers in navigating the realms of Beasts, Fey, or Plants.\n3 \tA hermit who works alone to protect the lands, seas, or skies they call home.\n4 \tA mender who travels the world healing natural, magical, or manufactured disasters.\nSenses Darkvision 120 ft.; Passive Perception 16\nLanguages Elvish, Undercommon\nCR 6 (XP 2,300; PB +3)\nTraits\nSpider Climb. The drider can climb difficult surfaces, including along ceilings,\nwithout needing to make an ability check.\nSunlight Sensitivity. While in sunlight, the drider has Disadvantage on ability\nchecks and attack rolls.\nWeb Walker. The drider ignores movement restrictions caused by webs,\nand the drider knows the location of any other creature in contact with the\nsame web.\nActions\nMultiattack. The drider makes three attacks, using Foreleg or Poison Burst in\nany combination.\nForeleg. Melee Attack Roll: +7, reach 10 ft.\nHit: 13 (2d8 + 4) Piercing damage.\nPoison Burst. Ranged Attack Roll: +6, range 120 ft.\nHit: 13 (3d6 + 3)\nPoison damage.\nBonus Actions\nMagic of the Spider Queen (Recharge 5–6). The drider casts\nDarkness,\nFaerie\nFire, or\nWeb, requiring no Material components and using Wisdom as the\nspellcasting ability (spell save DC 14).\n1d6 \tThe Druid Is...\n5 \tPart of a loose organization that adheres to timeless rituals and guards natural secrets.\n6 \tA warden who minds the underpinnings of reality and protects against extraplanar threats.\nDryad\nTree-Bound Guardian of Nature\nHabitat: Forest; Treasure: Any",
  "sourceRef": {
    "file": "docs/sources/Monster Manual/Monsters (D) - Monster Manual - Dungeons & Dragons - Sources - D&D Beyond.pdf",
    "pages": [],
    "section": "Monsters"
  },
  "notes": []
}
