{
  "id": "monster.bandit_crime_lord",
  "name": "BANDIT CRIME LORD",
  "status": "complete",
  "size_type_alignment": "Medium or Small Humanoid, Neutral",
  "size": "Medium",
  "creature_type": "Humanoid",
  "alignment": "Neutral",
  "armor_class": 17,
  "hit_points": 169,
  "hit_dice": "26d8 + 52",
  "speed": "30 ft.",
  "abilities": {
    "STR": {
      "score": 10,
      "mod": "+0"
    },
    "DEX": {
      "score": 20,
      "mod": "+5"
    },
    "CON": {
      "score": 14,
      "mod": "+2"
    },
    "INT": {
      "score": 18,
      "mod": "+4"
    },
    "WIS": {
      "score": 14,
      "mod": "+2"
    },
    "CHA": {
      "score": 15,
      "mod": "+2"
    }
  },
  "saves": null,
  "skills": "Acrobatics +9, Perception +10, Stealth +13",
  "resistances": null,
  "immunities": null,
  "vulnerabilities": null,
  "condition_immunities": null,
  "senses": "Passive Perception 20",
  "languages": "Common, Thieves’ Cant",
  "cr": "11 (XP 7,200; PB +4)",
  "traits": [
    {
      "name": "Evasion",
      "text": "If the bandit is subjected to an effect that allows it to make a Dexterity saving throw to take only half damage, the bandit instead takes no damage if it succeeds on the save and only half damage if it fails. It can't use this trait if it has the Incapacitated condition."
    }
  ],
  "actions": [
    {
      "name": "Multiattack",
      "text": "The bandit makes three attacks, using Scimitar or Pistol in any combination."
    },
    {
      "name": "Scimitar",
      "text": "Melee Attack Roll: +9, reach 5 ft. Hit: 12 (2d6 + 5) Slashing damage plus 14 (4d6) Poison damage."
    },
    {
      "name": "Pistol",
      "text": "Ranged Attack Roll: +9, range 30/90 ft. Hit: 10 (1d10 + 5) Piercing damage plus 14 (4d6) Poison damage."
    }
  ],
  "bonus_actions": [
    {
      "name": "Deadly Aim",
      "text": "The bandit gives itself Advantage on the next attack roll it makes during the current turn. If that attack hits, the target takes an extra 28 (8d6) Poison damage. Heralds of doom and plagues on the living, banshees are spirits obsessed by unresolved bitterness or sorrow. These storied phantoms slay any who glimpse them or hear their baleful wails. Although any tormented soul can arise as a banshee, some elven communities particularly fear them and believe that those who hoard or destroy beauty-natural or otherwise-risk returning as a banshee."
    },
    {
      "name": "All manner of torments might give rise to a banshee",
      "text": "Roll on or choose a result from the Banshee Sorrows table to inspire how a banshee's torment influences its behavior. Banshee Sorrows 1d6 \tTorment Compels the Banshee To... 1 \tAppear prior to a family member's death. 2 \tHaunt the site where it was executed. 3 \tLament a lost love and haunt their grave. 4 \tPresage a disaster or tragedy. 5 \tSeek the return of a stolen treasure. 6 \tSlay those more beautiful than it was in life. Barbed Devil"
    }
  ],
  "reactions": [],
  "legendary_actions": [],
  "lair_actions": [],
  "regional_effects": [],
  "raw_text": "AC 17 \tInitiative +9 (19)\nHP 169 (26d8 + 52)\nSpeed 30 ft.\nMOD \tSAVE\nSTR \t10 \t+0 \t+0\nDEX \t20 \t+5 \t+9\nCON \t14 \t+2 \t+6\nMOD \tSAVE\nINT \t18 \t+4 \t+4\nWIS \t14 \t+2 \t+2\nCHA \t15 \t+2 \t+2\nSkills Acrobatics +9, Perception +10, Stealth +13\nGear Pistols (2), Scimitar, Studded Leather Armor\nSenses Passive Perception 20\nLanguages Common, Thieves’ Cant\nCR 11 (XP 7,200; PB +4)\nTraits\nEvasion. If the bandit is subjected to an effect that allows it to make a\nDexterity saving throw to take only half damage, the bandit instead takes no\ndamage if it succeeds on the save and only half damage if it fails. It can’t use\nthis trait if it has the Incapacitated condition.\nActions\nMultiattack. The bandit makes three attacks, using Scimitar or Pistol in\nany combination.\nScimitar. Melee Attack Roll: +9, reach 5 ft.\nHit: 12 (2d6 + 5) Slashing damage\nplus 14 (4d6) Poison damage.\nPistol. Ranged Attack Roll: +9, range 30/90 ft.\nHit: 10 (1d10 + 5) Piercing\ndamage plus 14 (4d6) Poison damage.\nBonus Actions\nDeadly Aim. The bandit gives itself Advantage on the next attack roll it makes\nduring the current turn. If that attack hits, the target takes an extra 28 (8d6)\nPoison damage.\nMedium or Small Humanoid, Neutral\nHeralds of doom and plagues on the living, banshees are spirits obsessed by\nunresolved bitterness or sorrow. These storied phantoms slay any who glimpse\nthem or hear their baleful wails. Although any tormented soul can arise as a\nbanshee, some elven communities particularly fear them and believe that those\nwho hoard or destroy beauty—natural or otherwise—risk returning as a banshee.\nAll manner of torments might give rise to a banshee. Roll on or choose a result\nfrom the Banshee Sorrows table to inspire how a banshee’s torment influences its\nbehavior.\nBanshee Sorrows\n1d6 \tTorment Compels the Banshee To...\n1 \tAppear prior to a family member’s death.\n2 \tHaunt the site where it was executed.\n3 \tLament a lost love and haunt their grave.\n4 \tPresage a disaster or tragedy.\n5 \tSeek the return of a stolen treasure.\n6 \tSlay those more beautiful than it was in life.\nBarbed Devil\nDevil of Greed and Obsession\nHabitat: Planar (Nine Hells); Treasure: Any",
  "sourceRef": {
    "file": "docs/sources/Monster Manual/Monsters (B) - Monster Manual - Dungeons & Dragons - Sources - D&D Beyond.pdf",
    "pages": [],
    "section": "Monsters"
  },
  "notes": []
}
