{
  "id": "monster.kuo_toa",
  "name": "KUO-TOA",
  "status": "complete",
  "size_type_alignment": "Medium Aberration, Neutral Evil",
  "size": "Medium",
  "creature_type": "Aberration",
  "alignment": "Neutral Evil",
  "armor_class": 13,
  "hit_points": 18,
  "hit_dice": "4d8",
  "speed": "30 ft., Swim 30 ft.",
  "abilities": {
    "STR": {
      "score": 13,
      "mod": "+1"
    },
    "DEX": {
      "score": 10,
      "mod": "+0"
    },
    "CON": {
      "score": 11,
      "mod": "+0"
    },
    "INT": {
      "score": 11,
      "mod": "+0"
    },
    "WIS": {
      "score": 10,
      "mod": "+0"
    },
    "CHA": {
      "score": 8,
      "mod": "-1"
    }
  },
  "saves": null,
  "skills": "Perception +4",
  "resistances": null,
  "immunities": null,
  "vulnerabilities": null,
  "condition_immunities": null,
  "senses": "Darkvision 120 ft., Truesight 30 ft.; Passive Perception 14",
  "languages": "Undercommon",
  "cr": "1/4 (XP 50; PB +2)",
  "traits": [
    {
      "name": "Amphibious",
      "text": "The kuo-toa can breathe air and water."
    },
    {
      "name": "Sunlight Sensitivity",
      "text": "While in sunlight, the kuo-toa has Disadvantage on ability checks and attack rolls."
    }
  ],
  "actions": [
    {
      "name": "Spear",
      "text": "Melee or Ranged Attack Roll: +3, reach 5 ft. or range 20/60 ft. Hit: 5 (1d8 + 1) Piercing damage."
    },
    {
      "name": "Sticky Net (1/Day)",
      "text": "Dexterity Saving Throw: DC 10, one Large or smaller creature the kuo-toa can see within 15 feet. Failure: The target has the Restrained condition until the net is destroyed (AC 10; HP 5; Immunity to Bludgeoning, Poison, and Psychic damage). A creature can take an action to make a DC 10 Strength (Athletics) check to free itself or another creature in a net within 5 feet, destroying the net on a success."
    }
  ],
  "bonus_actions": [],
  "reactions": [
    {
      "name": "Sticky Shield",
      "text": "Trigger: A creature misses the kuo-toa with a melee attack roll using a weapon. Response-Strength Saving Throw: DC 11, the triggering creature. Failure: The attack's weapon sticks to the kuo-toa's shield. If the target doesn't let go of the weapon, the target has the Grappled condition while the weapon is stuck (escape DC 11). While stuck, the weapon can't be used. The target can take an action to make a DC 11 Strength (Athletics) check, freeing the weapon on a success."
    }
  ],
  "legendary_actions": [],
  "lair_actions": [],
  "regional_effects": [],
  "raw_text": "AC 13 \tInitiative +0 (10)\nHP 18 (4d8)\nSpeed 30 ft., Swim 30 ft.\nMOD \tSAVE\nSTR \t13 \t+1 \t+1\nDEX \t10 \t+0 \t+0\nCON \t11 \t+0 \t+0\nMOD \tSAVE\nINT \t11 \t+0 \t+0\nWIS \t10 \t+0 \t+0\nCHA \t8 \t−1 \t−1\nSkills Perception +4\nGear Spear\nSenses Darkvision 120 ft., Truesight 30 ft.; Passive Perception 14\nLanguages Undercommon\nCR 1/4 (XP 50; PB +2)\nTraits\nAmphibious. The kuo-toa can breathe air and water.\nSunlight Sensitivity. While in sunlight, the kuo-toa has Disadvantage on ability\nchecks and attack rolls.\nActions\nSpear. Melee or Ranged Attack Roll: +3, reach 5 ft. or range 20/60 ft.\nHit: 5 (1d8\n+ 1) Piercing damage.\nSticky Net (1/Day). Dexterity Saving Throw: DC 10, one Large or smaller\ncreature the kuo-toa can see within 15 feet.\nFailure: The target has the\nRestrained condition until the net is destroyed (AC 10; HP 5; Immunity to\nBludgeoning, Poison, and Psychic damage). A creature can take an action to\nmake a DC 10 Strength (Athletics) check to free itself or another creature in a\nnet within 5 feet, destroying the net on a success.\nReactions\nSticky Shield. Trigger: A creature misses the kuo-toa with a melee attack roll\nusing a weapon.\nResponse—Strength Saving Throw: DC 11, the triggering\ncreature.\nFailure: The attack’s weapon sticks to the kuo-toa’s shield. If the\ntarget doesn’t let go of the weapon, the target has the Grappled condition while\nthe weapon is stuck (escape DC 11). While stuck, the weapon can’t be used.\nThe target can take an action to make a DC 11 Strength (Athletics) check,\nfreeing the weapon on a success.\nMedium Aberration, Neutral Evil",
  "sourceRef": {
    "file": "docs/sources/Monster Manual/Monsters (K) - Monster Manual - Dungeons & Dragons - Sources - D&D Beyond.pdf",
    "pages": [],
    "section": "Monsters"
  },
  "notes": []
}
